Date,full_text,retweet_count
2021-11-06,MSFT 2021 11 05 CLOSE PRICE 336 059998 msft,0
2021-11-06,when will artificial intelligence make it to my Windows and tell me which file i need to open now AI MSFT,3
2021-11-06,And register using code ConnectWithIngram for discounted tickets DynamicsCon DynamicsConLive California Anaheim usa MSDyn365 dynamics365 businessapplications microsoft bizapps msft msftadvocate microsoftadvocate,0
2021-11-06,Learn HowTo copy amp Paste From Excel to a sharepoint list microsoft microsoft365 microsoftexcel tutorial learn YouTube Tweet youtube Shorts friday productivity productivitytips MSFT MicrosoftTeams,2
2021-11-07,He gave me new life shop bch ftx flm bmon rari bnb zrx fis emb labra fubo baba cream celo invest xrp hbar grt rune safemoon sol amc pltn xla ba msft om eth iota dis bal ilus miota bnb audio kebab nike miota spce fcel biol,0
2021-11-07,Ditching costly msft licensing in exchange for the most resilient cloud platform just became easier,0
2021-11-07,MSFT update n1 en MarketCap x 2da semana consecutiva EEUU tecnologia Microsoft research,0
2021-11-07,Market traders use the weekend and head to the TRICKTRADES Youtube channel actual professional market education you can apply to your trading SPY QQQ AAPL FB TSLA AMD TWTR MU AMZN MSFT GOOGL Stock Market,1
2021-11-08,MSFT could come down near 328 as it ended the day with a dark cloud candlestick and also it cannot stay away from SMA 10 MSFT SwingTrading,1
2021-11-08,Sign of weakness and correction MSFT chart on,0
2021-11-08,Microsoft Ignite Fall 2021 Innovations coming to Microsoft Teams MSFT Microsoft Teams MicrosoftTeams Ignite MicrosoftIgnite,0
2021-11-08,MSFT b profile today showing some selling but we need to focus on 334 07 If we can t break that level then the shorts are still trapped under it from the move up You can see them front running the cover already,1
2021-11-08,Wave 2 Trade Update in TTD We took this amazing long opportunity in the Discord group last week and the result is here today with a nice 26 pump Join us algotrading NDX SPX MSFT APPL AMZN GOOG GOOGL FB AMD NVDA SMH XLK JPM M,0
2021-11-08,With 2022 approaching enterprise customers must prepare for Microsoft s price increases Join Mansfield in this webinar for a deep dive into the increases MSFT s motivation behind them amp tips for overcoming them in your renewal Register here,2
2021-11-08,Market Cycle Top BTC flips MSFT amp AAPL Market Cap Euphoria over the moon We drop Remember this Bitcoin Microsoft Apple,1
2021-11-08,btc juld qsi xlm wbtc chainlink vtho pinu ez comp msft sushi shibainu kishimoto jspr twitter rsr jupw save nft hyzn hoge gtc btg cspr yukon visl klee mth uft xlm gldn vmcs qcom ada jpaw ogn joe locg bzrx play usei humbl ray xbi drep,0
2021-11-08,Microsoft makes Visual Studio 2022 and NET 6 generally available MSFT Microsoft VisualStudio Update,0
2021-11-08,Canva the ultimate productivity Design with Canva straight from your desktop on Windows 11,23
2021-11-08,uft ogen xeta epik flow ice ersdl nwc hot doggy grs amtx elon gvsi rdd lit enj kuma ped ionq news trmd hood aph sushi shiba akita oxbr idex trx gvt kin gold msft tlm eeenf cris icon tru usdc fsr open aapl dai any yala,1
2021-11-08,CLEAR announces partnership with Microsoft for Azure Active Directory for Verifiable Credentials via msft ITpro AAD,0
2021-11-08,The House passed a bipartisan 1T infrastructure bill to send to Biden s office as soon as this week What tickers stand to win the most if it passes Popular in Gatsby SPY AAPL TSLA AMD NVDA IWM AMC FB F LCID RIOT NIO DIS MSFT ROKU AMZN NotInvestmentAdvice,0
2021-11-08,aapl if it can break 153 17 is should go to 160 this month BB bbby koss gme tsla lcid bbig any wkey mmat leds phun dwac amc btc shiba doge,0
2021-11-08,MARKETS MOVE HIGHER IN PRE MARKET TRADING STOCK MARKETS IN PLAIN ENGLISH WITH UNCLE BRUCE SPIREGLOBAL SOFI GME RKLB amc atip mttr me smrt SPIR cyxt NASDAQ Covid 19 Crypto OptionsTrading ShortSqueeze APPLE GS IBM MSFT 23ANDME,2
2021-11-08,MSFT MSFT Daytrading,0
2021-11-08,New Microsoft Teams Feature to Make Collaboration Even Easier MSFT Microsoft Teams MicrosoftTeams RemoteWork,0
2021-11-08,MSFT 4hr update from 10 28 update presented to members at elliottwave trading stocks,0
2021-11-08,gt Perfect rally from the blue box very technical Join us today with 14 day Trial and learn to trade the Technical market and blue boxes Click here Elliottwave Microsoft MSFT Stocks AMD AMZN AAPL NVDA Trading,0
2021-11-08,The Best Windows11 Utilities to Install Now via msft ITpro sysadmin,0
2021-11-08,american airlines xiaojun facebook stx phun saitama mana ultraslan acb hot dai best uefa tlry rai haiti jon snow msft pax newamsterdam jared leto penn ajax genshinimpact reddit dbuy luna ilus digitalart sergio ramos forza horizon 5 xtz req xsr,0
2021-11-08,Closed Buy 3 33 Lots MSFT O 327 16 for 812 0 pips total for today 1191 0 pips stocks Trade at your own risk,0
2021-11-08,AAPL MSFT You Ask We Analyze Why Apple Stock Could Be Set For A Blue Sky Run,0
2021-11-09,MSFT likely basing after a fat run and a breakout above uptrend resistance for another big move if we break out of box and rally into EOY tech msft qqq,1
2021-11-09,GME SHARES RISE AS AMC FALLS GE TO SPLIT INTO 3 STOCK MARKETS IN PLAIN ENGLISH WITH UNCLE BRUCE SPIREGLOBAL SOFI GME RKLB amc atip mttr me smrt SPIR cyxt NASDAQ Covid 19 Crypto OptionsTrading ShortSqueeze APPLE GS IBM MSFT 23ANDME,3
2021-11-09,Microsoft Teams now lets users open new chats in a separate window MSFT Microsoft Teams MicrosoftTeams,0
2021-11-09,Revenue for the full year is expected to come in about 1 53 billion or 40 year over year growth the company said Palantir also reaffirmed that it expects annual revenue growth of 30 or more through 2025 PLTR SNOW GOOGL MSFT AMZN SPLK,0
2021-11-09,Texas Instruments Elliottwave Analysis Please like and share if you appreciate this chart algotrading NDX SPX MSFT APPL AMZN GOOG GOOGL FB AMD NVDA SMH XLK JPM M PG UNH INTC TXN,0
2021-11-09,Microsoft Teams is finally getting the update you ve all been waiting for URL collaboration Microsoft MicrosoftTeams MicrosoftTeamsConnect MSFT Updates,1
2021-11-09,The latest trend in tech is the Metaverse Welcome to the virtual world Meta StocksToBuy StockMarket nvda RBLX shop microsoft msft fsly,1
2021-11-09,It is 100 inevitable that bitcoin overtakes aapl msft in market cap It s a mathematical certainty darrenTEED,0
2021-11-09,Top 10 most profitable public companies this year aapl 2222sr brk a goog msft sftbf pngay fb tm 005930ks,0
2021-11-09,MSFT Put MSFT MSFT,0
2021-11-09,Who will be the killer platform ama Zon aws Msft azure google cloud or,0
2021-11-09,This is a device that can be repaired Do More like this MSFT SurfaceSE,0
2021-11-09,Microsoft is bringing more Power Platform to Teams MSFT Microsoft Teams MicrosoftTeams PowerPlatform,0
2021-11-09,2 25 this can t be a fuck up amd fb mmat mvrs goog amzn MSFT Ahhhhh,1
2021-11-09,An expensive acquisition target on the horizon MSFT v NASDAQ,0
2021-11-09,With Mesh for Teams Microsoft plans to bring 3D workspaces to remote workers in 2022 MSFT Microsoft Teams MicrosoftTeams Mesh 3DWorkspace,1
2021-11-09,Our METAVERSE Studio is going to be an AMAZING NEW revenue generating addition to our business Especially EXCITED that its a SaaS platform The LAUNCH is sooner than you think early 2022 Metaverse NTAR NEXCF,8
2021-11-09,Support your RightToRepair in Michigan Write a letter to your state rep here,1
2021-11-09,Microsoft s legal department is dedicated to giving back and I m proud to share the 2021 Pro Bono Report highlighting the partnership between volunteers and partners working every day to close the gap in legal services probono,7
2021-11-09,Ups and down are part of the game but don t loose control of the game If you cannot handle then don t even try to come to the business of stocks Imean it Im not gonna sell even 10 of my NVIDIA TSLA MSFT amp Coinbase,0
2021-11-09,November 9 2021 MSFT PatchTuesday B Get CumulativeUpdate s for Windows 11 Version 21H2 Windows 10 Ver 1507 1607 1809 1909 2004 20H1 20H2 21H1 21H2 and Windows Server 2016 2019 2022 LTSC SAC 20H1 20H2 on MicrosoftUpdateCatalog,10
2021-11-09,Selling my meme coins and investing into FORD and MSFT was the best thing I could ever do Invest your money y all it s free money if you re smart ford msft,0
2021-11-10,MSFT MSFT looking for a break on the 4h time frame Williams R is looking good for a bottom and price is bouncing of the 20 day ema sma,1
2021-11-10,Been playing with options not recommended for everyone bought 1 MSFT call Then msft dropped and allowed me to average down substantially If Microsoft bounces back to yesterday s price this will be a very profitable play Will update on this play later this week,0
2021-11-10,TSLA has started its descent MSFT is the next one it s part of the DOW30 so the markets will feel it TSLA MSFT TSLA MSFT,1
2021-11-10,After the huge success of Quiz 4 we re all set with Quiz 5 Set your reminders amp take your game to the next level Register here KonfHub CloudQuiz MSFT Azure kubernetes k8s,3
2021-11-10,So H T to Patrick William Joyce for highlighting meta teams msft,0
2021-11-10,SOFI AND SPIR EARNINGS TODAY AFTER THE CLOSE TRADING STOCK IN PLAIN ENGLISH WITH UNCLE BRUCE SPIREGLOBAL SOFI GME RKLB amc atip mttr me smrt SPIR cyxt NASDAQ Covid 19 Crypto OptionsTrading ShortSqueeze APPLE GS IBM MSFT 23ANDME,3
2021-11-10,Become a MSFT LIANA for JadenSmith s brand x AW21 Collection See more of Liana here jadoremodels jadorefam model inclusive photoshoot jadensmith msftrep msft selfridges,0
2021-11-10,Learn best practices around setting up Azure Kubernetes Services Attend this exciting session by Yusuf Rangwala on How to make best use of AKS for your Cloud Native Applications Date 17th November 2021 Time 5 PM IST Register here MSFT Azure,0
2021-11-10,Immutable storage for Blob Storage is now generally available and the best part is Immutable storage with versioning policies and legal holds are free of charge Storage usage and transactions will be billed as normal storage data azure msft,2
2021-11-10,Inviting techies to participate in Cloud Quizzing Challenge Visit here to know more KonfHub CloudQuiz MSFT Azure kubernetes k8s,2
2021-11-10,Microsoft Ignite 2021 Cloud the Metaverse and More Cross Company Capabilities MSFT Microsoft Ignire Cloud Metaverse,1
2021-11-10,L amp T Technology Services partners with Microsoft to offer IIoT based smart manufacturing solutions LandTTechnologyServicesLimited INE010V01017 LTTS Agreement Microsoft MSFT MicrosoftAzure,0
2021-11-10,Microsoft Teams meetings are coming to Meta s Workplace MSFT Microsoft Teams MicrosoftTeams Meta TeamsMeeting,0
2021-11-10,NEXCF Awesome nextech is the underdog compared to FB META AMZN MSFT but I believe it will come up on top as its focused on the AR VR and Meta being a first mover,0
2021-11-10,The best of gifts are here AAPL TSLA MSFT AMZN FB SNAP TWTTR PLAY FSR WISH CLOV NAKD SNDL AMC BB AAL LABRA BABA PLTN yea BA F HYLN RIDE NIO CCIV ok LI PLUG FCEL RCON TLRY ACB EBON SOS MARA RIOT CAN ORCL DKNG PENN NEGG SPCE SGOC HG,0
2021-11-10,Powered by AI our new digital archiving project Common Grounds Ancient Olympia allows anyone around the world to walk the streets of the ancient city and explore our common past CulturalHeritage MSFT,1
2021-11-10,If you re at Come to the fun booth for some fun laughter and great people and me So happy events are back on let s have fun DynamicsCon DynamicsConLive msdyn365 dynamics365 microsoftpartnernetwork msft microsoft msftadvocate ingrammicrocloud,1
2021-11-10,Finally got myself outside today and oh my the weather is amazing Such a great location for this Live event DynamicsCon DynamicsConLive California Anaheim usa microsoft msft msdyn365bc msdyn365 msftadvocate dynamics365,0
2021-11-10,MSFT thisdayinmarkethistory This Day In Market History Microsoft Introduces Windows Operating System,1
2021-11-10,Can anyone tell me why Microsoft Insights diagnosticSettings isn t available in Azure Resource Graph Anyone Seems like a massive oversight to me msft azure azurecloud ARM,2
2021-11-10,November 10 2021 MSFT rolls out NEW Windows 11 Version DEV 22H2 InsiderPreviewBuild 22499 1000 rs prerelease is NOW available in the DevChannel lt gt ActiveDevelopmentBranch Dev builds are also not matched to a specific release,2
2021-11-11,WATCH WE RECAP STOCKS INDEXES SECTORS FANNG INVESTING TRADING BEST Trading Trade Stocks TECHNOLGY BigTech FAANG AAPL MSFT AMZN FB GOOG TSLA NVDA NFLX BABA The SP50011 SECTORS XLK XLV XLF XLY XLC XLI XLP XLE XLU XLRE XLB,0
2021-11-11,Windows11 is making it easier to share your screen in and other video calls via msTeams ITpro sysadmin msft,0
2021-11-11,Most Possible scenario for Microsoft in the next few days MSFT chart on,1
2021-11-11,10 Stocks With Strong Media Sentiment in November 2021 MSFT MSFT stockstowatch marketsentiment stockstoby,0
2021-11-11,The best of gifts are here AAPL TSLA MSFT AMZN FB SNAP TWTTR PLAY FSR WISH CLOV NAKD SNDL AMC BB AAL LABRA BABA PLTN yea BA F HYLN RIDE NIO CCIV ok LI PLUG FCEL RCON TLRY ACB EBON SOS MARA RIOT CAN ORCL DKNG PENN NEGG SPCE SGOC HG,0
2021-11-11,Facebook plays catch up in the enterprise space by jumping on MSFT Teams,0
2021-11-11,SPY seems to be following MSFT as a market leader Might want to fasten those seat belts when this dip is complete SPY MSFT J,1
2021-11-11,MSFT pioneered community programs with Microsoft MVP amp Student Ambassador all the way back in 90s 20s and everyone now is almost emulating those programs,0
2021-11-11,Deposit OptionsTrade Withdraw Initial Investment Play Options without Risk Got it options nvda tsla RIVN MSFT NIO Riot OptionsTrading Trader investing,0
2021-11-11,Set your reminders amp do last minute prep Quiz 5 is less than a day away You could be on your way to win X boxes amp more Take the quiz here KonfHub CloudQuiz MSFT Azure kubernetes k8s,1
2021-11-11,Facebook pushes its Workplace software with new Microsoft Teams integration MSFT Microsoft Teams MicrosoftTeams Workplace,1
2021-11-11,MSFT MSFT 10d 12 996 TradingView,0
2021-11-11,SOFI BEAT ON ALL METRICS STOCK SURGES TRADING STOCK MARKETS IN PLAIN ENGLISH WITH UNCLE BRUCE SPIREGLOBAL SOFI GME RKLB amc atip mttr me smrt SPIR cyxt NASDAQ Covid 19 Crypto OptionsTrading ShortSqueeze APPLE GS IBM MSFT 23ANDME,3
2021-11-11,OnePlus Student Ambassador Program 2021 25 ambassadors selected from 24000 applications,2
2021-11-11,Perhaps Google Wave was too early Co create in realtime with Microsoft Loop loop msft productivity collaborate teams,0
2021-11-12,Windows 11 is making it easier to share your screen in Teams and other video calls MSFT Microsoft Teams MicrosoftTeams Windows11,1
2021-11-12,This week marks the 1st yr anniversary of my time as a MSFT employee Here is what I think so far Microsoft,1
2021-11-12,Working as part of the legal profession is at its core an endeavor of service Probono is how we strive to live our ideals and principles It s humbling to be in an organization with this kind of commitment and impact a collective effort of truly wonderful humans at MSFT,0
2021-11-12,AAPL MSFT Here s How Much Investing 1 000 In The Invesco QQQ ETF One Year Ago World Be Worth Today,0
2021-11-12,I didn t know msft had learnings on blockchain,0
2021-11-12,Check out my MSFT analysis on,0
2021-11-12,Had to buy Maeva her first T shirt LosAngeles Hollywood California usa DynamicsCon DynamicsConLive msdyn365 dynamics365 microsoftpartnernetwork msft microsoft msftadvocate microsoftadvocate travel,1
2021-11-12,The avg person is Soft willed Out of shape Lazy Addicted Insecure Avoid all 5 and you re guaranteed to be successful,379
2021-11-12,MSFT New Technical Analysis Invest commission free in the UK amp EU with Freetrade and claim a free stock Stocks Markets Trading TechnicalAnalysis,0
2021-11-12,ZS DOCU TSLA APPL UBER LYFT FB PANW SAIL CYBR PYPL SQ COIN MSFT In this exclusive Voice of Wall Street interview super smart US investor Managing Director at runs me through,6
2021-11-12,We re all set to go live It s a Kubernetes oriented challenge of the fastest amp the most skilled techies Many more quizzes are coming your way Play now KonfHub MSFT Azure CloudQuiz kubernetes K8s,6
2021-11-12,Well hello there Cool time in team meeting at the office in Munich M nchen DE MUC MSFT Microsoft,0
2021-11-12,So I usually watch the meme stocks Decided to jump on SNDL before earnings Was happy to take my 425 profit this morning Wasn t expecting such a nice return but hey no complaints Now my MSFT needs to do the same haha optionstrading daytrading realizedgains msft,0
2021-11-13,It takes a special kind of individual to unfollow you simply because MSFT has finally given reasons to comment positively on a piece of hardware software XboxSeriesX you may or may not have invested 500 500 into Not really my kind of people PS5,1
2021-11-13,The best of gifts are here AAPL TSLA MSFT AMZN FB SNAP TWTTR PLAY FSR WISH CLOV NAKD SNDL AMC BB AAL LABRA BABA PLTN yea BA F HYLN RIDE NIO CCIV ok LI PLUG FCEL RCON TLRY ACB EBON SOS MARA RIOT CAN ORCL DKNG PENN NEGG SPCE SGOC HG,0
2021-11-13,MSFT 2021 11 12 CLOSE PRICE 336 720001 msft,0
2021-11-13,Never liked PCs amp this issue doesn t help All my son wants to do is play the 27 version of Minecraft After buying installing it won t work Tried uninstalling upgrading Java etc Nothing except a sad son amp upset dad pcsstink techsupport needhelp windows mojang MSFT,1
2021-11-13,The avg investor doesn t have A rich spouse A cushy govt job Direct influence over companies they invest in The ear of every big tech CEO 100M net worth Do these 5 things and you are guaranteed to succeed in investing investing tesla msft Apple,1
2021-11-14,New post An Update FAANG MSFT ETSY TSLA AnirudhSethi has been published on Financial Occultist,1
2021-11-14,Time to reach 1 trillion value BTC Bitcoin 12 years FB Facebook 17 years TSLA Tesla 18 years GOOGL Google 21 years AMZN Amazon 24 years APPL Apple 42 years MSFT Microsoft 44 years What s next,7
2021-11-14,How to Enable or Turn off HDR on Xbox Series X S HDR Settings XboxSeriesX hdr gaming microsoft msft,1
2021-11-14,As of Sunday afternoon 11 14 2021 favorite day trade set ups going into tomorrow are AMZN FB MSFT TSLA,0
2021-11-15,msft hitting new ATH of 339 64 in premarket Will we break 340 today Maybe 342 OptionsTrading premarket stocks msft Daytrade goals StockMarket meta,0
2021-11-15,Happy Monday Very excited to be a Gold Sponsor at this years EdFi Conference in Austin Tx Please come amp visit our booth meet Paul Rodrigues and he looks forward to seeing you at tomorrows MSFT sponsored event Azure Cloud Partnership,2
2021-11-15,WRITING OPTIONS AS STOCKS LOOK TO RISE TODAY MARKETS IN PLAIN ENGLISH WITH UNCLE BRUCE SPIREGLOBAL SOFI GME RKLB amc atip mttr me smrt SPIR cyxt NASDAQ Covid 19 Crypto OptionsTrading ShortSqueeze APPLE GS IBM MSFT 23ANDME,1
2021-11-15,Protech AMS Easy Flexible Complete Meet with us at AMS Fest this week Learn more assnchat assntech assnprofs associationmanagement amsfest microsoft msft ProtechAMS saas technology,1
2021-11-15,The Microsoft Teams Store is getting a newer and cleaner look focus on app discoverability MSFT Microsoft Team MicrosoftTeams,0
2021-11-15,TOMORROW How to Tackle Microsoft s 2022 Price Increases Last chance to register for our webinar where Mansfield takes a deep dive into MSFT s upcoming price increases amp gives tips for overcoming them in your renewal Register here,1
2021-11-15,Microsoft Teams update will eliminate one of the most common remote working problems MSFT Microsoft Teams MicrosoftTeams RemoteWork,1
2021-11-15,The best of gifts are here AAPL TSLA MSFT AMZN FB SNAP TWTTR PLAY FSR WISH CLOV NAKD SNDL AMC BB AAL LABRA BABA PLTN yea BA F HYLN RIDE NIO CCIV ok LI PLUG FCEL RCON TLRY ACB EBON SOS MARA RIOT CAN ORCL DKNG PENN NEGG SPCE SGOC HG,0
2021-11-15,First day conference in Austin TX coming to a end amp what amazing speakers and content Very proud for to be representing at this great event Tomorrow is our MSFT event amp exciting to see you all there Cloud AI,3
2021-11-15,Microsoft MSFT to the Moon Dethroned the King Apple AAPL 5 years from now we may see Tesla dethrone them all TSLA,0
2021-11-15,Microsoft Teams will let users configure activity feed notifications MSFT Microsoft Teams MicrosoftTeams,0
2021-11-15,VERB Digital Revenue Up 30 Digital Revenue Q3 Increased 30 from Q2 Now represents 81 of Total Revenue Up 64 Year over Year SaaS Recurring Revenue up 25 Year over Year amp Up 15 over Q2 Combined Revenue Up More than 21 over Q2 VERB MSFT VERBLIT,1
2021-11-15,Once again i m here with an event as ind which is hands on session on Web development and MLSA program Register now MSFTStudentAmbassador MSFT Microsoft webdevelopment,0
2021-11-15,It s not the best of best set ups but still on watch for MSFT May be a quicker play aka scalp if it does breakout into unknown ATH territory MSFT Microsoft,0
2021-11-16,Staffbase Releases New Integrations to Bring the Best of Internal Comms Tech to Microsoft 365 MSFT Microsoft Teams MicrosoftTeams Microsoft365,1
2021-11-16,Reaching out the the ones I believe have actual functional brains here on Twitter namely and Care to comment on what this can be or you think know it is MSFT LINK QNT OVN,0
2021-11-16,11 16 alerts at WDL QCOM 1 60 gt 3 50 options 118 RBLX 4 00 gt 7 50 options 87 MSFT 1 50 gt 2 25 options 50 HAYW 25 76 gt 27 24 swing 5 75 ALL VALUES AT MAX ABOVE ALL STILL ACTIVE,0
2021-11-16,This is pretty cool news Microsoft launching their Swedish data centers msft Azure,4
2021-11-16,Microsoft to offer more customization on Teams Activity Feed Here s how to configure it MSFT Microsoft Teams MicrosoftTeams RemoteWork,0
2021-11-16,Streamline and Strengthen your Security to become Cyber Smart with Microsoft Security Solutions from DataPros Contact us for your free consultation today MSFT Microsoft Security IT,0
2021-11-16,Interested in getting started on Azure Kubernetes Services Mark the date 17th November tomorrow at 5 PM IST as will be guiding on How to make best use of AKS for your Cloud Native Applications RSVP here Azure MSFT,3
2021-11-16,After the huge success of Quiz 5 we re all set with Quiz 6 Set your reminders amp take your game to the next level Register here KonfHub CloudQuiz MSFT Azure kubernetes k8s,5
2021-11-16,MSFT says Halo Infinite the latest edition of the best selling Xbox alien shooter game will be available starting Nov 15 for multiplayer gaming via,0
2021-11-16,SPIRE GLOBAL SOFI BREAKING NEWS MARKETS IN PLAIN ENGLISH WITH UNCLE BRUCE SPIREGLOBAL SOFI GME RKLB amc atip mttr me smrt SPIR cyxt NASDAQ Covid 19 Crypto OptionsTrading ShortSqueeze APPLE GS IBM MSFT 23ANDME,1
2021-11-16,I was only able to stick around for the first 40 kins of the market I took one play on MSFT short but got stopped out when the Inverse H amp S pattern completed Below is my pic of entry and RR Hope you guys had a great day MSFT,0
2021-11-16,Earnings InvestorBrandNetwork MSFT News Partner Content Microsoft Corporation Climbs to Annual High Share Price,0
2021-11-16,Aloha Traders Updated Elliottwave counts on our Discord platform BTC ETH ETHBTC SPX SPX500 NDX NAS100 WTI oil Gold GLD XAU DXY VIX MSFT AAPL AMZN GOOG FB AMD NVDA TXN COP UUUU Game over for crypto Happy trading,1
2021-11-16,MSFT MSFT intraday o337 10 to help it push highs,0
2021-11-16,partial flashing is only supported by programs built using MakeCode This is because the service requires the user program to be appended onto the end of the DAL something which can t be guaranteed in a C program msft,0
2021-11-16,wow might actually turn on margin and just buy more MSFT stock yall know im a big fan of MSFT,0
2021-11-16,FTD of MSFT in the last 1 year To view more details including T 35 date visit FTD MSFT,0
2021-11-17,We will transition to a new Windows 10 release cadence to align with the Windows 11 cadence targeting annual feature update releases The next Windows 10 feature update is slated for the second half of 2022 MSFT via,0
2021-11-17,How to Invest Long Term and Build A Winning Portfolio MSFT chart on,0
2021-11-17,Important reading and useful guidance about deprecation of basic authentication in ExchangeOnline MSFT Microsoft ModernWork Exchange ExO O365 M365 Office365 Microsoft365 Cloud MicrosoftCloud,0
2021-11-17,MSFT MSFT Edge Browser Integrates Buy Now Pay later with 3rd party Zip previously Quadpay to offer this feature Imagine if GOOG also does its own BNPL with another small 3rd party then what will happen to AFRM KPLT fintech payments BNPL,0
2021-11-17,INSTITUTIONS BUY UP STOCK OF ATIP AND RKLB MARKETS IN PLAIN ENGLISH WITH UNCLE BRUCE SPIREGLOBAL SOFI GME RKLB amc atip mttr me smrt SPIR cyxt NASDAQ Covid 19 Crypto OptionsTrading ShortSqueeze APPLE GS IBM MSFT 23ANDME,3
2021-11-17,See this exciting announcement from MSFT and AT amp T that will advance the future of 5g edge microsoftazure,0
2021-11-17,Any MSFT Microsoft people tips on how to disable Focus Assist by default for Windows11 tried the Quiet Hours approach but doesn t seem to work avd MEM intune,0
2021-11-17,Halo Infinite is rocketing to the top with huge engagement no esp on Steam where it has amassed over 272k players in just 24hr This makes Halo Infinite one of the most played games on Steam and the most popular Xbox game ever released MSFT,0
2021-11-17,MSFT trade working well after inside day breakout Tomorrow msft pays dividends members,0
2021-11-17,Commission from So glad you liked it Go follow and support him commissionsopen MSFT,3
2021-11-17,Day 3 of the amp great keynote to start the day with breakfast amp coffee Looking forward to the breakout sessions later this afternoon amp stop at the MSFT booth and speak with amp team for more information amp follow up Cloud Data,1
2021-11-17,MSFT 15D consolidation channel breakout Plan is to pullback and re test breakout zone within this 336 70 338 50 area where if held successfully should push higher into 345ish zone MSFT,0
