Date,full_text,retweet_count
2019-09-20,Introducing Sketch Notes Our SketchNotes visualize concrete actions that employees and leaders can take to overcome business challenges Sketch Notes are tailored to your organization s needs and include expertly curated reading recommendations gt,2
2021-07-01,Microsoft just reached 2T pushing Steve Ballmer s net worth to 80B Interestingly when Ballmer joined MSFT in 1980 he was employee 30 and received ZERO equity By its IPO in 1986 he owned 8 of MSFT How did Ballmer get that stake A contract quirk Here s the story,685
2021-08-20,msft next long targets 348 34 first 375 76 397 93 420 1 second 451 65 491 85 last,0
2021-08-31,fully exited MSFT Microsoft,0
2021-09-02,This week s article is all about the new features of Dynamics365 FieldService in 2021ReleaseWave2 Lots of new functionality and updates including some updates to functional locations Check it out here msdyn365 msdyn365ce powerplatforms MSFT,1
2021-09-02,MSFT MSFT GLOBAL TradingView,0
2021-09-02,In Microsoft s world cloud email still often requires on premises Exchange Why via msft Exchange email ITpro sysadmin,0
2021-09-02,Microsoft 400 2021 Price Target MSFT chart,1
2021-09-02,Get ready for the new Word Cloud feature coming to Teams MSFT Microsoft Teams MicrosoftTeams Word MicrosoftWord Windows,0
2021-09-02,Microsoft announces its fall Surface event for September 22 MSFT Microsoft Surface MicrosoftSurface,0
2021-09-02,Listened to interviewing Zuck A couple things I found interesting 1 Hear Zuck talk about metavarse and workforce productivity being there with co workers setups feels as if this is targeted to the msft domain Helping make everyone productive,0
2021-09-02,September 2 2021 MSFT push out CumulativeUpdate KB5006050 for Windows 11 Ver 21H2 InsiderPreviewBuild 22000 176 co release svc prod2 210825 1709 in the BetaChannel also making CU available to commercial PCs in the ReleasePreviewChannel,4
2021-09-02,Microsoft Teams just got new breakout room controls and better search MSFT Microsoft Teams MicrosoftTeams,1
2021-09-02,Is there any reason for Microsoft CSPs to even consider customer self service portals Here s a look PowerApps Microsoft lowcode PowerPlatform msft azure dynamics365 linkedin microsoft365,5
2021-09-03,By the way Outlook App on Android doesn t support S MIME Keys bigger than 4096bit RSA Got 8K Keys Crash No problem on iOS though Microsoft365 msft,0
2021-09-03,Microsoft Teams Here are the features added in the past month MSFT Microsoft Teams MicrosoftTeams,1
2021-09-03,A gym analogy for why businesses should be using A short video having a little fun check it out amp see if it makes you smile or look at things differently MSDyn365 Microsoft MSFT IngramMicroCloud D365 Video,1
2021-09-03,Bring the intelligence security and reliability of Azure to your SAP apps Learn how to move your on premises workloads to the cloud with this free guide Apps Cloud MSFT MSFTadvocate RT,0
2021-09-03,Big Ideas Channel AMZN APPL MSFT PLDR Extreme Weather Across the U S is Just a Preview of Global Warming Reality,0
2021-09-03,Exchange servers being hacked by new LockFile ransomware via msft ITpro sysadmin Exchange infosec opsec,0
2021-09-03,How to Enable Super Duper Secure Mode in Microsoft Edge microsoftedge superdupersecuremode msft Windows11 windows10 TechTutorial TechSupport TipsAndTricks HowTo,0
2021-09-03,Windows 11 Microsoft marches toward open platforms MSFT Microsoft Windows11 IT,0
2021-09-03,Ugh 22000 168 has somehow corrupted my Start Menu and I am having trouble recovering Anyone know of any easy fixes WindowsInsider Win11 MSFT,0
2021-09-03,How to earn and win 1000 points with Xbox punch cards xbox xboxone XboxSeriesX microsoft microsoftrewards msft,1
2021-09-03,MSFT MSFT,0
2021-09-03,Researchers cybersecurity agency urge action by Microsoft cloud database users via msft ITpro infosec opsec,2
2021-09-03,Microsoft Teams 7 shortcuts for quick access to basic but important functions MSFT Microsoft Teams MicrosoftTeams ShortCut,1
2021-09-03,If you are here you are profitable me msft pig upin vgac akt jzxn stsa stockstobuy yfii euro2020 news inqd enq cciv pinetwork lem xvg sparta nftcollector dmtk shiba kava hpil edg lrc eth safemoon aph market ubx nflx dogecoin yield stx,0
2021-09-03,Cant wait to see how AI algos run during anything but an uptrend btc crypto ether Ethereum xrm xrp xlm doge amc gme nok bb bbby amzn aapl fb googl nflx snap tsla msft panw spy qqq uco uso sco slv gld sqqq iwm dow dia djia acb tlry,0
2021-09-03,10,0
2021-09-04,I plan on starting to post about finance mainly stocks personal finance possibly crypto Don t worry my Xbox clips will still be here too finance Crypto investing Ethereum aapl msft xbox,0
2021-09-04,Peace and Blessings MSFT CFO Amy Hood sold more than 18 million of shares on Wednesday msft stockstowatch stocks stocksinnews,0
2021-09-04,Want to learn how to email a channel in MicrosoftTeams Check out this tutorial Microsoft Microsoft365 Office365 MSFT MSTeams Remotework MicrosoftEDU YouTube Howto Tutorials SharePoint SharePointOnline email,1
2021-09-05,MSFT remains strong and likely sees 319 320 before a wave 4 pullback Overall I see MSFT hitting 370 s after a decent 6 10 pull back,0
2021-09-06,Want to learn how to restore a deleted file in MicrosoftTeams Check out this tutorial Microsoft Microsoft365 Office365 MSFT MSTeams Remotework MicrosoftEDU YouTube Howto Tutorials SharePoint SharePointOnline,1
2021-09-06,How to Change the Install Location of Microsoft Store Games xbox xboxone XboxSeriesX XboxSeriesS microsoft msft MicrosoftStore,2
2021-09-06,today I hosted my first ever event as MSFTStudentAmbassador it was an awesome experience being ind I spoke about reactjs ReactNative Nodejs MSFT and also demonstrated how to create a simple web app using the react js library Microsoft microsoftteams webdevelopment,3
2021-09-06,Want to learn how to use the history menu in MicrosoftTeams Check out this tutorial on youtube Microsoft MSFT MicrosoftEDU Remotework MSTeams Microsoft365 Office365 Teams PowerAddicts Translated using MicrosoftFlow,1
2021-09-06,MSFT 2021 09 03 CLOSE PRICE 301 140015 msft,0
2021-09-06,MSFT SIGNAL for CLOSE PRICE Prediction for the next 7 Days starting 2021 09 03 msft,0
2021-09-06,MSFT Actionable Signals Day IB Week 2x IB Full Time Frame Continuity is when MSFT is gt 302 87 Bullish gt 302 60 305 19 Bearish lt 300 26 300 18 TheStrat daytrading trading MSFT microsoft technicalanalysis OptionsTrading Watchlist,0
2021-09-06,MSFT Don t let a bad trade make you into a long term investor It took 17 years for MSFT to reclaim dot com bubble highs,20
2021-09-06,trading stocks finance Dark msft Darktrace continues to trade higher Using AI to reduce cyber threats to business Straight into the FTSE 250 tracker indexes purchasing Key partnerships with Microsoft,1
2021-09-07,Are you to Azure ML amp IoT If yes then here you go Learn the fundamentals of Azure ML with Azure IoT by Saravanan on 11th September 2021 10 30 am onwards RSVP here for AzureDevIndia Azure MSFT,4
2021-09-07,PRSM earlier 1283 closed yday 1228 systematica are stuck short they hv about 1 to cover BARC latest institutional buyer has taken a holding last few days has others hv a deal looks on 2000 PEGA PATH and automationanywhere MSFT any1 of them could make a bid all same field,0
2021-09-07,AAPL with a strong move trading at the top of its channel make or break for the next week AAPL SPY QQQ MSFT NASDAQ,0
2021-09-07,today and I received our MVP award kit thank you msft and mvpbuzz azure microsoft365 officedev,2
2021-09-07,Microsoft joins Open Infrastructure Foundation MSFT Microsoft Infrastructure,0
2021-09-07,AMD 115 at least please or i will turn gay AAPL TSLA ROKU AMZN SNAP SQ CLOV AMC,0
2021-09-07,Why in the name of SAVING OUR PLANET is donating to climate denying Rs and their PACs Shame on you MSFT,0
2021-09-07,AAPL AMD MSFT Three stocks to watch tomorrow for more upside I provide levels and targets for each trading,0
2021-09-07,CRYPTO NEWS Binance to launch Microstrategy Apple and Microsoft stock tokens aapl altcoin altcoinnews crypto cryptocoin cryptocurrency microstrategy msft mstr stocktokens,0
2021-09-07,Microsoft rebrands its news feed as Microsoft Start MSFT Microsoft MicrosoftStart News,0
2021-09-07,Full Time Graduate Opportunities MSFT WeArehiring Jobs jobseekers graduates,0
2021-09-07,Microsoft Forms is adding some much needed organization features MSFT Microsoft Forms MicrosoftForms Office365,0
2021-09-07,Microsoft Inside Day MSFT chart,0
2021-09-07,MSFT chart intra day MSFT has been weaker than other tech stocks so far This would be the 5th consecutive day down See if it reclaims 300 26 for a possible reversal as this looks like a hammer type candle,0
2021-09-07,Are you a partner with questions around NCE Check out this FAQ PDF MSFT Microsoft IngramMicroCloud NewCommerceExperience MSFT MSDyn365 Microsoft365 Azure Cloud MSFTAdvocate,1
2021-09-07,Have you all seen the updates pushed by microsoft Myanalytics is migrating to vivainsights so be sure to get caught up on all the latest news before the release in Fall 2021 viva msft msftadvocate,0
2021-09-08,Top watches for tomorrow MSFT may break downwards channel MU symmetrical triangle ROKU downtrend break coming SHOP downtrend break coming soon SHOP ROKU MU MSFT stocks stocktowatch stockstobuy stockmarket chartidea,0
2021-09-08,Don t b a msft west be an aapl China east Play the InfiniteGame The OneBeltOneRoad is infinite Everything China has done since 1AD has been infinite Respect cx ex custexp custserv employeeexperience innovation futureback,0
2021-09-08,MSFT Defender Graph Yes plz Check out the picture this provides of attacker steps once they compromise 1 device,0
2021-09-08,Before you hear it anywhere else DmcRyan got me blocked is a Tool and Subservient to Advertising Dollars He doesn t represent XBOX or MSFT in any shape or form He simply opens his mouth when his superiors probably in advertising tell him to,0
2021-09-08,What s everyone buying tomorrow DKNG AAPL SPY AMC GME AMD MSFT,0
2021-09-08,Tomorrow I ll be watching MSFT VALU PAYX PXLW GMAB,0
2021-09-08,MSFT Start allows users to personalize their news feeds with content from more than 1 000 publishers via,1
2021-09-08,MSFT Looking at 2 potential plays shown with Yellow Circles MSFT Microsoft SPY QQQ,0
2021-09-08,Holisticinfosec working at MSFT with a just defended dissertation in SecViz approves this message The graph presents a holistic view of how an attack spread through an environment over time where it started amp how far the attacker went defender,2
2021-09-08,Is MSFT encroaching more and more on ADBE space MSFT buys video editing software company Clipchamp,1
2021-09-08,Hybrid working is here to stay and Microsoft is enabling it MSFT Microsoft HybridWork RemoteWork,0
2021-09-08,IBM IBM MSFT MSFT Money mimicry and mind control Big Tech slams ethics brakes on AI,0
2021-09-08,Secure your data in the cloud with Microsoft Azure Solutions from Data Pros Contact us for a free consultation today MSFT Microsoft DataPros Azure Cloud,0
2021-09-08,Want to learn howto set your out of office in Microsoftteams Check out my youtube tutorial outlook Microsoft Microsoft365 MSFT Microsofttraining vacation MSTeams,1
2021-09-08,MSFT MSFT possible setup looking for 293 worth a look,2
2021-09-08,And there it is the 2021 Standards of Business HR training for our company has just landed Productivity falls to zero as the entire company craters the HR system to find out what Nelson s been up to Good lord I love that HR training is so fun at Microsoft,3
2021-09-08,Microsoft rebrands its news feed as Microsoft Start MSFT Microsoft Start MicrosoftStart,0
2021-09-08,I legit wait for this training and Nelson is a legend sbc msft,0
2021-09-08,MSFT chart intra day MSFT touched its 21EMA after it entered a downtrend from 305 It might be worth a try here versus the low of the day if the market rebounds later in the day Holding above 298 20 would be a start,0
2021-09-08,Microsoft acquires Clipchamp cloud video editor msft surface o365 feedly,0
2021-09-08,Want to learn all of the different ways you can create a team in MicrosoftTeams Check out this tutorial Microsoft Microsoft365 Office365 MSFT MSTeams Remotework MicrosoftEDU YouTube Howto Tutorials SharePoint Azure AzureActiveDirectory,1
2021-09-09,Microsoft Teams is getting hybrid meeting features including CarPlay support MSFT Microsoft Teams MicrosoftTeams CarPlay,0
2021-09-09,Announcing CloudQuiz Put your knowledge of Cloud amp Azure services to test And win exciting prizes in store Challenge begins October 8th Register here KonfHub MSFT,13
2021-09-09,Wow MSFT MSFT non stop above ask buys Thanks whales We re already early on these contracts just in case she rips without giving us a dip to average down,1
2021-09-09,Announcing the next wave in MicrosoftTeams Rooms innovation with a new category of intelligent camera The PanaCast 50 We are proud to be a part of this MSFT Moment Brace yourselves Hybrid work is hard Here s how Microsoft Teams can help,0
2021-09-09,September 9 2021 MSFT push out CumulativeUpdate KB5005642 for Windows 11 Version 21H2 InsiderPreviewBuild 22000 184 co release svc im 210901 1745 in the BetaChannel also making CU available to commercial PCs in the ReleasePreviewChannel,5
2021-09-09,MSFT we exited this position as it broke the low of the day Respect your stops as it might get choppier later in the day,0
2021-09-09,Microsoft CEO Flexibility is the key to future of hybrid work MSFT Microsoft HybridWork CEO,0
2021-09-09,So much MicrosoftTeams goodness announced today for HybridWork Intelligent Cameras for MicrosoftTeamsRooms Dynamic View Companion mode in Teams mobile hot desking on TeamsDisplays Cameo in PowerPoint Live Apple Car Play support and more,4
2021-09-09,Briefs MSFT Microsoft SoftBank Backed OYO Collaborate For Travel Tech,0
2021-09-09,Microsoft is indefinitely postponing workers return to US offices as Covid cases surge The fall ahead might look very similar to last fall MSFT,0
2021-09-09,Jefferies a MSFT expert who said px incr will likely drive higher adoption of E5 deeper integrations for Office Dynamics and Teams are on the way and that Win365 can be expensive but catered to clients who don t want to manage infrastructure,0
2021-09-09,Microsoft Teams and Outlook are getting big updates to help you adapt to hybrid work MSFT Microsoft Teams MicrosoftTeams Outlook,0
2021-09-09,Calling out to all Azure enthusiasts to join this exciting session on End to End Predictive Maintenance Use Case with Azure ML amp Azure IoT Edge by Saravanan Register for Azure MSFT,4
2021-09-09,Big congratulations to Team for elevating the HybridWorking experience with new MicrosoftTeams features that create an inclusive environment where everyone is seen and heard remotework officeofthefuture MSFT,1
2021-09-09,Windows11 could make your PC faster thanks to these clever new tricks via sysadmin msft,1
2021-09-09,Microsoft warns of attacks targeting Office documents via msft sysadmin ITpro,0
2021-09-10,MSFT DRIP Yes please microsoft stockmarket msft drip dividendreinvestmentplan investing,0
2021-09-10,MSFT intra day chart After dipping as low as 296 40 MSFT is attempting a reversal as it reclaimed 297 We bought some 300 calls expiring next week in case it starts a new active sequence or at least a dead cat bounce from the 21EMA,0
2021-09-10,LinkedIn owned by MSFT is one of the worst They are punitive and draconian Their rules are irrational and defy commonsense They cut you off for telling the Truth I d rather use Twitter Facebook and Gettr,0
2021-09-10,MSFT MSFT patience Lets see how we close the week,0
2021-09-10,MSFT Microsoft The tight consolidation at the top,0
2021-09-10,This new Microsoft Teams feature can help make you a better presenter MSFT Microsoft Teams MicrosoftTeams,0
2021-09-10,No circuit breakers in the last 15 min Read the rules btc crypto ether Ethereum xrm xrp xlm doge amc gme nok bb bbby amzn aapl fb googl nflx snap tsla msft panw spy qqq uco uso sco slv gld sqqq iwm dow dia djia acb tlry bitcoin,0
2021-09-10,Are you facing Provisioning challenges with MicrosoftTeams Looking to enhance your DataGovernance strategy Discover how MSFT limitations are affecting your organization and how you can tackle them,1
2021-09-10,MSFT 90TD and 90CD counts into High Hitting Sq9 target in PRICE as Gann cycles come due TIME amp PRICE gann MSFT stocks Techstocks FANG NDX trading WDGann cycles timing volume RSI Ganntrading,0
2021-09-10,Data Pros VoIP solutions give you tailored telephony systems that allow you to modernize your communications without breaking the bank Contact us for your free consultation today MSFT Microsoft DataPros VoIP,1
2021-09-11,WATCH BEARISH SEPT SELL OFF DOW JONES INDEX DJIA DOW 30 DIA JNJ JNJ JPM JPM KO KO MCD MCD McDonalds MMM MMM MRK MRK MSFT MSFT Microsoft NKE NKE Nike PG PG TRV TRV UNH UNH V V Visa VZ VZ Verizon WBA WBA WMT WMT Walmart,0
2021-09-11,MSFT Blue Raindrop on the daily as MSFT starts to dip into volume gap,3
2021-09-11,Let s have a look at the story of Microsoft in this final part of my Microsoft deep dive invest dividends TEIN msft,1
2021-09-11,AzureDevIndia is going live with the session End to End Predictive Maintenance Use Case with Azure ML amp Azure IoT Edge by Saravanan Ganesan in the next 30 mins Catch us live here MSFT Azure,7
2021-09-12,Want to learn how to pop out apps in MicrosoftTeams Check out this tutorial on youtube Microsoft MSFT MicrosoftEDU Remotework MSTeams Microsoft365 Office365 Teams PowerAddict,1
2021-09-12,MSFT target near 289 MSFT SwingTrading,1
2021-09-12,Having spent 18 years doing my bit to boost the MSFT stock price from lt 30 to gt 300 you re welcome btw I am super stoked about my next life assignment and to be joining as Director Technical Advisory group starting tomorrow W00T,1
2021-09-12,MSFT target near 289 MSFT SwingTrading,1
2021-09-12,Market traders use the weekend and dive into some actual professional market education TRICKTRADES Youtube channel SPY QQQ AAPL BABA NVDA FB TSLA AMD TWTR MU AMZN NFLX MSFT GOOGL Stock Market,2
2021-09-12,Check mega caps What do you think about their shareholders sales increasement in august and sept Is it coincidence 38 of 46 company check from finviz I hope you will be carefull in nowadays esp with options options megacap Apple Facebook Google PG MSFT,1
2021-09-12,MSFT MSFT Weekly Breakdown Do you think we see a continuation move lower We will discuss 6pm Tonight On Sunday Night Futures LIVE,0
2021-09-13,MSFT option volume MSFT chart,0
2021-09-13,MSFT intra day chart MSFT showed early strength but followed the market weakness and dipped below Friday low of 295 38 If the market conditions improve see if it can reclaim it for a possible reversal trade,0
2021-09-13,AMD boutta get slapped for saying this but still bullish i think got leaps on this so ill just let it play out AAPL TSLA ROKU AMZN SNAP SQ CLOV AMC FB NIO ES SPY SPX NVDA MSFT,0
2021-09-13,NIO long 38 AAPL TSLA ROKU AMZN SNAP SQ CLOV AMC FB NIO ES SPY SPX NVDA MSFT,0
2021-09-13,Regulation s was always predestined for AI And Machine Learning Just like human judgment AI isn t infallible AI ML HBR Regulation Google MSFT AMZN BMW,0
2021-09-13,MSFT s quarterly chart looks like a penny stock s one minute chart It has become a mania stock It will drop huge MSFT MSFT optiontrading,0
2021-09-13,Microsoft Teams update will fix the single most common video conferencing problem URL collaboration Microsoft MicrosoftTeams MSFT UCC videoconferencing,0
2021-09-13,Finallyyyyyy Thank you and MSFTStudentAmbassadors team Microsoft microsoftlearn gold milestone studentlife community elevate MSFT MSFTStudentAmbassadors,3
2021-09-13,Brad Reback who covers MSFT as an analyst at Stifel says diminishing fiscal impact of Windows has 2 facets Increasing of co s rev comes from cloud serv like Azure and MSFT 365 combined with MSFT s decision to give Windows 11 out as a free upgrade,0
2021-09-13,Great to see this customer story now live for our partner Power Central Working alongside making more possible for our partners IngramMicroCloud PowerCentral Microsoft MSDyn365 BusinessCentral MSDyn365BC PowerBI PowerPlatform MSFT,0
2021-09-13,Microsoft Teams will soon let you temporarily unmute your microphone MSFT Microsoft Teams MicrosoftTeams,1
2021-09-13,Combining this with LinkedIn MSFT has been very busy making small but highly strategic looking acquisitions MSFT acquires learning marketplace start up TakeLessons,1
2021-09-13,Microsoft Brings In New Features Will Ensure Muted Microphone Microsoft teams MicrosoftTeams MSFT MSFT,0
2021-09-13,What to expect from Microsoft s Surface event MSFT Microsoft Surface MicrosoftSurface,0
2021-09-13,Beyond sharing your screen Interactive collaboration with apps in Microsoft Teams meetings MSFT Microsoft Teams MicrosoftTeams Office365,0
2021-09-14,Have you seen a lot of content on New Commerce Experience amp realised they re giving a lot of info without actually telling you anything Well I have the blog for you IngramMicroCloud NCE MicrosoftUpdates MSFT,1
2021-09-14,New Microsoft Teams Outlook features are designed for hybrid remote work MSFT Microsoft Teams MicrosoftTeams HybridWork Outlook,0
2021-09-14,Want to learn how to restore a deleted file in MicrosoftTeams Check out this tutorial Microsoft Microsoft365 Office365 MSFT MSTeams Remotework MicrosoftEDU YouTube Howto Tutorials SharePoint SharePointOnline,1
2021-09-14,What is MSFT up to,0
2021-09-14,msft MSFT on watch this week whats your theory it holds 299 6 to test 301 303 or it breaks to 297 20 295 08 microsoft optionstrading,0
2021-09-14,MSFT s reversal Can we trust it MSFT chart,1
2021-09-14,September 14 2021 MSFT PatchTuesday B Get CumulativeUpdate s for Windows 10 Version s 1507 1607 1809 1909 2004 20H1 20H2 21H1 and Windows Server LTSC 1809 SAC 20H1 20H2 on MicrosoftUpdateCatalog served by the same updates,7
2021-09-14,Covered Calls Cash Flow Strategy Ticker MSFT Date 2021 09 17 Strike 300 0 Premium Generated 1 18 options coveredcalls stocks MSFT,0
2021-09-14,MSFT is embracing empathy courage and vulnerability to create trust and build connections Hope to see more MSPartners embrace the Dare to Lead methodology,0
2021-09-14,Microsoft September 2021 Patch Tuesday MSHTML Vulnerability Patch Included MSFT MSHTML Patches,6
2021-09-14,Microsoft Teams This new feature will make your meetings more interactive MSFT Microsoft Teams MicrosoftTeams,0
2021-09-14,MSFT MSFT chart,0
2021-09-14,TradeIdea MSFT MSFT Channel Inverse H amp S pattern setting up I would prefer a consolidation to happen before the break Probability wise it would be a safer way to break important areas that way,0
2021-09-14,Are You Getting the Most Out of Microsoft Teams MSFT Microsoft Teams MicrosoftTeams,0
2021-09-14,MSFT Call MSFT MSFT,0
2021-09-14,MSFT MSFT recently broke the previous outside return structure Can we expect a short term trend reversal Price may very well go back down to the 289 level in this case,0
2021-09-15,FREE TW0E options Trade Setups Scale out gt 25 MSFT gt 301 06 gt 303C 304 58 lt 298 gt 296P 294 AAPL gt 149 09 gt 150C 154 37 lt 146 90 gt 146P 144 50 FB gt 378 27 gt 380C 381 17 lt 375 gt 373P 370 83 MRNA gt 437 40 gt 440C 450 lt 418 6 gt 415P 405 amp 400 Help me with TW0E stocks,2
2021-09-15,spy doesnt know what to do with decent breadth but FANGman getting sold minus MSFT Smells a little bit like the index rebal with laggers up today into quad friday Apart from open what a horrible day to trade,0
2021-09-15,Opening Bell MSFT MSFT 299 79 0 94 Join The Hype List,0
2021-09-15,Microsoft Teams This new feature will make your meetings more interactive MSFT Microsft Teams MicrosoftTeams,0
2021-09-15,SPY 479 will be a good confirmation Else still a Bull trap stocks stockmarket cnbc elon btc msft irnt,0
2021-09-15,MSFT Long at 302 50 MSFT,0
2021-09-15,Microsoft Teams This new standout feature is coming to a meeting near you soon MSFT Microsoft Teams MicrosoftTeams,1
2021-09-15,Thank you for the increase msft,0
2021-09-15,QQQ continues to struggle red candles in a row is a big red flag TLT indicates that requests for bonds are increasing spy spx qqq ndx nasdaq investingwithmk trading fb fcel msft silk trox zi cei crox irnt isee sdc clr star agc beem,0
2021-09-15,How to Set Up Alexa Email Alerts amazon alexa gmail hotmail outlook microsoft msft windows10 windows11 skills,0
2021-09-15,Should Microsoft have simply increased its stock buyback instead of increasing its dividend MSFT AMZN GOOGL,0
2021-09-15,Aloha Traders Updated Elliottwave counts on our Discord platform BTC ETH ETHBTC SPX SPX500 NDX NAS100 WTI oil Gold XAU DXY MSFT AAPL AAPL completed an impulse down NDX in an EW configuration Tech telling us something,0
2021-09-15,RR Microsoft Will Require All Employees and Office Visitors to Be Vaccinated Covid 19 Health Microsoft MSFT Pandemic ReturntoOffice Safety WFH,1
2021-09-15,Success from jg in Discord BABA BABA FB FB MSFT MSFT,0
2021-09-15,msft msft just broke to meet ATH Over 305,0
2021-09-15,We are celebrating RIL TCS mcap crossing 200 Billions While Msft is doing buyback of 60 billions with mcap of over 2 trillion Longway to go,0
2021-09-15,Mr Softie to DA Moon MSFT flagged it as strongest in mega cap tech It s by far my largest position,0
2021-09-15,September 15 2021 MSFT push out Windows 11 NEXT Version DEV InsiderPreviewBuild 22458 1000 rs prerelease is NOW available in the DevChannel ActiveDevelopmentBranch,6
2021-09-15,It s great when you wake up to a 10 payrise dividends microsoft MSFT passiveincome retirementplanning FinancialFreedom,0
2021-09-15,Microsoft to buy back up to 60 billion in shares Microsoft share dividends MSFT MSFT stockmarket,0
2021-09-15,A Peek Into The Markets AVTX Earnings JKS MSFT A Peek Into The Markets US Stock Futures Rise Ahead Of Economic Data Crude Oil Gains 1,0
