Date,full_text,retweet_count
2021-09-28,Just wrapped recording my session for DiscoverBizApps You can register here So proud to be kicking off this event we have amazing speakers across 3 tracks lined up be sure to register BusinessApplications MSDyn365 PowerPlatform MSFT,1
2021-09-28,Microsoft Teams is giving phone calls a big makeover MSFT Microsoft Teams MicrosoftTeams Phones,0
2021-09-28,MSFT MSFT 700 Search Increase on Google Past 4 Hours,0
2021-09-28,MSFT added 285,0
2021-09-28,NET AMZN Cloudflare going head to head with AWS claiming to be 50 cheaper than S3,1
2021-09-28,Red October appl msft fb googl amazn tslq nike,12
2021-09-29,Participate in more quizzes on Cloud amp Azure technologies And WIN prizes Register at KonfHub CloudQuiz MSFT,1
2021-09-29,Cloud PCs A New Frontier In Hybrid Work via on HybridWork Cloud PC MSFT,0
2021-09-29,September 29 2021 MSFT push out Windows 11 NEXT Version DEV InsiderPreviewBuild 22468 1000 rs prerelease is NOW available in the DevChannel ActiveDevelopmentBranch,4
2021-09-29,Microsoft will open Windows Store to third parties starting with Epic and Amazon MSFT Microsoft Windows Amazon,0
2021-09-29,Microsoft Begins to Test Xbox Cloud Gaming on Xbox Consoles microsoft msft xcloud xbox XboxSeriesX XboxSeriesS CloudGaming cloudcomputing,1
2021-09-29,Will keep an eye on MSFT around the 285 area MSFT,0
2021-09-29,9 28 BloodyMarket Blue Chips taking some Big Hits MSFT AAPL GOOGL AMZN PYPL AMC With Low Vol had a nice little dip to grab some more tickets to freedom,3
2021-09-29,MSFT The biggest monopoly in history close to closing the gap below around 281,0
2021-09-29,MSFT I am stopped out Breakeven on the trade This is why it s important to manage your risk appropriate by good position sizing scaling profits at the right time and adjusting the Stop Loss to your tolerance Moving on MSFT,0
2021-09-29,PASS Data Community Summit 2021 is the year s largest gathering of Microsoft data platform professionals It s free and virtual this year Nov 8 12 2021 Cant wait Thankyou for making this happen msft sqlserver analytics,0
2021-09-29,Microsoft Corporation MSFT closed at 284 00 score 47 credit rating A,0
2021-09-29,MSFT 285 should hold Less bullish price action if it doesn t My stop loss raised slightly,0
2021-09-29,Just finished working out and now on the comps I m not seeing much at the moment Seeing some short squeezing from the late shorts yesterday Of my watchlist I do like MSFT for having some nice upside potential but I don t have a set up yet for an entry Stay patient,0
2021-09-29,Ouch Does someone wanna check in on MSFT to see if they re ok Turn it on and off maybe,0
2021-09-29,Love Microsoft Analysts believe that increasing cloud strength and new product additions will drive MSFT stock higher What do you think Traders Get in on the StockTrading action with Trading is risky,0
2021-09-29,MSFT MSFT Short TradingView,0
2021-09-29,MSFT Call Lotto MSFT MSFT,0
2021-09-29,Microsoft Teams Whiteboard is getting this huge makeover MSFT Microsoft Teams MicrosoftTeams WhiteBoard,0
2021-09-30,MSFT Call MSFT MSFT,0
2021-09-30,Operator Connect general availability and new Microsoft Teams Phone features to modernize calling MSFT Microsoft Teams MicrosoftTeams OperatorConnect,0
2021-09-30,I ve posted a new YouTube video Feel free to check it out here Alibaba BABA Bitcoin BTC SPY NASDAQ 10year treasury China Evergrande Ethereum ETH Litecoin LTC Apple AAPL Microsoft MSFT Tesla TSLA,0
2021-09-30,New Research Note Alert Adds New Features to Teams to Support Hybrid Work and Enabling Collaboration HybridWork Collaboration MSFT MicrosoftTeams Futureofwork,18
2021-09-30,embrace the hybrid paradox people want the flexibility to work from anywhere but simultaneously crave more in person connection emplyeexperience msft,0
2021-09-30,msft It s falling as much as 4 in an hour,0
2021-09-30,Xbox Series X S Stock Issues Will Continue Into 2022 According To Phil Spencer xbox XboxSeriesX XboxSeriesS microchipshortage microsoft msft gaming,4
2021-09-30,How To Wipe Your Xbox Game Cache xbox xboxone XboxSeriesX xboxseriess xboxtips cache microsoft msft,1
2021-09-30,PartnersWelcome Cybersecurity Expertise is specialized Those that know MSFT and its security stack know that it takes highly talented experts to set up manage monitor amp complement what offers knows how amp we deliver AskMe MakeTheCall,3
2021-09-30,I took 4 trades today Short SPY Green FB Breakeven MSFT Green Long SPY Green My last play was MSFT short which I just closed recently It s been a while since I played the short side on names I actually prefer short plays over longs because they are quicker,0
2021-09-30,Extremely proud of the work we re doing at MSFT to support Growth amp Resilience in Tech Excited to join at TNWConference tomorrow at 8am PST for a fireside chat about how non tech skills to foster a more inclusive future Hope you can tune in,5
2021-09-30,DiscoverBizApps event Register here IngramMicroCloud Microsoft MSFT MicrosoftPartnerNetwork MicrosoftPartner MSFTAdvocate VirtualEvent LiveEvent WeAreCloud Dynamics365 MSDyn365 PowerPlatform PowerAddicts,1
2021-09-30,Check out s recent blog Compliance Center Design Diagram for a visual guide on the information flow and the main Compliance Center capabilities,2
2021-09-30,Past trends of where I invested the most heavily 2017 GOOG and MSFT 2018 AMD and NVDA 2019 Bitcoin Ethereum and TSLA 2020 Litecoin and Chainlink 2021 Litecoin and Chainlink,0
2021-09-30,MSFT Call MSFT MSFT,0
2021-09-30,Check out the biggest Ask and Above the Ask orders coming through IAA MSFT GOOG DIS QCOM GOOGL MRNA NFLX,0
2021-09-30,msft And I lost 320000yen,0
2021-09-30,MSFT Getting buy signals down at these levels Personally I would wait to see at the end of this week if that GAP down below will fill If we bounce here this would be a strong buy on the breakout line MSFT is a long for me either way just one of those companies not going,0
2021-09-30,MSFT On Demand writing Below 285 if stays and close for 3 consecutive days weekly close Watch panic upto 272 268 soon and more,1
2021-09-30,MSFT Getting buy signals down at these levels Personally I would wait to see at the end of this week if that GAP down below will fill If we bounce here this would be a strong buy on the breakout line MSFT is a long for me either way just one of those companies not going,0
2021-09-30,Cloud PCs A New Frontier In Hybrid Work via on Cloud PC MSFT Futureofwork HybridWork,1
2021-09-30,Portability and style surface msft windows pc tablet coding gaming technology electronic pc mac dev 100daysofcode devcommunity,3
2021-10-01,MSFT Call MSFT MSFT,0
2021-10-01,Cloud Quizzing Challenge has a grand tournament coming up 2 winners from the tournament will be awarded grand prizes Challenge begins October 8th Register here KonfHub CloudQuiz MSFT Azure,1
2021-10-01,Here are New Game Releases for Xbox Series X S and Xbox One in October 2021 xbox XboxSeriesX october october2021 gaming consolegaming microsoft msft,1
2021-10-01,Up more than 50 on our small Account Join is next week On our road to 100k AAPL TSLA BTC SPY ETH MRK AMZN QQQ NFLX LINK AMC NIO MSFT PED CEI AAPL TSLA BTC SPY ETH MRK AMZN QQQ NFLX LINK AMC NIO MSFT PED CEI,0
2021-10-01,Microsoft announces latest product launch and new operating system MSFT Microsoft Office365 Windows11,2
2021-10-01,Trade Review 9 30 21 MSFT Short MSFT,0
2021-10-01,MSFT Daily Depending on the degree of the pullback for MSFT some areas of interest,2
2021-10-01,Today was my first day as Sales Executive Intern for Microsoft Germany Excited for the months ahead msft sales internship germany tech,1
2021-10-01,MSFT Now that the GAP filled properly this is why patience is important we should see if we get a confirmation bounce or not tomorrow If we do we can carry calls into next week as long as QQQ is in a good spot as well MSFT is a strong company to go long on as well,0
2021-10-01,are you paying attention yet MSFT MSFT Microsoft one of the reasons i was bearish on the futures and said im looking for shorts on em this stock alone is 10 of NQ F NQ F and 5 7 of ES F ES F,0
2021-10-01,Excellent new post by David Keller Mean Reversion in FAANG Stocks Link here Markets Trading Analysis Stocks MeanReversion FAANG NFLX MSFT TradersSummit,1
2021-10-02,Daily Close 01 10 21 Trending Markets Stocks 30 Most Popular Hedge Fund Stocks 2021 Q2 AAPL AMZN BABA FB GOOGL MSFT NFLX TrendFollowing,0
2021-10-02,FTD of MSFT in the last 1 year To view more details including T 35 date visit FTD MSFT,1
2021-10-02,HA Website is now fully operational on MSFT Cloud Cheers,5
2021-10-02,Microsoft always seems to shoot themselves in the foot I predict the uptake of Windows 11 will be very low because of the TPM 2 0 requirements and no clear feature that is of any benefit msft,1
2021-10-03,Microsoft Fixing Remaining Windows 11 Bugs Ahead of October 5 Release MSFT News,1
2021-10-03,MSFT bounced off of the uptrendline and 20 week ma Depending on how market behaves msft can see a run up into tech ER Might have something baking in the over here chartidea QQQ earnings,0
2021-10-03,Interested in getting started with DevOps with Data Engineering Mark the date 7th October at 6 pm IST as will be guiding on Bringing DevOps Culture to Data Engineering Teams RSVP here AzureDevIndia Azure MSFT,5
2021-10-03,Anyone notice that there s no complaints about Sony amp their exclusivity deals studio acquisitions but negative press for MSFT amp pushback from the gaming media from their moves Gaming Advertising dollars at work here or brand bias My opinion Its Both,0
2021-10-03,Portability and style surface msft windows pc tablet coding gaming technology electronic pc mac dev 100daysofcode devcommunity,8
2021-10-04,The USArmy is continuing to inform Integrated Visual Augmentation System network integration by evaluating emerging commercial radio technology that enables data exchange among Soldiers NationalTechieDay IVAS ArmyTech,114
2021-10-04,MSFT Windows11 Up facebookdown Tech Ups and Downs,0
2021-10-04,After 17 amazing years at Microsoft it s time for my next adventure I m grateful to have worked at such an incredible company met so many wonderful people and learned so much along the way Great memories working on Visual Studio and Microsoft Cloud Will remain a fan msft,0
2021-10-04,Great day finally getting together with our UK Biz Apps team And a big welcome to Liam O Brien joining the team A very special team that s for sure IngramMicroCloud MSFT Microsoft MSDyn365 PowerPlatform D365,0
2021-10-04,MSFT Put MSFT MSFT,0
2021-10-04,MSFT 2021 10 01 CLOSE PRICE 289 100006 msft,0
2021-10-04,Hone your Cloud knowledge amp win amazing prizes A fun quiz on Cloud amp Azure Challenge dates 8th October to 17th December Register here KonfHub CloudQuiz MSFT Azure,8
2021-10-04,Microsoft Teams meetings are about to get a lot more colorful URL collaboration Ideation Microsoft MicrosoftTeams MicrosoftWhiteboard MSFT whiteboarding,0
2021-10-04,Want to learn howto set your out of office in Microsoftteams Check out my youtube tutorial outlook Microsoft Microsoft365 MSFT Microsofttraining vacation MSTeams,0
2021-10-04,Portability and style surface msft windows pc tablet coding gaming technology electronic pc mac dev 100daysofcode devcommunity,9
2021-10-04,SELL ALERT for MSFT 282 24 Green Circle exit Return 0 33,0
2021-10-04,Today joining in on Microsoft Airlift 2021 Nice to have the possibility to chat amp connect TY MSFT,0
2021-10-04,MSFT and TSLA will be important today for market sentiment Can the software giant hold above 286 and go green Similarly will early strength in the EV maker push the stock above 800 If both turn lower expect more selling pressure in the entire market,0
2021-10-04,NQ touched the important trend line support which has been holding from June 2020 Nice bounce after touching the support Huge buy order before the bell TOMORROW GOING TO BE HUGE PUSH IN THE MARKET AAPL MSFT TSLA AMZN FB GOOGL CRM NFLX ROKU PLTR BAC BABA COST MA,0
2021-10-04,Windows 11 How to use the new version of Microsoft Teams MSFT Microsoft Teams MicrosoftTeams Windows11,0
2021-10-04,Together Azure and Dynatrace provide organizations with the acceleration needed to understand manage and transform their business Check out how in the below webinar MSFT Observability,1
2021-10-04,If was a stock it would be msft but with a linux for an operating systems,0
2021-10-04,The 365 Defender Threat Intelligence Team issued a warning last week on a large scale phishing as a service operation discovered as they were researching phishing attacks Cybersecurity Phishing MSFT,4
2021-10-04,BUY ALERT for MSFT 283 18 Target Range 284 60 to 286 04 Red Circle entry Shaded areas represent P L S L 282 47,0
2021-10-04,Our MSFT CLOSE PRICE prediction for coming days msft investingtips What do you project,0
2021-10-04,Microsoft Teams is getting this new look on Surface Hub MSFT Microsoft Teams MicrosoftTeams SurfaceHub,0
2021-10-05,Microsoft Teams Update Introduces Quiet Time Feature MSFT Microsoft Teams MicrosoftTeams,0
2021-10-05,MSFT Call Lotto MSFT MSFT,0
2021-10-05,Join us tomorrow morning as we ring the bell with to celebrate the next suite of Canadian Depositary Receipts CDRs to hit the market on the NEO Exchange Own the company not the currency Register DIS FACE PYPL MSFT VISA NEOlisted CDR,1
2021-10-05,Windows 11 Microsoft s biggest minor upgrade ever is all about new hardware MSFT Microsoft Windows Windows11 IT,0
2021-10-05,The one and only Curt Bean of about to starting here Cloud9Insight DiscoverBizApps IngramMicroCloud Dynamics365 MSDyn365 CRM LiveEvent VirtualEvent Dynamics PowerPlatform ERP LessCodeMorePower Microsoft MSFT MSFTAdvocate,2
2021-10-05,Microsoft s big new Windows 11 update is out now here s how to get it MSFT Microsoft Windows11 MicrosoftWindows11,0
2021-10-05,MSFT target 299 before any correction MSFT TradingView it was predicted months ago,0
2021-10-05,Is Windows 11 opt in or auto update DEVcommunity techtwitter windowsupdate msft,0
2021-10-05,Getting so much positive feedback right now on this session on the PowerPlatform brought to you by amp amazing job amp a huge thank you to these 3 great guys DiscoverBizApps PowerPlatform MicrosoftTeams MSFT Microsoft MSDyn365 LessCodeMorePower,0
2021-10-05,If true it s time for Phil amp MSFT to fight fire with fire It s Obvious that the Japanese Gaming Corporation s arent playing fair with MSFT so why take the high road It s time to aquire either a take2 EA or even a cdprojektred amp throw shots back at Sony,0
2021-10-05,MSFT 1 Day msft msft Microsoft technology tech StocksToBuy stockstowatch longterm growth investors trendlines trendsupport,0
2021-10-05,Are you familiar with Cloud amp Azure services Then we have some exciting prizes in store Simply take the quiz win amp get yours Challenge begins on October 8th Register here KonfHub CloudQuiz Azure MSFT,6
2021-10-05,Portability and style surface msft windows pc tablet coding gaming technology electronic pc mac dev 100daysofcode devcommunity,5
2021-10-05,I M UP NEXT All about building a resilient supply chain with BusinessCentral IngramMicroCloud Dynamics365 MSDyn365 MSdyn365BC OneIngram MSFT MicrosoftAdvocate ERP CRM PowerPlatform DiscoverBizApps BusinessApplications,3
2021-10-05,Congress will never interfere as they all own stock in FB AMZN AAPL Google NFLX and MSFT They are all bought especially,0
2021-10-05,Earnings MSFT Three Days In Trading Microsoft,0
2021-10-05,There is no doubt at least to me that Facebook and Google are grave menaces Along with Apple and Amazon they have become classic monopolies But none of the anger or activism in Washington and among liberal outlets is about solving that They want to be the overseers of it,617
2021-10-05,Adds New Features to Teams to Support Hybrid Work and Enabling Collaboration HybridWork Collaboration Futureofwork MSFT,0
2021-10-05,Who wants to explain Windows 11 in a nutshell I thought that 10 was going to be the last one and just keep updating Is my 10 going to automatically update to 11 this week Can I prevent that windows11 windows,0
2021-10-06,Hands up if you were a Visual Basic coder,140
2021-10-06,MSFT What does it take for it to fly again MSFT chart on,0
2021-10-06,what created enough fear to keep deflating the dot com bubble when it looked like it might recover China Japan entering recession Powell Greenspan hiked rates after the peak SPACs dot coms began to lose access to funding FB MSFT lost a landmark anti trust case we almost there,0
2021-10-06,My dad was a CompSci teacher with ties to MSFT when VB launched I had early access My senior CompSci team amp I were the only team to have gasp actual windows in our final year presentation it was smoke amp mirrors our actual project was in C but dang did we look good,0
2021-10-06,Microsoft Teams to get faster and more relevant search results MSFT Microsoft Teams MicrosoftTeams,0
2021-10-06,Don t be weary of the Stock Market just think of it as a BUYING opportunity Stocks you ve always wanted to own watch if they re going down amp BUY on the dip Robinhood offers easy ways to purchase stocks InvestInU FB MSFT DIS AAPL DOGE,1
2021-10-06,Participate in more quizzes on Cloud amp Azure technologies And WIN prizes Register at KonfHub CloudQuiz MSFT Azure,1
2021-10-06,These are my personal alerts I set up for every night MSFT 1 50 4 00 AFRM 2 00 11 00 freemoney easymoney goldlines spy msft afrm,2
2021-10-06,Just 1 more day to go Set your reminders and buckle up Cloud Quizzing Challenge starts on October 8 Register now if you haven t done yet KonfHub CloudQuiz MSFT Azure,1
2021-10-06,microvision msft hololens MVIS,0
2021-10-06,Today MSFT amp MCTH,0
2021-10-06,Actionable alerts today MSFT calls 1 34 gt 2 20 64 at second attempt first failed MARA 38 49 gt 39 60 swing still active BTBT 11 86 gt 12 42 at peak 4 this one reversed quick but delivered quick 4 5 Didn t reach higher levels Maybe next time,0
2021-10-06,Hope yall are using the for your flows AMC nvidia amd paypal roku twitter CCIV GME wish cei StocksInFocus StocksToBuy calloption putoption Apple Microsoft appl msft,1
2021-10-06,msft microsoft mrsofty WHERESMINE NFT s amp Icecreampromo bloomberry icecream amp NFTS windows11 bloomberry mikeylikesit sendmesome I m on an island Maui,0
2021-10-06,GM MSFT EXCLUSIVE How GM Microsoft Palantir Backed Wejo Is Scaling Its Connected Vehicles Marketplaces,0
2021-10-06,Aloha Traders Updated Elliottwave counts on our Discord platform BTC ETH ETHBTC SPX SPX500 NDX NAS100 WTI oil Gold GLD XAU DXY VIX TGT SLB MSFT AAPL TTWO bouncing from our green box nicely while the market is down,0
2021-10-06,just dabbled with elliot wave theories this week ami doing it right using wxy because no waves present 5 counts for a valid abc this count suggests that we are missing a leg bottom is in ath IMO AAPL tsla ROKU AMZN SNAP amd FB NIO ES SPY SPX NVDA MSFT,0
2021-10-06,Portability and style surface msft windows pc tablet coding gaming technology electronic pc mac dev 100daysofcode devcommunity,6
2021-10-06,MSFT analysis grafical for MSFT TradingView,0
2021-10-06,Join us live on 7th October at 6 pm onwards on this exciting session Bringing DevOps Culture to data engineering by Register here for AzureDevIndia Azure MSFT,4
2021-10-06,The latest Twitch clusterfck illustrates how laughably short sighted MSFT was to abandon Mixer,0
2021-10-07,I love this,6
2021-10-07,TAKING PROFITS ON ALL CALLS IN MSFT AND SPY MARKET MSFT chart on,0
2021-10-07,Connecting the Microsoft and Workday communities gt gt MSFT WDAY IT planning cloud,0
2021-10-07,Rise and Shine asan msft sq,0
2021-10-07,MSFT WHERE IS THE ELITE 2 VERSION,0
2021-10-07,AAPL MSFT NVDA Do ya still think this market is bear term for rest of this year The history chart shows the upper trend could be followed in which MA50 is 14886 so the price could go back to previous points if the chart is true,0
2021-10-07,MSFT bouncing off that uptrend on the weekly Wow that trendline was a recipe for success msft tech qqq chartidea,0
2021-10-07,Today s alerts at WDL AMD calls 0 09 gt 0 96 967 MSFT calls 1 34 gt 4 52 234 MRVL swing 65 gt 67 19 3 40 still active Day 1,0
2021-10-07,MSFT ARC a great introduction,0
2021-10-07,A weak recovery MSFT chart on,0
2021-10-07,Bringing DevOps Culture to Data Engineering Teams by is about to start Join in for the wonderful session LIVE URL AzureDevIndia Azure MSFT,0
2021-10-07,Microsoft Teams to automatically add webinar invites to attendees calendars MSFT Microsoft Teams MicrosoftTeams,0
2021-10-07,Want to learn how to use MicrosoftWhiteboard in MicrosoftTeams Check out this tutorial Microsoft Microsoft365 Office365 MSFT MSTeams Remotework MicrosoftEDU YouTube Howto Tutorials whiteboard MicrosoftWhiteboard,1
2021-10-07,MSFT Put MSFT MSFT,0
2021-10-07,MSFT MSFT LONG TradingView,0
2021-10-07,MSFT Put MSFT MSFT,0
2021-10-07,Good luck to everyone today Don t get FOMO Be patient Don t chase Let the trade come to your plan SPX SPY QQQ AMZN AFRM MSFT TSLA ROKU SQ AAPL,0
2021-10-07,Anyone else noticing the sudden increase in 100 dollar trades over on Microsoft today Looks like Short Sellers are getting their hands on MSFT,0
2021-10-07,Dont forget to join the AKS Office Hours with strebel and the MSFT Global Black Belt Team now,1
2021-10-07,MSFT Call MSFT MSFT,0
2021-10-07,StockstoWatch Stockstobuy Swingtrading Swingtrade Nasdaq100 Nasdaq nyse stockinfocus On daily closing MSFT TMO PEP SNOW MMC DASH MRVL DXCM FTNT EXC MSFT TMO PEP SNOW MMC DASH MRVL DXCM FTNT EXC,0
2021-10-08,What s on Xbox October 11th to 15th All Titles xbox xboxone xboxseriesx XboxSeriesS xboxgamepass xboxgaming xboxgaming microsoft msft,2
2021-10-08,MSFT has promised to actively look into right to repair gt when s AAPL s turn via,0
2021-10-08,Just a few hours left Take exciting quiz challenges at CloudQuiz amp WIN rewards Visit to register now KonfHub MSFT Azure,4
2021-10-08,NeW Windows11Upgrade is an Open Source tool meant to help bypass Microsoft Windows11 upgrade requirements tpm secureboot msft,2
2021-10-08,SPIRE GLOBAL SPIR SHORT SQUEEZE COMING Live Stock Coverage in Plain English with UNCLE BRUCE SOFI GME RKLB amc atip mttr me smrt SPIR cyxt StocksToWatch NASDAQ COVID crypto Options MARKETNEWS ShortSqueeze APPLE GS IBM MSFT,4
2021-10-08,With the CVE 2021 41773 vulnerability in Apache being exploited in the wild we encourage customers to immediately patch affected systems Microsoft365 Defender customers can use the device discovery and threat amp VulnerabilityManagement capabilities to respond to this threat,50
2021-10-08,Presenting GoL Clinics IOT a 5 week IoT Skilling initiative to level up on the Internet of things through building and deploy end to end IoT Solutions on Microsoft Azure Register today at MSFT MSFTAzure IoT,22
2021-10-08,Microsoft Ocean Plastic Mouse a great MSFT initiative I can t wait to get one,1
2021-10-08,It s all about quick profits when following flow on BBS Voice Take 10 20 amp run to the bank don t get too greedy Had some nice winners yesterday MSFT JPM AMD NVDA CARG TSLA,0
2021-10-08,Windows 11 How to use Microsoft Teams after upgrading to the new OS MSFT Microsoft Teams MicrosoftTeams Translated using MicrosoftFlow,1
2021-10-08,Nice limited 20th anniversary controller MSFT but can I just be able to purchase the Halo Elite 2 controller Please,0
2021-10-08,Innovative products by MSFT,0
2021-10-09,Bullish on MSFT,0
2021-10-09,Convert this into real one 100DaysOfCode MSFT MSFTStudentAmbassadors,11
2021-10-09,Want to learn how to share files outside of a team in MicrosoftTeams Check out this tutorial Microsoft MSFT MicrosoftEDU Remotework MSTeams Microsoft365 Office365 SharePoint SharePointOnline,2
2021-10-09,The Best Xbox One Accessories for 2022 xbox xboxone xboxaccessories microsoft msft gaming,2
2021-10-09,Users Experiencing Multiple Problems Following Microsoft Windows 11 Operating System Upgrade MSFT News,1
2021-10-09,became 225th company acquired by MSFT,0
2021-10-09,Our MSFT CLOSE PRICE prediction for coming weeks msft wealth Does it help,0
2021-10-09,MSFT 2021 10 08 CLOSE PRICE 294 850006 msft,0
2021-10-10,Hello Windows11 Microsoft MSFT Windows,1
2021-10-11,PIE MSFT 8 47 PM PST,0
2021-10-11,Microsoft Teams Update Now You ll Never Miss a Meeting Again MSFT Microsoft Teams MicrosoftTeams,0
2021-10-11,Last week we announced our partnership with the application marketplace for Microsoft users Find out what this new partnership means for automating amp optimizing business processes iPaaS MSFTAppSource MSFT,2
2021-10-11,Introducing Chat from Microsoft Teams on Windows 11 for your personal accounts MSFT Microsoft Teams MicrosoftTeams Windows11,0
2021-10-11,Microsoft announces updates to Smart Pages website builder MSFT Microsoft SmartPages IT,0
2021-10-11,MSFT Trending Microsoft outlaws Terrorism MSFT Now Microsoft is acting almost as though there is some competitive advantage in censorship because others are accused of the same,0
2021-10-11,What a weekend Fantastic time at watching amp Great time with some great partners NFL NewYorkJets ingrammicrocloud microsoft msft msftadvocate MSDyn365 relationshipbuilding london partnerdevelopmemt,0
2021-10-11,Morgan Stanley Starts Coverage On SoFi Tech with Overweight Target 25 Live Markets with Uncle Bruce SOFI GME RKLB amc atip mttr me smrt SPIR cyxt StocksToWatch NASDAQ COVID crypto Options MARKETNEWS ShortSqueeze APPLE GS IBM MSFT,2
2021-10-11,DKNG Citigroup Initiates Coverage at Buy PT 66 aapl tsla pltr msft penn amzn tsla nvda pton baba fb nflx roku ba sklz wmt sbux dis cat sq pypl v ma wiah dish uber t,0
2021-10-12,Liquid teams up with Microsoft to merge fixed line and Internet based calls MSFT Microsoft Liquid Phones Office365,0
2021-10-12,Microsoft for Startups alumni ElasticRun s platform is empowering grocery store owners in India s hinterland with its intelligent logistics and distribution network retail retailtech supplychain startup startups msft,3
