Date,full_text,retweet_count
2021-12-14,JNJ GOOG AAPL MSFT FB FDX CVS NSC ACN EPAM IT BABA LOW VMI TRMB ANSS GS sp500 wallstreet Fabulous insights amp stock ideas here from one of the US finest investors K Farr of Farr Miller amp Washington Definitely worth a watch,0
2021-12-14,Microsoft Teams now has end to end encryption support for one to one calls MSFT Microsoft Teams MicrosoftTeams,1
2021-12-14,Tata in talks to bring MSFT aboard digital venture Tata is replicating Reliance Jio s strategy via,0
2021-12-14,iFixit partners with Microsoft on official repair tools MSFT Microsoft iFixit IT,1
2021-12-15,dee msft,0
2021-12-15,Our AI runtime OnnxRuntime is now available on Android and iOS and powers some big MS features It allows more complete AI models to run on device delegating pieces that can be hardware accelerated to CoreML NNAPI and runs the rest with our runtime,15
2021-12-15,MSFT as promotor for CLOUDACT acceptment and agreements Cc krone,0
2021-12-15,MSFT seeing sustained chatter on wallstreetbets over the last few days Via msft wallstreetbets,0
2021-12-15,Those 5 stocks MSFT GOOG AAPL NVDA and TSLA account for more than one third of S amp P 500 s 26 return this year chart,0
2021-12-15,We encourage defenders to look for signs of post exploitation rather than fully relying on prevention log4j MSFT,0
2021-12-15,A year on continues to call for Aotearoa New Zealand to consider a CLOUDAct executive agreement with USA extract below is from its Oct 2021 submission to NZ s consultation on new UN cybercrime convention negotiations Released to me under OIA amp online soon,6
2021-12-15,SOL is MSFT while ADA is Apple Who wins VCs or the people FYI SOL took in 300m of VC record money during the summer,0
2021-12-15,msft Microsoft good RR ratio so it s interesting to try long,0
2021-12-15,December 15 2021 MSFT rolls out NEW Windows 11 Version DEV 22H2 InsiderPreviewBuild 22523 1000 rs prerelease is NOW available in the DevChannel lt gt ActiveDevelopmentBranch Dev builds not matched to a specific Windows release,7
2021-12-15,No one could ve predicted what happen with MSFT today,0
2021-12-15,If AAPL and MSFT join the rout the averages ain t gonna look pretty SPY QQQ,0
2021-12-15,Example MSP DOT ALGO Max III Trading alerts Stocks with 3 or more code yellow alerts Type Options MSFT MSFT had 5 code yellow alerts on options Monday and dropped 15 on Tue A good move for a 330 stock,0
2021-12-15,What is the closest to expiration you have purchased and swung any option spy dxy options trading qqq AAPL TSLA MSFT amzn ES F,0
2021-12-15,Bill Clinton and Prince Andrew should be called as witnesses in the Ghislaine Maxwell trial Bill Gates too But James Comey s daughter being the prosecutor means the prosecution is a joke MSFT,1
2021-12-15,ABOUT TIME Good job msft,0
2021-12-15,Microsoft to make Windows Terminal the default Windows 11 command line experience MSFT Microsoft Windows11 MicrosoftWindowsTerminal,2
2021-12-15,MSFT one of the most mentioned on wallstreetbets over the last 7 days Via msft wallstreetbets,0
2021-12-15,Top author for 4 out of 5 companies with highest market cap AAPL MSFT AMZN TSLA,1
2021-12-15,As we continue to monitor threats taking advantage of the CVE 2021 44228 Log4j 2 vulnerability we re seeing activity ranging from experimentation to exploitation from multiple groups including nation state actors and access brokers linked to ransomware,323
2021-12-15,MSFT with the cup and handle pattern Gap to fill in the AM whales,0
2021-12-15,printer goes brrrr Powell swingtrade msft MSFT Discord optiontrading MONEY gainsonly,0
2021-12-15,Most trending tickers on Reddit past 24 hours GME TSLA AMC AAPL NVDA MSFT QQQ AMD PLTR CLOV HOOD LCID ARKK FB WISH Data courtesy of Try them out,1
2021-12-15,Why Microsoft is opening up Dynamics 365 to more employees MSFT Microsoft Dynamics365 MicrosoftDynamics,1
2021-12-16,1 hour timeframe charts technical videos regarding all 78 instruments are available for members viewing ElliottWave Forex Indices Commodities stocks etf s CryptoCurrency YM F RTY F ES F NQ F USDX EURUSD AMZN GOOGL MSFT SPY BTC,0
2021-12-16,Fking BS market Was up yesterday and today its all fking Red rn so pissed off My stop loss didnt trigger wtf Massive win for msft turned to absolute garbage today Are we gonna turn around afternoon Why r we going down today,0
2021-12-16,MSFT Quick Update 15 12 2021 MSFT Microsoft fintwit,0
2021-12-16,MSFT one of the most mentioned on wallstreetbets over the last 24 hours Via msft wallstreetbets,0
2021-12-16,msft msft right at POC over 335 63 and i m seeing 337 59 341 06 344 16 334 32 333 01 332 16 331 05 329 5 335 63 337 59 339 08 341 06 344 13,0
2021-12-16,BZI POD Earnings MSFT News Dividends Here s How Much 100 Invested In Microsoft 5 Years Ago Would Be Worth Today,0
2021-12-16,If you invest on stocks which one your choice AAPL GOOGL FB NVDA MSFT TSLA,0
2021-12-16,It s the 10th amp last quiz of the month Set your reminders amp give it your Register here KonfHub CloudQuiz MSFT Azure DevOps,5
2021-12-16,Microsoft Teams Essentials for Small Business now available MSFT Microsoft Teams MicrosoftTeams SmallBusiness,0
2021-12-16,The picture across the S amp P 500 right now Technology struggling MSFT down 1 6 and AAPL down 2 7 Equities SPX Visit FP Markets,0
2021-12-16,Streamline and Strengthen your Security to become Cyber Smart with Microsoft Security Solutions from DataPros MSFT Microsoft ITSecurity,1
2021-12-16,MSFT seeing sustained chatter on wallstreetbets over the last few days Via msft wallstreetbets,0
2021-12-16,Nasdaq Portfolio Solutions Channel AAPL AMZN MSFT ONEQ Don t Overlook the Potential of this Nasdaq ETF,0
2021-12-16,The power of algotrading in SPX We anticipated this Measured Move on the Discord synchronized with the VIX Join us algotrading Elliottwave NDX SPX MSFT APPL AMZN GOOG GOOGL FB AMD NVDA SMH XLK JPM M PG UNH INTC VZ MA PFE,0
2021-12-16,1839 funds increasing their holding in MSFT vs last quarter msft stocks investing finance Find out more,0
2021-12-16,Check out my MSFT analysis on,0
2021-12-16,MSFT Quarterly chart Looking like a p o s penny stock 94 1 chance to go down The big funds won t be able to get out without pulling the rug for the whole market MSFT MSFT,1
2021-12-16,2 3rd of all Nasdaq Composite gains can be attributed to only 5 stocks MSFT NVDA AAPL GOOG and TSLA narrowmarket takemybreadthaway,8
2021-12-16,Make sure you check out DataPros Training Videos and other Video Content MSFT Microsoft Teams MicrosoftTeams MicrosofTtraining,0
2021-12-16,MSFT with a Daily Gap to Fill 335 19 339 08 This will likely gap in the morn so watch for a bounce off 339 for entry to upside Stocks StockMarket msft stockstowatch,1
2021-12-17,It s the last quiz of the month Set the reminders to participate and win amazing prizes Register here CloudQuiz Azure DevOps MSFT,3
2021-12-17,Instrument Microsoft MSFT Timeframe D1 Idea type Long window of opportunity Probability 59 88 Idea generation time America New York 2021 12 17 09 51 48 Idea generation price 323 19 USD Valid for 2021 12 31 10 business days MSFT Stocks NASDAQ,0
2021-12-17,The most popular stocks owned by Congress by chamber via Article msft amzn aapl googl dis,0
2021-12-17,You know why the dot com bubble burst Because companies that didn t do anything other than have a website had billion dollar valuations based on this new internet thing That s not today s tech qqq spy aapl meta amzn tsla nflx nvda msft NASDAQ,1
2021-12-17,Microsoft is pushing the Control Panel aside in its latest Windows 11 updates MSFT Microsoft Windows Windows11 MicroosftTeams,2
2021-12-17,MSFT having said I want to keep diversified I like the look of the chart I caught over a 3 move last week but this time its dropped below the 50ma however I m giving it a go back in with a nibble at 320 5,0
2021-12-17,We re are going live Don t miss the last weekly quiz Start playing KonfHub MSFT Azure CloudQuiz DevOps,5
2021-12-17,Most trending tickers on Reddit past 24 hours TSLA NVDA AAPL QQQ RIVN AMD GME PLTR MSFT ADBE Data courtesy of Try them out,2
2021-12-17,Success Post from user THUMP CONNECT in Discord MSFT MSFT StocksToWatch StocksToBuy,0
2021-12-17,New Microsoft Teams Phone tech helps connect modern and legacy devices MSFT Microsoft Teams MicrosoftTeams TeamsPhones,1
2021-12-17,Hot stocks this morning rvn tsla nvda aapl msft QQQ,0
2021-12-17,MSFT Call MSFT MSFT,0
2021-12-17,Check how to embed Oracle Analytics in Microsoft Teams Article by oracle oracleanalytics microsoft teams msft orcl analytics data,3
2021-12-17,MSFT Call Lotto MSFT MSFT,0
2021-12-17,Hey MSFT what s up with Windows11 doing this,0
2021-12-18,YTD Performance Ethereum 442 Bitcoin 60 shows BitcoinCrash hysteria re Cryptos misplaced Google 65 compares to BTC but MSFT 49 AAPL 32 TSLA 28 SPX 25 JPM 25 all lower Eurozone Germany s DAX 13 China s Evergrande 89,0
2021-12-18,EvaAnderssonDubin GlennDubin BillGates jizzlanemaxwell maxwelltrial MaxwellTrialTracker MaxwellCrimeFamily epsteincoverup EpsteinFiles jeffreyepstein lesliewexner LB ANF MSFT,0
2021-12-19,New post FAANG TSLA MSFT MA V RIVN AnirudhSethi has been published on Financial Occultist,1
2021-12-19,MSFT looks like a great setup A few levels to watch on the chart but everytime it gets in this zone on the Williams R it seems to make a move upwards Microsoft MSFT StocksToBuy stockmarkets stocks,1
2021-12-19,ZM will go crazy this week while we wait on MSFT to find the floor and create new highs,0
2021-12-20,MFAAANNGT Looking for AMZN AAPL MSFT to lead reversal up MSFT FB AMZN APPL AMD NVDA NFLX GOOGL TSLA SPY QQQ YM NQ ES VIX DowJones SPX NASDAQ imo maybe have intraday bottomed for now looking for bounce up,0
2021-12-20,MSFT seeing an uptick in chatter on wallstreetbets over the last 24 hours Via msft wallstreetbets,0
2021-12-20,MSF Microsoft Putting a top in for a correction Only my opinion Microsoft MSFT Stocks,1
2021-12-20,Just my opinion MSFT Microsoft Corp is topping out and in a daily sell Also very close to a weekly Sell 310 314 280 285 a Monthly Sell MSFT Microsoft Sell,0
2021-12-20,Oracle snags Cerner in 28B mega deal to make a big move into healthcare MSFT Microsoft Oracle Healthcare MicrosoftHealth,0
2021-12-20,MSFT Easy scalps MSFT chart on,0
2021-12-20,How to easily manage scheduling with Microsoft Bookings MSFT Microsoft Booking MicrosoftBookings,0
2021-12-20,Microsoft aims to improve Teams Rooms experience MSFT Microsoft Teams MicrosoftTeams TeamsRooms,0
2021-12-20,Microsoft Corporation MSFT closed at 319 91 score 35 credit rating A,0
2021-12-20,had a dream bout msft and wanna do a call option but knows very little about the space,0
2021-12-20,MFAAANNGT Reversing All Green Candles on 15 mns chart including QQQ MSFT FB AMZN APPL AMD NVDA NFLX GOOGL TSLA SPY QQQ YM NQ ES VIX,0
2021-12-20,Wells Fargo Analyst Reiterates Buy Michael Turrin analyst at Wells Fargo reiterates Buy Rating on MSFT with a price target of Is MSFT on your radar Check this out MSFT MSFT Technology stockstowatch StocksToTrade,0
2021-12-20,Now its Reps Turn lol stocks stockmarket cnbc aapl msft msft aapl,0
2021-12-20,MSFT was the 14th most mentioned on wallstreetbets over the last 7 days Via msft wallstreetbets,0
2021-12-20,As a MSFT Retail Partner of the Year we ve enabled omnichannel capabilities for some of the world s biggest brands Want all the details Chat us up at NRF2022,1
2021-12-20,1839 funds increasing their holding in MSFT vs last quarter msft stocks investing Find out more,1
2021-12-20,MFAAANNGT APPLE MSFT AMZN NVDA are hiking MSFT FB AMZN APPL AMD NVDA NFLX GOOGL TSLA SPY QQQ YM NQ ES VIX Looking like AMZN GOOGL AAPL going to power the bullish recovery again Let s see GL,0
2021-12-20,2203 funds holding MSFT as one of their top ten holdings This is up 110 vs last quarter msft stocks investing Find out more,0
2021-12-20,If futures remain red we could see a move down to 373 374 on QQQ tomorrow Would be a nice buying opportunity in tech names for a Santa rally imo qqq nvda amd msft aapl,0
2021-12-21,The Winter Solstice is the 22nd Solar Term while the sun reaches its vertical position over the Tropic of Capricorn WinterSolstice RUC SFRUC MSFT Fintech blockchain,0
2021-12-21,MSFT seeing sustained chatter on wallstreetbets over the last few days Via msft wallstreetbets,0
2021-12-21,Most traders don t even pay attention to MSFT and it s ashame,0
2021-12-21,MSFT Teams is reportedly under investigation for its free NHS gift,0
2021-12-21,big gains in the discord caught lows on fb msft played spy and qqq downside then up spy msft qqq es f msft spy fb OptionsTrading StocksToTrade gainsonly gains Discord,0
2021-12-21,MSFT working it s way into the top 20 most mentioned on wallstreetbets over the last 7 days Via msft wallstreetbets,0
2021-12-21,At the frontier of this exciting new metaverse opportunity sits MSFT which is well positioned to monetize this potentially multi trillion dollar opportunity MSPartner,0
2021-12-21,Synapse December Update is out AzureSynapse Spark Pipelines MSFT The Map Data tool looks very cool,2
2021-12-21,Amazon Technical Analysis Please like and share if you appreciate this chart Elliottwave algotrading NDX SPX MSFT APPL AMZN GOOG GOOGL FB AMD NVDA SMH XLK JPM M PG UNH INTC,2
2021-12-21,My phone from 2000 amazing how MSFT screwed up the opp I remember the PM of the group telling one of my customers that business will drive the adoption of mobile not consumers epic fail,0
2021-12-21,How to Join the Xbox Insider Program xboxinsider xbox xboxone xboxseriesx xboxseriess microsoft msft,2
2021-12-21,MSFT was the 14th most mentioned on wallstreetbets over the last 24 hours Via msft wallstreetbets,0
2021-12-21,Taboola teams with Microsoft to launch audience network MSFT Microsoft Taboola MicrosoftTeams,1
2021-12-21,Make Teams Edge and PowerPoint pop with Pantone s color of the year MSFT Microsoft Teams MicrosoftTeams PowerPoint Edge MicrosoftEdge,0
2021-12-21,Vox Markets Voices of Wall Street Wedbush Securities Managing Director Dan Ives Stocks mentioned include ZS DOCU TSLA APPL UBER LYFT FB PANW SAIL CYBR PYPL SQ COIN MSFT,0
2021-12-21,How to easily manage scheduling with Microsoft Bookings via msft O365 M365,0
2021-12-21,Great Story MSFT,0
2021-12-21,MSFT Call MSFT MSFT,0
2021-12-21,Check out my MSFT analysis on levels to watch above 324 level high volume zone SMA 50 D 328 level levels to watch below 320 level high volume zone daytrading StockMarket,1
2021-12-21,4 amp 1 hour timeframe charts technical videos regarding all 78 instruments are available for members viewing ElliottWave Forex Indices Commodities stocks etf s CryptoCurrency YM F RTY F ES F NQ F USDX EURUSD AMZN GOOGL MSFT SPY BTC,0
2021-12-22,MSFT MSFT,0
2021-12-22,Here are the AAPL MSFT SPY charts with my levels Will update the performance of these two tweets later autotrades,0
2021-12-22,Manage your business from anywhere with Cloud Services from DataPros Contact us for your free consultation today MSFT Microsoft Cloud CloudServices,0
2021-12-22,MSFT was the 13th most mentioned on wallstreetbets over the last 7 days Via msft wallstreetbets,0
2021-12-22,MSFT MSFT DarkPool lvls above are both gt 1 5B in value Stock will interact at those levels and if successful will push above to my exit The longer it pauses at those dark pool levels to gain steam the higher my profit Jan 23 325c exit 333 59 autotrades buyingtime,0
2021-12-22,In Dec of 99 Microsoft was worth 614 billion By Dec of 2000 it crashed below 250 billion as the tech bubble burst Microsoft s market cap wouldn t rise above 500 Billion again until 2017 The stock did nothing for 15 years Where s the next Bubble Msft qqq spy,0
2021-12-22,Tell your favorite guru to post gains in real account like me bet they wont cause your mans is a fake ass cat msft spy qqq spy qqq msft Discord Cash gainsonly Hit me up if you want to learn,1
2021-12-22,These tech stocks can withstand a rising rate environment traders say MSFT ARKK AMD INTC,0
2021-12-22,One of my favorites AppTio is running is microsoft azure Are the startups of the future going to be powered by Msft Tech Technology DigitalTransformation Data AI IT Cloud CloudComputing PublicCloud from,3
2021-12-22,T to MSFT AT amp T selling ad tech unit Xandr to Microsoft yahoo finance,0
2021-12-22,News roundup FDA authorizes PFE covid 19 pill TSLA and AAPL jump BABA falters more AMZN GOOG MSFT FB NAKD,0
2021-12-22,Added today AMD NVDA TECL AMZN MSFT AAPL SPY positions Mostly Jan23 calls w Jan22 amp Mar22 calls mixed in Usually trade a smaller number of positions at once so will do my best to update these as the days go by All setup w conditionalorders based on my lvls autotrades,1
2021-12-22,MSFT MSFT Update hit Jan 20 2023 325c conditionalorder filled at 333 56 lvl 15 after clearing both large DarkPool lvls directly below Once retail investors realize what s going on I m selling while they are buying bc I made my bag lowrisk autotrades leveltolevel,0
2021-12-22,Today s alerts MSFT hit 67 at close Entered some new Tesla s closed at 15 QQQ from Zoltar MSFT TSLA AVCT,0
2021-12-22,How to visualize security and threat information in Microsoft Power BI MSFT Microsoft BI PowerBI MicrosoftPowerBI,1
2021-12-22,MSFT beautiful calls today WinningIsSoEasy MSFT BlessedAndGrateful XoThrax Gone,0
2021-12-22,MSFT bouncing on 326 high vol zone from yesterday levels above to watch 9ema daily and 20 sma daily levels below 326 and 323 5 vol areas Avg daily range projection high 331 area and low 323 area daytrading OptionsTrading Daytrade,0
2021-12-22,Success Post from user Nate G in Discord MSFT MSFT StocksToWatch StocksToBuy,1
2021-12-22,MSFT MSFT someone throwing some weight around,0
2021-12-22,What s next for the Microsoft Cloud MSFT Microsoft Cloud MicrosoftCloud,1
2021-12-23,MSFT was the 12th most mentioned on wallstreetbets over the last 7 days Via msft wallstreetbets,0
2021-12-23,As a certified Microsoft Partner we offer a unique variety of Microsoft Solutions that can give your business a strong competitive advantage Contact us for your free consultation today MSFT Microsoft MSP DataPros CSP,0
2021-12-23,Boom If you are a MSFT developer you want to take a look at this And there s more Excel stuff to come How to sync two Excel Sheets with Baseledger Baseledger,51
2021-12-23,Check out my MSFT analysis on msft,0
2021-12-23,Flat Bottom triangle MSFT chart on,0
2021-12-23,SPY looking like it will run again today Looking for target and hold of 472 71 Downside looking for bounce off 466 58 stocks stockmarket SP500 QQQ tsla AAPL MSFT fb NVDA,0
2021-12-23,msft MSFT wave 5 started and its myabe big like wave 1 but shortterm target 370 its not santa rally,0
2021-12-23,Today s alerts Only 1 loss was a spy hedge for 20 to 22 TSLA NVDA MSFT STZ,0
2021-12-23,for all Developers MSFT Excel,0
2021-12-23,What s MSFT gonna do today I know of a few MSFT traders on here that blow it out the park every time be rambling Let s see what happens WinningIsSoEasy,1
2021-12-23,In this latest Voice of Wall Street series Paul Hill of speaks to Michael Farr President amp CEO of Farr Miller amp Washington JNJ GOOG AAPL MSFT FB FDX CVS NSC ACN EPAM IT BABA LOW VMI TRMB ANSS GS,1
2021-12-23,Choppy waters still make money HLT TSM F MSFT UnusualWhales FollowTheFlow,0
2021-12-23,May I have your attention HA website on MSFT Cloud is scheduled to undergo its first planned maintenance starting tonight after markets close We are upgrading our VM to a more efficient model thus requiring a new DNS It will take about day for new DNS to become addressable,0
2021-12-23,This program has performed an illegal operation and will be shutdown MSFT,0
2021-12-23,MSFT seeing sustained chatter on wallstreetbets over the last few days Via msft wallstreetbets,0
2021-12-23,How to sync your contacts between your iPhone and Microsoft Outlook MSFT Microsoft iPhone Outlook,1
2021-12-23,Describe Windows without saying Windows,416
2021-12-24,Merry Christmas The application for 2022 MSFT Program has started Scan the QR code in the poster to learn more Christmas RUC SFRUC MSFT fintech blockchain,0
2021-12-24,How to Earn Microsoft Rewards Easily microsoft microsoftrewards rewards msft,1
2021-12-24,As AI and technology continues to improve drastically one stock every long term investor should buy and hold is MSFT,0
2021-12-24,Christmas free book giveaway We want to make someone happy with a free Mastering Microsoft Endpoint Manager book for the holidays to educate yourself on MEM and Windows365 for the new year Just reply like and you are in Merry Christmas,81
2021-12-24,You re here because you were chosen halo xbox msft,0
2021-12-24,4 amp 1 hour timeframe charts technical videos regarding all 78 instruments are available for members viewing ElliottWave Forex Indices Commodities stocks etf s CryptoCurrency YM F RTY F ES F NQ F USDX EURUSD AMZN GOOGL MSFT SPY BTC,0
2021-12-24,MSFT Microsoft Corporation 5 Year Prediction 404 84 Potential 23 0 MSFT,0
2021-12-24,Low risk stocks for decades to come msft amp goog,0
2021-12-24,Vox Markets Voices of Wall Street NewEdge Wealth Founder and Managing Partner Rob Sechan MSFT GOOG TSM JPM HD EOG HLT DXCM SAFE GTII ROK,0
2021-12-24,Co written by my colleague a chance to upskill MSIntune MEM MSFT,0
2021-12-25,MSFT Microsoft MSFT The best scenario for climbing TradingView,0
2021-12-25,MSFT LONG MSFT chart on,0
2021-12-25,Check out my MSFT analysis on msft,0
2021-12-26,The first trade we entered into after the COVID crash was MSFT The initial position is over 620 days old and we have accumulated around 100 profit on that As you can see we have also compounded along the way and these positions are also in profit trendtrading stocks,1
2021-12-26,MSFT was the 13th most mentioned on wallstreetbets over the last 7 days Via msft wallstreetbets,0
2021-12-26,MSFT Gap above 333 needs to hold,0
2021-12-26,MSFT has had some wild swings as of late I see us coming back to 329 37 and digesting the move we just made a little before coming back to the 338 86 area MSFT Microsoft stocks StockMarket spy SP500,0
2021-12-27,MSFT working it s way into the top 20 most mentioned on wallstreetbets over the last 7 days Via msft wallstreetbets,0
2021-12-27,MSFT is the most overlooked underestimated and undervalued Augmented and Virtual Reality plays right now MSFT MixedReality AugmentedReality VirtualReality MR AR VR Investing Stocks,0
2021-12-27,Holding MSFT PFE SPY call into tomorrow Think we continue to break a few new highs before a bit of a cool off,0
2021-12-27,7 000 flights worldwide were cancelled since Friday mostly due to Covid cases among flight crews Popular tickers in Gatsby last week SPY TSLA AAPL BABA SQQQ AMC QQQ NVDA PFE NFLX AMD RBLX SEAC T MSFT UVXY MRNA RIOT F NOTINVESTMENTADVICE,1
2021-12-27,Success Post from user Nate G in Discord MSFT MSFT StocksToWatch StocksToBuy,0
2021-12-27,MSFT MSFT Daily,0
2021-12-27,MSFT Call Lotto MSFT MSFT,0
2021-12-28,What do you do on your days off I found it interesting when public companies precious metals and crypto were ranked next to each other so I made a pie chart of the top 15 Gold APPL MSFT GOOG 2222 SR AMZN Silver TSLA FB BTC NVDA BRK A TSM TCHEY ETH,0
2021-12-28,reading through some MSFT announcements regarding Microsoft Information Protection and counting how many of my customer projects are affected by that compliance dataclassification,4
2021-12-28,My company has been working with Their stock MSFT is a BUY the Aroon Candlestick trend 3 years shows a pop coming very soon Developed by Tushar Chande in 95 as a way to identify the end of a current trend Scoop amp Score,0
2021-12-28,This is what I like to see early mornings It s something sexy about this afrm qs Tesla msft,0
2021-12-28,4 amp 1 hour timeframe charts technical videos regarding all 78 instruments are available for members viewing ElliottWave Forex Indices Commodities stocks etf s CryptoCurrency YM F RTY F ES F NQ F USDX EURUSD AMZN GOOGL MSFT SPY BTC,0
2021-12-28,Microsoft may be looking beyond the Duo to a triple fold phone MSFT Microsoft Duo MicrosoftDuo MicrosoftPhone,1
2021-12-28,Ending my 2nd consecutive day green Why Because I exercised some discipline and DID NOT over trade PFE MSFT,0
2021-12-28,last 12 months performance Green StockMarket stocks StocksToTrade just few stocks from top list 1 googl 65 38 2 tsla 64 3 msft 51 59 4 unh 45 38 5 aapl 31 16 pypl 19 36,1
2021-12-28,MSFT Double bottom pattern in Microsoft TradingView,0
2021-12-28,Microsoft launches new Defender capabilities for fixing Log4j MSFT Microsoft Defender Log4j,0
2021-12-28,Strategic Capital Advisers Inc Purchases 872 Shares of Microsoft Co NASDAQ MSFT,0
2021-12-28,stockmarkets recap We discussed nvda nvda msft msft and also fb facebook options Follow us Watch full video,0
2021-12-28,Peace and Blessings Most Mentioned Tickers on WSB via 1 TSLA 2 AAPL 3 AMZN 4 NVDA 5 GME 6 AMD 7 QQQ 8 MSFT 9 FB 10 NFLX stockstowatch stockmarkets stocks StockMarket stocksinnews,2
2021-12-28,Hey guys I m moving to twitter because webull banned me for 90 days for no reason Going to try to post here actively I day and swing trade options AAPL spy msft nvda cost AMD cvs upst F TSLA calls on each Watch for a weak open dip and rip,0
2021-12-28,MSFT another nice opening dip and bounce then chopped all day TradingView Daytrade TRADINGTIPS tradingstrategy optiontrading OptionsFlow MSFT Microsoft SPY QQQ,0
2021-12-28,Enhance modern workplace collaboration with Microsoft Teams MSFT Microsoft Teams MicrosoftTeams Linkedin,0
2021-12-28,Most trending tickers on Reddit past 24 hours TSLA AAPL AMZN GME AMD NVDA PLTR MSFT Data courtesy of Source,1
2021-12-28,MSFT with some early positive pre market movement Road to 400 stockstowatch stocks Wealth trading,0
2021-12-28,MSFT MSFT 45Min TradingView,0
2021-12-29,A new functionality shipped by Microsoft to Defender setting klaxons blaring in SOCs after Defender itself flagged it as dangerous p s folks it looks like OpenHandleCollector exe isn t really going to hurt you infosec cybersecurity msft,1
