Date,full_text,retweet_count
2021-04-15,Mercedes Benz unveils new flagship EQS electric sedan to take on Tesla Tesla TSLA Mercedes,2
2021-04-15,AMC GME TSLA ocgn good morning Ape Family i hope you guys are enjoying your day Below is the ortex data for each of the above ticker symbols looks like AMC is almost at 100 utilization while ocugen is already there Enjoy,15
2021-04-15,TSLA AAPL near term inflection point for the bears need to see downside follow through,2
2021-04-16,TSLA Swing BPCS It seems like it is not giving me an opportunity to enter the trade at my price Any news on this quick pop TSLA,0
2021-04-16,Doge is at a 34 billion dollar market cap I think dogecoin is chasing a squirrel to the moon TSLA BTC ETH,2
2021-04-16,A Tesla s security cameras helped police connect a man to several crimes including a fire that destroyed a Black church Tesla TSLA,4
2021-04-16,doge to the moon doge TSLA ElonMusk,0
2021-04-16,10k 100k Challenge Account starting from March Here is it now 1 and 1 2 months later FridayVibes fridaymorning FridayThoughts cryptocurrencies FridayMotivation FridayFeeling motivation tradingview tsla,6
2021-04-16,I got my crazy gift NEBL BCH RVC ONTX XEP AMC CELO Fx DPW hexo GRT FPRX Wentz ETH TOT CedarFX NEAR MSFT SPAQ DIS TNXP NU MKR pf CHFS LINK mck FTT xmr SNSS ATOM CLRO tsla ICON aave weed TRX,1
2021-04-16,Found some other up close photos of the Cybertruck on IG I can t wait for this beast TSLA TSLA User Mrbrownsince82 on IG,106
2021-04-16,Tesla has made 1 billion from its bitcoin investment in just 10 weeks Tesla Bitcoin TSLA,2
2021-04-16,When RBLX hit the market we knew it would be a fun one to trade 70 profit on calls finance options stonks stockmarket wsb elon tsla gme trading robinhood marketing fitness optionstrading pennystocks stocks marketwatch tdt financialfreedom,0
2021-04-16,dogecoin is the TSLA stock of crypto Get in before its too late,23
2021-04-16,Gonna buy my first TSLA with dogecoin TSLAIndia,3
2021-04-16,Gonna start sharing my trading amp investing journey on Twitter 634 not bad for an hour of work Always down to answer any questions and help any one get started daytrading tsla,0
2021-04-16,Tesla Model X Plaid makes an appearance at Fremont test track with Tesla Semi Tesla TSLA,2
2021-04-16,Who would you rather invest your money with Automakers that trying to figuring out how to build a good EV or someone who s already figured out how to build factories that produce Excellent EV s GigaBerlin GigaTexas ElonMusk TSLA,2
2021-04-16,Friday tiny gains stocks invest nio nokia wallstreetbets WallStreet optioncalls amc AMCtothemoon tsla evs,0
2021-04-18,Amazon to start accepting dogecoin payment wsb wallstreetbets tesla gme tsla DogeDay420 stocks stockmarket gamestop doge DogecoinToTheMoon dogearmy zomedica doge robinhood Bitcoin Dogecoinarmy egod adddogecointocoinbase,4
2021-04-18,AMC GME TSLA STONKS MOONING wallstreetbets Good Morning folks Happy Sunday This morning we have quite a bit to go through as I ve been fairly quote with the DD up until this point But I ll be posting back to back this am Hopefully you all will have a better understanding,14
2021-04-18,Imagine A hedge fund manager who did a negative 0 1 past quarter vs the 6 that the SP500 did is now claiming Elon and Chamath are responsible for the GameStop insanity A hedge fund manager Not even a good one it seems Wow shoutout to TSLA for kicking his ass lol,28
2021-04-18,Another great week to be a Titan Check out some of our top trades finance options stonks stockmarket wsb elon tsla gme trading robinhood marketing fitness optionstrading pennystocks stocks marketwatch tdt financialfreedom money invest trending motivation,0
2021-04-18,1 2 TSLA TSLA Called the pop big time This closed over major 718 resistance of the week and broke out of bearish wedge here Most of last wk was consolidating after pop which is good sign Soon to see,4
2021-04-19,Your research as a private individual is better than professionals Data logs recovered so far show Autopilot was not enabled amp this car did not purchase FSD Moreover standard Autopilot would require lane lines to turn on which this street did not have,3324
2021-04-19,Tesla booth at Auto Shanghai Her shirt says brake failure and she shouted The brakes are not working This is all over social media in Mainland China now More details TSLA TSLAQ AutoShanghai,17
2021-04-19,TSLA TSLA keep watch on 745 Above can test 765 775 next Keep in mind below TSLA can test 730 719 next before seeing a move near 700,0
2021-04-19,The stock market can dramatically go down but the trend is always upward wallstreet StockMarket investingtips stocks investing101 FinancialFreedom money picturethis trading Markets savings passiveincome investing TSLA retirement 401k history mondaythoughts,0
2021-04-19,Major flaws in the Model S One crashed TSLA,0
2021-04-19,My response to the Tesla FSD accident in Texas,133
2021-04-19,TSLA has all the elements of a classic bubble and if we have failed at the neckline 780 800 we are now in the bust phase PS This is still by a factor of X2 the largest holding of ARKK and ARKQ So along with her crypto holding it could be a rough week,44
2021-04-19,Tesla brakes malfunctioned female car owner was beaten at Shanghai auto show tsla nio xpev li models model3 modelx,2
2021-04-19,When you see the market is down pre market on Monday morning There s only 1 way to prepare bitcoin btc stocks stockmarket tsla tesla nio coinbase crypto cryptocurrency,2
2021-04-19,TSLA TSLA New case study this week Read below,5
2021-04-19,Even FSD doesn t allow for such a non sense situation that happened in Texas Maybe they had cruise control on and had the seatbelt under their butt before they hopped out of the seat while cars moving You can do that in any car that s called stupid TSLA TSLA TSLAQ TSLAQ,8
2021-04-19,Tesla owner not too happy tesla teslacars teslachina tsla tsla teslaclub drivingchina carsinchina chinesecars chinacars ev evs nev electriccar,3
2021-04-19,TSLA Swing Got triggered and went back above 100 SMA TSLA,0
2021-04-19,TSLA Swing Got a fill at first entry TSLA,0
2021-04-19,The National Highway Transportation Safety Administration has launched a probe into the fatal crash of a Tesla Model S in Texas Saturday Tesla TSLA,2
2021-04-19,TSLA has all the elements of a classic bubble and if we have failed at the neckline 780 800 we are now in the bust phase PS This is still by a factor of X2 the largest holding of ARKK and ARKQ So along with her crypto holding it could be a rough week,44
2021-04-19,TSLA has all the elements of a classic bubble and if we have failed at the neckline 780 800 we are now in the bust phase PS This is still by a factor of X2 the largest holding of ARKK and ARKQ So along with her crypto holding it could be a rough week,44
2021-04-19,Entry Alert BTO Z 5 21 133 00C 9 70 optionstrader optionstrading options stockoptions StockMarket optionsalert optionsproalert daytrading BTC BTC TSLA TSLA SPY SPY Z,0
2021-04-19,WCAT MAKING SOLID MOVES amp ON THE RISE AGAIN THE FIRST ASSET IS SENDING THIS NORTH OF 5P SPAC BITCOIN ETHERIUM ARB OBC CRYPTO GME TSLA Stocks StocksToWatch SpacSquad StocksInNews Investing FTSE AIM MONEY LSE SHARES OIL TRADINGTIPS FOREX AEX AMX,1
2021-04-19,China official Xinhua urges Tesla to match users expectations Tesla TSLA,5
2021-04-19,Best question on the TSLA earnings call so far Battery prices need to still dramatically drop batteries TSLA GigaBerlin,1
2021-04-19,TSLA Swing Reducing the risk Partial profit at 713 I can scale in back on the dips Holding 20 shares amp debit call spread TSLA,0
2021-04-19,Gotta take advantage of this ridiculous media shitstorm tsla stocks doge tesla,0
2021-04-19,Wall Street just needed a reason for TSLA to close that gap Wall St shakeout at its finest,4
2021-04-19,This video shows Tesla automatically pulling over when driver unbuckles seat belt while using FSDBeta FSD TSLA TESLA,1
2021-04-20,What an explanation tsla greatest car ever in a deadly accident driver unhurt others killed tslaq enabler,0
2021-04-20,Descending wedge on the daily and a nice range of support around 1 5 cents I like the way this chart looks HEX in May just might HEX BTC ETH BNB tron Doge Tsla xrp ada dot link airdrop nft money business entrepreneur,1
2021-04-20,BIG TRUTH tsla doge Teslacrash gme StockMarket,0
2021-04-20,Even the new iPad has Lidar TSLA,0
2021-04-20,AMC GME TSLA KOSS OCGN good morning everyone I hope and trust you have had a wonderful morning despite what is going on in the market Below is your ortex data and a few words of wisdom as we go through this valley today,12
2021-04-20,APTV is a promising business priced at a discount and a good way to get exposure to Tesla and other EVs without the absurd meme stonk valuations in some EV names My dd on why the stock has room to 200 currently 140 a long term hold for me EV APTV TSLA,1
2021-04-20,Brand new video uploaded into YouTube Why did Cathie Wood sell Tesla shares to buy Coinbase COIN coin coinbase btc bitcoin cryptocurrency crypto cathiewood arkk tesla tsla stocks stockmarket investing,1
2021-04-20,Tesla Gigafactory Nevada gets another batch of rooftop solar panels Tesla TSLA Nevada,3
2021-04-20,Tesla s US market share was probably close to peak in 2020 Analyst Tesla TSLA,0
2021-04-20,TSLA TSLA Textbook bounce off the volume shelf today,7
2021-04-20,Elon keeps his promise and stock goes crazy Watch the stock climbing TSLA,0
2021-04-20,Today s Entry trigger for TSLA was 722,0
2021-04-20,So far TSLA looking better TSLA ToTheMoon,0
2021-04-20,We noticed an interesting inconsistency between some analyst ratings amp TSLA price performance Since Sept 19 Citigroup s C sell ratings were almost always at a bottom before price continued to move up strong Read more here TSLA SPY QQQ IWM,10
2021-04-20,The new iPad Pro AppleEvent,0
2021-04-20,Here is how the morning plays went for today ROKU NVDA TSLA QQQ BA,1
2021-04-20,1 2 TSLA TSLA Over weekend FUD news of crash that killed 2 Elon is fighting against it Some pop AH here This broke below the MAs today and came back all above it on the 100MA As long as we can base the MAs and stay around 718 we can hold,0
2021-04-20,How to get a free random Stock 1 join Bitpanda gt 2 invest at least 25 3 get a free random stock worth 5 200 as soon as Bitpada Stocks is live On top of that you will also be eligible to win a Tesla Model 3 Performance TSLA raffle,6
2021-04-20,TSLA Update TSLA is building a nice support at 713 If the pennant breaks up we could see some movement to 784 Right now I do believe we would be over 800 if it wasn t for the Texas Crash Earnings next Monday let s see if we have a strong run up,0
2021-04-20,Tesla China launches new Special Handling Team after Shanghai Auto protest Tesla TSLA China,1
2021-04-20,doge420 Is too busy defending tsla today to tweet some dogecoin love,1
2021-04-21,AMC GME Stonks Market TSLA wallstreetbets mooning squeeze OCGN Alright good morning everyone I hope and trust you all have had a wonderful morning thus far Lets get into this new SR DTC 2021 007 rule shall we Today s Recap is about Going Digital,25
2021-04-21,Option Traders Are Undecided On Tesla s Price Action And So Is Tesla s Stock Tesla TSLA,2
2021-04-21,TSLA TSLA Worth noting the win rate for April since the 2016 lows is 83 and this April is right in line with that strong historical seasonality However this drops off rather significantly into May with only a 40 win rate over the last 5 years,5
2021-04-21,Eye popping sale numbers by TSLA in China Seems the distance from developing to developed won t be covered in my lifetime,0
2021-04-21,Plan Execute Here is the morning plan and key price levels where the trades were executed Also an example of TSLA chart from pre market showing where how we wanted to time our entry TSLA NVDA AMZN SQ ROKU,1
2021-04-21,Update Z 5 21 133 00C 11 30 P L 16 49 from entry 9 70 optionstrader optionstrading options stockoptions daytrading StockMarket optionsalert optionsproalert BTC BTC TSLA TSLA SPY SPY Z,2
2021-04-21,TSLA Update Broke up out of pennant and is holding 713 well I do believe over 735 is the pivotal point and we see a retest of 750 785 Earnings on Monday let s see if we can explode,0
2021-04-21,I m just a man from the future TSLA,0
2021-04-21,TSLA spent more on Bitcoin than on R amp D in 2020 TSLA made more profits from Bitcoin than from selling cars 1 billion in Bitcoin purchases equals CO2 emissions of 1 2 mn ICE cars driven for 1 year,15
2021-04-21,Tesla s family of vehicles sighted in Laguna Seca in potential Model S Plaid attempt Tesla TSLA,2
2021-04-21,The Original Tesla Model S Aero Wheel Revived tesla teslamotors tsla teslamodels wheel wheels aerowheels rim rims,1
2021-04-21,TSLA Today was some major bullish engulfing Algo s read this as a major bullish sign and set limit orders to buy AH PM and at open tomorrow Express train leaving the station OptionsTrading leaps TSLA,0
2021-04-21,TSLA was the star trade today nobias tradelevels playedputscalls options tradewhatyousee spy qqq,1
2021-04-21,Power Hour happening tsla Pre earnings rally should have started TSLA trading at 738 94,1
2021-04-21,Long Swing positions TSLA amp NIO got a nice bounce from the entry price GRWG Back to the entry price Didn t take the loss yesterday TW0E SwingTrading TSLA NIO GRWG,0
2021-04-21,AMC GME TSLA KOSS NAKD I hope and entrust you all are having a wonderful morning For AMC Koss and Nakd looks like are utilizations match up for today we are at 100 folks See your ortex info below now if only we can get our options folks not to buy short calls that are,19
2021-04-21,TSLA that Bullish Trend bar from 50sma,1
2021-04-21,Mammoth triangle building up for tsla,0
2021-04-21,TSLA sums it up nicely,0
2021-04-21,TSLA Rocket,0
2021-04-21,TSLA 1D stochastics LT Stoch now gt 50 if TSLA break above 750 80 coming sessions then we are heading gt 1000 very soon,2
2021-04-22,Was The Smart Money Right About Piling Into Tesla Inc TSLA Tesla TSLA,2
2021-04-22,TSLA TSLA Updated analysis into Thursday Watch below,6
2021-04-22,I know I will sound ridiculous I have my estimates TSLA will be a 64 Trillion company in next 2 decades or less Only a force majeure can push it further Corora did nothing to its growth story May be WW 3 TSLA,4
2021-04-22,Who else is Hodling HOLD dogecoin DiamondHands hodler tothemoon Dogecoinarmy TSLA,0
2021-04-22,TSLA A Car company An Energy company A Distributed Utility Robotaxi Software Company Battery Company A Chip Company A company that make machines which make machines Completely vertically integrated All in one,4
2021-04-22,tsla trading at 752 07 Pre earnings rally has started U S weekly jobless claims keep falling bullish TSLA,1
2021-04-22,If Dogecoinarmy requests 420 069 to TSLA I think might take us to the moon with doge,1
2021-04-22,gon Fill in the blank btc stocks market dow tsla ETFs cryptos investing GME AMC EarthDay,1
2021-04-22,TSLA TSLA Tesla Tesla is at an algo sell level from the banks This area is a no trade zone for me Levels are not high probability for me to buy I d want either 633 if we can hold bullish to buy in Or 426 if we break down in the future Current price is 744,35
2021-04-22,An epic deep look into the greed of the ken n friends corruption and cover ups an in depth piece of dd blow economies and be rewarded and bailed out until now Party is over amc gme moass Fedge citadel JPMorgan,32
2021-04-22,Wait The irony of saying this is a negative THE CAR CAN DRIVE ITSELF haha Tsla Tsla,1
2021-04-22,SPY puts l daytraded for 35 profit Check out the trade explanation and become a better trader with Titan Day Trading finance options stonks stockmarket wsb elon tsla gme trading robinhood marketing fitness optionstrading pennystocks stocks marketwatch,0
2021-04-22,TSLA Good morning Happy Successful Investing TSLA StocksToBuy,0
2021-04-22,Tesla Will Drive With No One in the Driver s Seat Consumer Reports,77
2021-04-22,TSLA is going to the moon,0
2021-04-22,Honestly this is beautiful Yesterday retests EXACTLY to the 699 on the wedge and finished green wow Tsla tsla,0
2021-04-22,Tesla cars can drive with nobody in the driver s seat Consumer Reports engineers find Tesla TSLA,1
2021-04-22,AMC GME TSLA NAKD OCGN KOSS before tonight s DD if you have time I want you guys to read this Reddit article below it ll bring you up to spread market moon AMCtothemoon squeeze stonks,10
2021-04-22,TSLA TSLA Mentioned 745 this AM and hit my target EOD THis is setting up for a huge RIP up if we can clear this weekly downtrend resistance white line look for RIP to 798 next Very strong bullish candle today Calls above 745 can work for 798 SOWC,2
2021-04-22,TSLA Update TSLA is testing resistance here Once we break over 750 huge pivot point to head to 780 Earnings on Monday this run could be huge,0
2021-04-22,TSLA TSLA Check out yesterday s analysis before the market opens Watch below,2
2021-04-22,NFLX calls daytraded for 41 profit in minutes finance options stonks stockmarket wsb elon tsla gme trading robinhood marketing fitness optionstrading pennystocks stocks marketwatch tdt financialfreedom money invest trending motivation doge,3
2021-04-22,AMC GME TSLA OCGN good morning everyone I hope many of you enjoyed the bit of a rise we got this morning in AMC Below is your ortex info for this morning I want you guys to keep calm and enjoy the ride Preview for tonight s topic and video is going to be a blend,33
2021-04-23,China s Guangzhou city government bans Tesla from driving on highways,11
2021-04-23,Success from Nightlifechump in Discord TSLA TSLA,1
2021-04-23,BUY IT HE DIP tsla DOGE,2
2021-04-23,Elon is NOT an engineer I m going to inform NASA I hope you do the same tsla tslaq,1
2021-04-23,AMC GME TSLA alright good morning everyone I hope you all have enjoyed yourselves this morning AMCPARTY is trending lol Alright I dozed off on my own DD last night Not because it was boring i just had a long day lol Below is your ortex looks like AMC is enjoying its rise,34
2021-04-23,Consumer Reports Tesla s can drive with nobody in the driver seat TSLA TSLA Tesla,0
2021-04-23,This escalated quickly TSLA,6
2021-04-23,TSLA May7 21 595 P 773 Volume vs 225 OI 1 464 954 USD Volume Underlying price 728 4 Last Option Price 5 65 TSLA,2
2021-04-23,Falcon 9 launch as seen from S Florida SpaceX NASA ElonMusk tsla,0
2021-04-23,Is there someone like homer GME GME TSLA TSLA AMD AMD T T NFT GOOG GOOG DIS Disneyland PM FB FB SNE SNE EA ETH etherium AMC,0
2021-04-24,Suni made 1 altcoin for April Make the planet a better place SuniToken suni NFT cryptocurrency BTC TSLA,13
2021-04-24,Epic week for the chat Is it Monday yet trading market spy amcstock gamestop pltr nio tsla acb sndl,0
2021-04-24,And so it begins WSB WallStreetBets binance TSLA GME,237
2021-04-25,Check out our Friday recap and look at how ZEUS torched the market finance options stonks stockmarket wsb elon tsla gme trading robinhood marketing fitness optionstrading pennystocks stocks marketwatch tdt financialfreedom money invest trending,0
2021-04-25,Pros amp Cons Of Buying Tesla Stock Tesla TeslaStock TSLA TechStock TechStocks CarStock StockMarket ElonMusk StocksToBuy Stocks ElonMuskDay ElonMuskSNL,3
2021-04-25,Watchlist for this week Lots of great earnings this week some ideas for earnings some not Charts will go up in a bit AAPL AMZN AMD BA FB MSFT NFLX NIO NVDA PINS PYPL SPOT SQ TSLA TWTR,1
2021-04-25,1 2 TSLA TSLA Weekly closing above 20MA and on top of massive wedge resistance ER tomorrow after bell Very impotant catalyst to get us OUT of this wedge up or down If this beats 798 to come next then 880 Volume is on rise bullish weekly,4
2021-04-25,Happening right now or actually from 10AM SGT TSLA Roadshow at EarthDay,7
2021-04-25,Tesla CEO Elon Musk to host Saturday Night Live on May 8 Tesla TSLA ElonMusk,1
2021-04-25,We noticed an interesting inconsistency between some analyst ratings amp TSLA price performance Since Sept 19 Citigroup s C sell ratings were almost always at a bottom before price continued to move up strong Read more here TSLA SPY QQQ IWM,35
2021-04-25,I wish the stock market was open on the weekends A girl can dream amc gme tsla,0
2021-04-26,GameStop watching after hours soar GME AMC AMC GME wallstreetbets WSB reddit reddittraders WSBArmy TikTok DiamondHands HODL RVPH MVIS MMED CCIV GSAT VXRT AMZN TSLA TSLA COIN PLTR RIOT MARA,1
2021-04-26,Maybe TSLA sold a bit of Bitcoin to get a better crypto asset to diversivy Oh wait,1
2021-04-26,Another successful TSLA earnings pump and dump Thank you to Twitter promoters and Muskits Please send more fools as soon as possible Daytraders everywhere tsla,0
2021-04-26,TSLA 4H EW 2nd break below 717 56 and a re test of it should be viewed as bearish Not there yet though Break above 750 80 bullish,5
2021-04-26,Big Short UBS Top Broker Face 23 Million Claim over Tesla Trades Tesla TSLA,2
2021-04-26,Your Uber driver Elon musk is here ElonMusk Tsla TSLA dogecoin,0
2021-04-26,TSLA and palantir should date See how it goes,0
2021-04-26,Here comes the squeeze,17
2021-04-26,MNKD stocks StocksToWatch StockMarket wallstreetbets StocksToBuy amcstock AMCSqueeze TSLA GME Options,1
2021-04-26,We wait tsla,1
2021-04-26,I smell lots of WE don t profit companies tesla tsla Crypto stonks gme dogecoin 420day hype failarmy chipshortage madeinchina currencywars bestinshow poof,0
2021-04-26,TSLA 100mm in profits from selling Bitcoin 25 of profitability lolol,34
2021-04-26,Hey market traders sign up for the TrickTrades FREE NEWSLETTER everything you need to get you prepared and ready to start the trading day AAPL SPY FB TWTR TSLA Stock Market trading aapl tsla amd fb ba Click below for free newsletter,6
2021-04-26,So let s recap Elon Takes over a dead space program last NASA flight 11 years ago and builds a freaking bus to take people into space every 6 months with reusable rockets at a fraction of the cost and this is only a 20 sec morning show bs piece on mainstream media TSLA,142
2021-04-26,TSLA TSLA Looking ready to make a move Earnings report today market AH,1
2021-04-26,MannKind reduces debt by 49 5M and restructures remaining obligations,1
2021-04-26,Dojo update Tesla Solar Roof developments Here are the top 5 questions retail investors want answered at Tesla s TSLA Q1 2021 earnings call Tesla TSLA ElonMusk,3
2021-04-26,Amazing trading machine Tsla,0
2021-04-26,AMC GME TSLA Koss OCGN NAKD alright good morning everyone I hope and trust each of you has had a wonderful morning enjoying the rise in a few of our stocks Below is your refreshed ortex data as it stands today Keep in mind this data pulls from multiple resources not,17
2021-04-26,I ve never had a more stressful text before TSLA TSLA,0
2021-04-26,TSLA June 800 calls are on options tsla,1
2021-04-26,tsla trading at 747 64 up 2 47 Pre earnings rally has started TSLA,0
2021-04-26,Tesla Earnings Day is always heart attack day for short sellers TSLA is up 1 15,4
2021-04-27,Alright good morning Ape Family I hope you all have had a good morning I expect the markets to get volatile today so hold if you can only buy more if you can afford to Below is your ortex info for the morning Have an Awesome Day amc gme nok nakd tsla ocgn koss moon,26
2021-04-27,I m sticking with my view that the bull trap appears to have closed and that we are now in the bust phase of a classic bubble TSLA ARK,70
2021-04-27,Tesla s Largest Profit Ever Is All Thanks to Bitcoin and Credit Sales Tesla TSLA bitcoins,3
2021-04-27,Not mine These regulatory credits are so bearish TSLA TESLA FreeMoneyIsBad,183
2021-04-27,Two of my worst trades happened back to back The average trader would quit I m inspired Let s get it TSLA TSLA ER,1
2021-04-27,TSLA DAy Trade Plan TSLA,0
2021-04-27,Let Me Be Clear My Issue With ARKK Is TSLA amp COIN I Think Cathie Has Averaged Down Coin 5 Now ZeroHedge Is A BAD Strategy SPX DJIA NDX OOTT,1
2021-04-27,HEX looking very descending wedge ish Just not sure about which best fit resistance will need to be broken could argue the break already occurred and the retest is currently taking place Larger break on volume wouldn t hurt HEX BTC ETH BNB tron Doge Tsla xrp ada,1
2021-04-27,I m sticking with my view that the bull trap appears to have closed and that we are now in the bust phase of a classic bubble TSLA ARK,70
2021-04-27,Tesla next square out date is 10th May Gann Astrology TSLA,0
2021-04-27,The market trying to understand TSLA s earnings,1
2021-04-27,cryptomining on your powerwall could make your solarroof into a legit Bitcoin ATM BTC TSLA,29
2021-04-27,TSLA Long Got in full size TSLA,1
2021-04-27,Tushy Tuesday tesla tucked bagged ruined elonmusk model3 pink irvine ElonMuskDay ev doge electric tsla,3
2021-04-27,Tesla next square out date is 10th May Gann Astrology TSLA,0
2021-04-27,TSLA 13F men lie women lie numbers don t,7
2021-04-27,TSLA under pressure but holding the pivot area so far Lets see if we get any buyers show up here tomorrow TSLA,3
2021-04-27,Let s get this bad boy to 10K before GME does GME AMC AMC,9
2021-04-27,Let s talk about how incredible and insanely hard what Elon and TSLA just did,46
2021-04-27,Well done Tesla 2021 is going to be a record breaking year Tesla TSLA TSLA,4
2021-04-27,10K AMC AMC GME GME KOSS RKT TSLA PLTR CCIV BTC DOGE SAFEMOON NAKD MVIS,1
2021-04-27,TSLA PRice levels for a bounce today 717 56 amp 710 95 TSLA,0
2021-04-27,Let Me Be Clear My Issue With ARKK Is TSLA amp COIN I Think Cathie Has Averaged Down Coin 5 Now ZeroHedge Is A BAD Strategy SPX DJIA NDX OOTT,1
2021-04-27,David Massey CEO Of SIRC Tells MicroCap Conference Investors That Company Will Eventually Expand Into Texas And Discusses His Up List Strategy stocks stockmarket solar solarpower solarenergy greenenergy SIRC TSLA BLNK RUN GM SPWR,2
2021-04-27,Tesla TSLA CFO on ongoing global semiconductor shortage and its challenges Q1 1Q 1Q21 TSLA Tesla,1
