Date,full_text,retweet_count
2021-02-08,Before every fall we have buying History repeats itself Lately we are having too much buying before too much fall spx ndx equity forex dxy appl tsla gme bitcoin money trading investing Russell,1
2021-02-08,Tesla buys 1 5 billion in bitcoin and plans to start accepting it as payment for products TSLA ARB MODE OBC MARA RIOT BTC,3
2021-02-08,What a world we live in Bitcoin TSLA BTC TSLA,0
2021-02-08,Starting today UniDex traders can also trade TSLA USD on the platform with 0 slippage That means any trader in the world can gain exposure to Tesla through a synth in a fully decentralized environment By traders for traders and with traders UniDex TSLA Ethereum,20
2021-02-08,Here is another photo because why not TSLA TSLA Tesla,2
2021-02-08,TSLA TSLA Massive volume shelf forming Shout out to for teaching us this anchoring technique from the breakout point,5
2021-02-08,TSLA TSLA BTC BTC,4
2021-02-08,There will be a RaspiBlitz in every TSLA Soon,2
2021-02-08,There moment the news cameout that tsla bought 1 5B in BTC,0
2021-02-08,if you invite for TSLA commentary re BTC please also ask about her relationship w known shorts amp her history in covering the company Your viewers deserve full picture She trashed company product amp CEO w no pushback from host C mon SwitchingChannels,35
2021-02-08,TSLA buying 1 5bn in BTC,163
2021-02-08,ARB ARBKF the US open is going to be fun after that btc tsla,2
2021-02-09,mode were the first LSE listed company to hold Bitcoin on their balance sheet as a treasury reserve A truly game changing business with an unbelievable senior team where mode started tsla followed,2
2021-02-09,Share price over past year Tesla 450 NVIDIA 119 Twitter 71 Apple 70 Amazon 57 Dell 51 Netflix 48 Alphabet 38 Microsoft 29 Facebook 26 Intel 13 IBM 21,326
2021-02-09,TSLA buying 1 5bn in BTC like to Visit Elonmusk dogecoin,0
2021-02-09,And the rest soon will follow TSLA BTC Bitcoin cryptocurrency,0
2021-02-09,33 days ago TSLA ElonMusk Bitcoin,0
2021-02-09,ALPP For those that couldn t attend here is the Alpine 4 2020 Zoom Shareholder Meeting from February 5th 2021,46
2021-02-09,Can ANY bull admit they were wrong The fact that you have made money proves tslaq was right about FRAUD tsla,0
2021-02-09,TSLA I was looking for a long entry near 840 It seems like it is going without testing 840 I am not taking any trade now TSLA,0
2021-02-09,If you invest in TSLA you now automatically invest in BTC,8
2021-02-09,SAVE THE EARTH TSLA,0
2021-02-09,Does this mean we can buy tsla with dogecoin now dogearmy DogecoinRise DogeBowl doge,1
2021-02-09,NNDM for a quick short Stocks StockMarket DayTrading Daytrader NASDAQ Investing PennyStocks Investors DIA SPY QQQ GOOGL TSLA SHOP AMZN NVDA ROKU EBAY AMD BB DAL GME AAPL,1
2021-02-09,Me want see pic tsla TSLA,1
2021-02-09,mode Bitcoin this is the beginning of the journey,8
2021-02-09,So tempting TSLA SG,0
2021-02-09,TSLA TSLA Bulls would like to see it clear the down trend line and horizontal price level of 881 for a potential run towards 901 840 to 830 has been support lately 900C can work above 881 as a trade setup,1
2021-02-09,Silver is just too cheap Public collecting physical silver from shops powell fed TSLA federalreserve SNP snp500 stockmarkets dax nasdaq dowjones forex DAX30 SPX SHCOMP ni225 ecb DXY XAUUSD Covid19 gold xauusd bitcoin etherium silver buythedip,4
2021-02-09,NIO is like Netflix TESLA is like a DVD TSLA,0
2021-02-09,The meme king bitcoin doge btc tesla TSLA spacex tomars mars meme memes king kingofmeme,0
2021-02-09,TSLA Long never mind I am taking one more time long TSLA,0
2021-02-09,The hype is real Monday s tsla BTC dogecoin starlink,0
2021-02-09,Sweet didn t think Southern California would be eligible in 2021 Ihatespectrum starlink tsla spaceX,0
2021-02-09,can you spot the difference BTC vs TSLA,0
2021-02-10,TSLA BPCS Swing I didn t take profit when it hit 870 I have rolled 12th Feb 840 845 BPCS to next week 825 830 Put spread for 1 debit So overall credit on this one is 1 85 now Also opened another BPCS 810 815 Put spread for 2 6 credit TSLA SwingTrading,0
2021-02-10,If you think the tsla drop isn t anything other than mms manipulating due to the ev credit announcement in the US you don t follow Tesla close enough same pattern happened just before the s and p 500 expect a week or more of consolidating at 800 to 840 level then,2
2021-02-10,Here s the news sentiment for today tsla sentiment cryptoreview ai tesla tsla,4
2021-02-10,Out adventuring in the Model Y TSLA TSLA Tesla,0
2021-02-10,When TSLA and BTC moves together and forming a dogecoin head amazing D you are a genius D,4
2021-02-10,the competition will be gigantic F RIVIAN TSLA tsla Ford,2
2021-02-10,TSLA Swing Adding a small size here TSLA,0
2021-02-10,Order flow the last 5 mins was mainly calls TSLA TSLA,0
2021-02-10,Wipes sweat from brow closes Linkedin window stocks stonks djia tsla zyne veru gevo,1
2021-02-10,TSLA stock price has been consolidating between 800 and 872 and reached ATH at 900 Ytd dip drop back to support at 800 which is also around the support of 20EMA Expect consolidating around 800 for a while before go back up to 872 and all the way beyond 900 to 1200,0
2021-02-10,TSLA TSLA Stuck at the shelf,3
2021-02-10,shop mstr nvda btc tsla mstr bitcoin play shopify er run nvda breakout 90 000 one day,2
2021-02-10,Bitcoin has already hit escape velocity The floodgates were opened with TSLA s move They were the last big domino needed to kick this adoption into hyperdrive There s no going back now Bitcoin is officially mainstream and the black hole is now unstoppable 46 391,5
2021-02-10,If pictures speak louder this one just screams Tesla TSLA,3
2021-02-10,Something to look forward too WSG rook uni dext dextools uniswap gem bots bnb btc eth umb trx rsr tsla gme amc,0
2021-02-10,Me when TSLA dips,0
2021-02-10,Hmm weird doge is on the rise as called dogeto1dollar is real we have passed our low elon musk won t push some shhh he doesn t trust as seen with tsla tesla Hop on board retweet our free giveaway post from earlier for a chance to win btc Bitcoin ToTheMoon,9
2021-02-10,VERY happy all of us at tslaq have been short the top one So stop asking tsla,1
2021-02-10,People holding TSLA since 2018 reacting to this weeks movement,2
2021-02-10,Price of BCH is extremely depressed and totally unjustified reminds me TSLA before it took off in 2019 If BTC won t ruin the show won t be surprised to see 50 pump in a day taking BitcoinCash above 700 Are you ready bitcoin crypto investing,9
2021-02-11,Not bad for a month worth of trading The force is with me RobinHood Webull trading TRADINGTIPS SNDL CCIV ISR tsla BNGO,0
2021-02-11,RICHEST MAN IN THE WORLD absolute crook TSLA,1
2021-02-11,RT if you are diamond hands cryptocurrency Crypto dogecoin DOGE dogearmy DogecoinToTheMoon dogetothemoon Bitcoin AMCtothemoon GME,14
2021-02-11,When you just got married but you bet your honeymoon money on TSLA weeklies,0
2021-02-11,These are baby dogecoin DOGE dogearmy BTC XLM SNDL TSLA DogeBabe,4
2021-02-11,TSLA accepting bitcoin Uber considering it Mastercard planning it,0
2021-02-11,DJIA Great day for dowjones investors AAPL TSLA AAPL TSLA DJIA,1
2021-02-11,Pie chart of the top 30 stocks trending across analysts and social media last 24 hours We ve seen a massive change from last week looks like cannabis is now in the spotlight sndl tlry trch cciv amc gme visl lotz zyne tsla RT if you see a stock that you own,10
2021-02-11,SNDL ITS back gme tsla gm nokd bb robinhood,1
2021-02-11,Tesla TSLA Currently Trading At 826 We see 943 Before 1st March Stop loss 788 now See you soon,1
2021-02-11,Just shows how overvalued TSLA was that it s fallen 10 and yet it s still 100 overvalued,4
2021-02-11,TSLA Long Nice win on this one even though I didn t get my original entry price P L 1290 20 Nice win TSLA DayTrading Alerts TW0E,0
2021-02-11,TSLA is such a disappointment lately guess Elon is too busy pumping dogecoin,4
2021-02-11,stocks TSLA SNDL OGI HODL wallstreet Individual daily movements Me,0
2021-02-11,NEW VIDEO ON YOUTUBE Check it out link to channel in bio investingassist youtube youtuber dogecoin doge cryptocurrency stocks tesla tsla draftkings dkng visa v apple aapl square sq mastercard ma amazon arkk stockstobuy stockstowatch,2
2021-02-11,Got in on IOTA under a will be considered an impossibility within a decade mining fees will be the laughing stock of the S amp P500 TSLA,4
2021-02-11,Here s the news sentiment for today tsla sentiment cryptoreview ai tesla tsla,1
2021-02-11,It s a good day today almost 20 000 in plus Let s go boys and girls Follow for more tips and tricks Investment invest tesla tsla nio gevo trading stonks stocks,1
2021-02-11,Morning Market Conversation sony sne msft Gm f ford tsla amd nvdia nio mmc morningmarketconversation gains profit nyse stockmarket stocks stonks trading investing semiconductor FSS ForeverSlowStroking foreverslowstrokingykm YKM,2
2021-02-11,TSLA Day Trade Plan No trade if I don t get an entry TSLA,0
2021-02-11,TSLA Long I missed my entry Then I got in on the pullback near 805 TSLA,0
2021-02-12,New watchers record 18 530 since this morning ampe StocksToBuy StocksToWatch investment Apple Microsoft Tesla ElonMusk Bitcoin BTC Huawei crypto cryptocurrency cryptocurrencies TSLA money LTC trading investing btc twitch,3
2021-02-12,ADA performance vs ETH TSLA BTC AAPL Cardano,0
2021-02-12,TELSA and the Median Line TSLA chart,1
2021-02-12,Titan trade of the day finance options stonks stockmarket wsb elon tsla gme trading robinhood marketing fitness optionstrading pennystocks stocks marketwatch tdt financialfreedom money invest trending motivation,1
2021-02-12,TSLA Short It got me pretty good Got stopped out after adding a size and I entered earlier I could have followed my plan P L 773 TW0E DayTrading Alerts TSLA,0
2021-02-12,AMPE keeps boomimg Currently 18 271 watchers on StockTwits Click link for more Investment StocksToWatch B117 cryptocurrency Bitcoin Tesla Microsoft ElonMusk apple COVID19 BTC google trading Crypto cryptocurrency Trending,3
2021-02-12,TSLA Got me pretty good on day trade as well as a swing trade I took a loss on the swing position Now it ended up closing near 820 TSLA,0
2021-02-12,TSLA Short If I get an entry I will go with 1 2 size only TSLA,0
2021-02-12,Cover mock up for book Thoughts tsla tsla tesla bookcover mars earth Sustainability,4
2021-02-12,Here is today s news sentiment to close off the week tsla sentiment cryptoreview ai tesla tsla,0
2021-02-12,ChineseNewYear TSLA to the moon,0
2021-02-12,TSLA below 800 is a shit show,1
2021-02-12,TSLA TSLA The seasonality into next month is not great this is looking back over the last 5 years March has a 33 win rate since 2015 and this is overextended Let s see what happens,5
2021-02-13,TSLA s Giga factory in Berlin Germany Electronic Vehicles are the future,1
2021-02-13,The Tesla roadster is damn cheap in comparison to Bugatti Chiron with better performance TSLA,0
2021-02-14,Legacy auto trying to make a compelling EV Bolt boltev Chevorlet TSLA TSLA,0
2021-02-14,This is update 3 for Tesla deliveries in Q1 2021 that I calculated on 7 Feb I estimate 182K for Q1 880K for 2021 I posted update 4 on Patreon yesterday It will be on Twitter on 20 Feb There is a 7 day lag except for the final update on 31 Mar,45
2021-02-14,spx investment idea You want to sell when Short side of the assets managers is above 20 red line You want to buy when Short side of the assets managers is below 10 green line ndx appl tsla gme amc trading forex dxy usd investing crash bund equity biden,8
2021-02-14,ICYMI Tesla announced a 1 5 billion investment in Bitcoin and that the cryptocurrency would soon be accepted as payment for its cars Here is a closer look at how the payments might work,26
2021-02-14,Bitcoin Tesla And Gamestop The Democratisation Of Risk TSLA Tesla Bitcoin,1
2021-02-14,Tesla will increase production for 75 YoY in 2021 TSLA,0
2021-02-14,This chart is from Friday but I still stand by it TSLA sold off and had almost a 30 run right before close Still holding full position I see TSLA retesting ATH very soon I will continue to monitor heavy TSLA,0
2021-02-14,Interesting chart the reason why Cathie Wood is saying Bitcoin could have a value of 200k 500k per token if all the S amp P 500 companies allocated 1 of their cash balance to BTC its value would increase significantly to that PT TSLA just grabbed 1 5 billion BTC,1
2021-02-15,I m blown away by how big the global transportation market is Simply taking three segments new vehicle sales trucking logistics and ride hailing yields an 8T plus market compared to the smartphone market around 500B,159
2021-02-15,Switched over to the Darkside for a bit The what I got on TSLA for the up coming weeks A big breakout is on the way Over 860 should send us to ATH Looks like history repeating itself here TSLA Elliottwave,0
2021-02-15,Elon Musk says he supports top dogecoin holders selling most of their coins Dogecoinarmy ElonMusk markets wallstreet Crypto cryptocurrency bitcoin BTC Tesla TSLA SpaceX solarenergy paypal stocks riskon fx gold Ethereum XRP Litecoin,3
2021-02-15,HCMC The moon had a conversation with HCMC and said hey HCMC YOUR TOO TAKE NEXT to MARS NO ONE HAS MADE IT THERE YET EXCEPT TSLA WHAT DID HCMC RESPOND,6
2021-02-15,Which earnings are you looking forward to this week 02 15 stocks stockmarket finance elonmusk tesla tsla palantir pltr,1
2021-02-15,Corporate America can t avoid one question It s Tesla s fault Tesla TSLA American news,0
2021-02-15,Nickel expected forecast is to be 14x current demand Who will be the big players in the long run AOU ADD BSX JRV or others ElectricVehicles EV TSLA TESLA ElonMusk,0
2021-02-15,The same with Bitcoin TSLA,0
2021-02-15,Public collecting physical silver from shops powell fed TSLA SNP snp500 stockmarkets dax nasdaq dowjones forex DAX30 SPX SHCOMP ni225 ecb DXY XAUUSD Covid19 xauusd bitcoin xrp dogecoin ElonMusk MakeAmericaGreatAgain,1
2021-02-15,We re not for or against any single stock However we think it s worth highlighting tsla as a systemic risk YoY Tesla has added more to its market cap than any single company barring Apple and has outpaced Amazon 1 2,0
2021-02-15,StockMarket closed today feels like Sunday all over again SNDL CCIV TSLA CTRM,2
2021-02-15,Every TSLA investor now has exposure to Bitcoin This announcement sent the value of Bitcoin to an all time high,0
2021-02-15,Mondays without Nasdaq is BORING tsla bynd cciv crsp,0
2021-02-15,So I gave up won t try to sell again TSLA TSLA,0
2021-02-15,TOMORROW WILL BE GREATTTT CCIV NIO SNDL TSLA ZOM Godisgood,2
2021-02-15,tsla overvalued,0
2021-02-15,THIS IS HUGENEWS This New Deal Will Blow Up Tesla RenewableEnergy TSLA TSLA TeslaStock Tesla SolarEnergy,1
2021-02-15,Tesla s 25 000 Model 2 electric car rendered Dope or Nope Tesla TSLA Auto,2
2021-02-15,Well seems like it s happening with Mr Musk elonmusk GIOT tsla SpaceX nueralink boringcompany Bitcoin,1
2021-02-15,crypto TSLA exposure to bitcoin is spreading to even hard deniers like JPM Now since so many active passive fund invest in Tesla amp Co many of the investors are now exposed to crypto by default Rebalancing headches,1
2021-02-15,Tesla accelerates Giga Shanghai s expansion as news of 25k EV heat up Tesla TSLA,6
2021-02-15,You have enough time Photo courtesy of tesla tsla spacex Pediatric,3
2021-02-15,What is CakeDeFi Who can answer this question on Crypto cryptocurrency cryptocurrencies blockchain cake Cake DeFi Definews Finance DecentralizedFinance decentralized DecentralizedFinance,1
2021-02-16,Tehe the balloon is full getting close to the danger zone tesla tsla,0
2021-02-16,Oh you didn t buy in on CCIV at 10 20 30 or 40 Just look at TSLA stock and remember saying I wish I got in when they re issued stock at around 80 This is your redemption moment yes even at 50 CCIV Lucidmotors stocks,0
2021-02-16,It is DeFi on Bitcoin and it will be the DeFi playground for companies and institutionals Because since TSLA BTC is de risked,2
2021-02-16,Morning Market Conversation SPY NYSE BTC BTCUSD bitcoin CRYPTO ETH ethereum DOGECOIN DOGE STOCKS STONKS CCIV STOCKMARKET MONEY NIO TSLA SBE ev energy FOREVERSLOWSTROKING STROKESEASON YKM RIOT BLOCKCHAIN MARA,0
2021-02-16,BUY THE DIP tesla tsla stocks,0
2021-02-16,Whats else is in Keith Gills Portfolio after GameStop We already know He shows his actual portfolio on his youtube Channel GME 48 55 TSE 3 30 lt New 52wk High Today RFP 2 95 lt New 52wk High Today NGD 2 60 PBF 2 53 GME WSB TSLA CCVI SNDL AMC BB NOK,0
2021-02-16,Towards more EVs in Singapore TSLA,1
2021-02-16,What s up with TSLA or should I say down with it,0
2021-02-16,Porsche taking Tesla head on with new Taycan EV base model Tesla TSLA PorscheTaycan,4
2021-02-16,What s your favorite interior color on the yoke refreshed Tesla Model S X teslamodelS interiordesign design tesla tsla tsla teslamodelx innovation EV tesladisruption,1
2021-02-16,We are living an innovation revolution tesladisruption tesla tsla tsla bitcoin liftoff,1
2021-02-16,Tesla registered 8 of every 10 EVs in the U S in 2020 Tesla TSLA Auto,1
2021-02-16,It s not just Elon Musk a Tesla board member may have also helped with the automaker s massive bitcoin purchase ElonMusk Tesla TSLA Bitcoin,1
2021-02-16,Here s the news sentiment for today tsla sentiment cryptoreview ai tesla tsla,0
2021-02-16,My book choices really match my stocks tsla btc bngo crsp tdoc pltr beam,0
2021-02-16,TSLA holding over 820 this morning would be beautiful Would love to see a pump next resistance at 860 TSLA,0
2021-02-16,I don t think Hargreaves Lansdown like that I m 85 tsla the email went straight in the bin,0
2021-02-16,Just got my baby back from They have done an absolute stellar job looks better than when it was collected Props to for their recommendations Can t praise them both highly enough TSLA,1
2021-02-16,Profits from our entry signals We trade common stocks like AAPL BLNK SNDL FB NIO ABNB SPY SNAP MP VZ TSLA O DASH PLTR TPGY SPCE BYND SNOW BA AAL DKNG FUBO PYPL,0
2021-02-16,tesla tsla for history technical analysis Soon price 760 or 680,0
2021-02-17,Well warned all tsla traders out there Short since 850 spy ElonMusk,0
2021-02-17,How am I supposed to check his tire pressures TSLA,0
2021-02-17,Potential abc correction in Tesla Currently trying to bounce off the 50 day SMA TSLA,2
2021-02-17,Goodnight MOON cciv Bitcoin ctrm TRCH brqs cbat gme SNDL StocksToBuy TSLA,0
2021-02-17,Tesla Electric Truck Rival Volta Announces Good News for Battery Suppliers Tesla TSLA,2
2021-02-17,I really feel good today Lol even though tsla is down about 5000 for the month,0
2021-02-17,I see tsla is on sale right now,0
2021-02-17,Use your brain Think twice If you are discovering something hot you re already too late Except TSLA amc tsla gme ftft bigbraintime arkg arkk arkf,0
2021-02-17,Panic now gt gt gt into TSLA,0
2021-02-17,Tesla s manufacturing advantage lies in legacy auto s stranded assets Tesla TSLA,2
2021-02-17,When a great company s stock pullback it s the time to add more at discount and the last thing u wanna do is panic,56
2021-02-17,We have been blessed with some buying time TSLA,0
2021-02-17,Congrats to my aunt she just bought a Tesla TSLA TSLA congrats Ant Kat She loves it too,12
2021-02-17,Hello brothers please I need you advice and expertise Tesla or Amazon which one should I go for if since I can only do one at the moment Amazon Tesla teslastock AmazonWishList investor CFD StocksToBuy bitcoins TSLA BitcoinCash,1
2021-02-17,Cathie Wood says her confidence is growing in Tesla Ark Invest has been adding to position StockMarket TSLA CathieWood ARK,1
2021-02-17,Success from hou in Discord TSLA TSLA,0
2021-02-17,Not selling until 3000 Stay Strong Have faith in Elon Your Patience will pay off HODL TSLA,1
2021-02-17,TSLA Chart and notes,0
2021-02-17,17 FEB INTRADAY PERFORMANCE HIGH VOLATILE MKT NO TRADE ZONE JACKPOT CALL TCNS 470 TO 484 BTST TATACONSUMER 628 TO 644 Nifty StocksToWatch OptionsTrading daytrading ITC banknifty reliance CNBC StockMarket NSE BSE spy TSLA,0
2021-02-17,780 key level for Tesla to regain today could well be a failed breakdown Tsla tsla,0
2021-02-17,How many of my tesla peeps are going to invest in loopenergy tsla tsla tslaQ,0
2021-02-18,13 BIG REASONS WHY LUCID MOTORS amp CCIV WILL SOON MERGE CCIV CCIV lucidmotors LucidAir stocks StocksToWatch ToTheMoon nio NIO TSLA TSLA Tesla,2
2021-02-18,Tesla Slashes Prices As Rivals Make Big Push In EV Market Tesla TSLA,2
2021-02-18,1 year ago today I picked up my Tesla Model 3 Thanks to the lockdowns I ve only done 6k miles but it s still been an amazing car and upgrade from the Leaf40 TSLA,15
2021-02-18,A big thing I like about this service is they pick contract sizes for all I ve been in many that only play big names like amzn tsla googl has several normal names he commentates on that fit all account sizes Taking the rest of the day off I made well today,3
2021-02-18,Pattern repeats over and over ndx spx equity covid appl btc tsla gme usd dxy forex investing trading euro cash money spy bund inflation,0
2021-02-18,TSLA TSLA In line with seasonality today Only a 29 win rate for Thursdays so far in 2021,2
2021-02-18,Need to order more of these Maybe I know too many people maybe my garage is too small but I m shipping faster than Amazon this last week Bitcoin BTC TSLA IFuckingToldYouSoYearsAgo,0
2021-02-18,Meanwhile in Germany Dogecoin billboards Everything takes time just Hodl position Dogecoinarmy TSLA doge,1
2021-02-18,Tesla s stock is on sale in case anyone wants to load up TSLA,1
2021-02-18,What the feck is going on with the EV market solo tsla nio ayro,1
2021-02-18,Tesla flops in 2021 J D Power Vehicle Dependability Survey Tesla TSLA,1
2021-02-18,CCIV stayed green despite the red market Do you think the merger will happen Thoughts lucid spac merger ev ElectricVehicles spy nasdaq market OptionsTrading amzn tsla,1
2021-02-18,You should always be very scared of flying pigs TSLA,3
2021-02-18,Good morning new and improved car TSLA awesome OTA Update feature let s see what it does,0
2021-02-18,I hope likes this one CCIV cnbc StocksToWatch TSLA,0
2021-02-18,TSLA D another one to watch,0
2021-02-18,Inflation is the friend of Gold powell fed TSLA SNP snp500 stockmarkets dax nasdaq dowjones forex DAX30 SPX SHCOMP ni225 ecb DXY XAUUSD Covid19 xauusd bitcoin xrp dogecoin ElonMusk MakeAmericaGreatAgain,0
2021-02-18,Tesla launches Lithium market SpaceX vertical after defying all laws of gravity for its own stock amp hitting intraday 900 mark As you know even the best trees are not growing to the moon but even pigs can fly for a while during the hurricane DYOR,2
2021-02-18,TSLA trying to find support at the 50ema Will we see another leg up from here TSLA,2
2021-02-18,Tesla Semi is less an upcoming model and more a M O TSLA TSLAQ,0
2021-02-18,Wtf is going on today tsla and everything is down bad today cciv only green on the board for me,0
2021-02-19,If you hold tsla then you have a stake in the future if you don t then what you love the past,2
2021-02-19,FLIR swings paid off too finance options stonks stockmarket wsb elon tsla gme trading robinhood marketing fitness optionstrading pennystocks stocks marketwatch tdt financialfreedom money invest trending motivation,2
2021-02-19,Could Tesla Stock hit 1 000 TSLA TSLA We have answers,1
2021-02-19,Possible reversal on BEAM check it out stocks StocksToTrade SwingTrading tsla,1
2021-02-19,Watching anyone sell cciv and thinking of those who sold TSLA early stonks StocksToWatch lucidmotors stocks ev,0
2021-02-19,Here is today s news sentiment to close off the week tsla sentiment cryptoreview ai tesla tsla,2
2021-02-19,Huge amount of calls option being bought for TSLA Bullish TSLA,0
2021-02-19,Look who I ran into Tesla tsla,2
2021-02-19,Of course Elon was already there waiting for them MarsLanding Tesla TSLA,1
2021-02-19,Me to my broker when TSLA nose dives,0
2021-02-20,Well rested future tsla roadster owner,1
2021-02-20,Tesla s Gigafactory formula rose from a humble tent at the Fremont Factory Tesla gigafactory TSLA,1
2021-02-20,Tesla s bitcoin investment reportedly made more profit this year than car sales in the whole of 2020 Tesla TSLA Bitcoin,1
2021-02-21,why elon thinks Bitcoin Etherium is Over priced StockMarket TSLA,2
2021-02-21,Me when people ask me to help with my trades and I say no then I end up missing it GME tsla shortsqueeze wallstreetbets dogecoin,0
2021-02-21,Weekly Charts amp Commentary Feb 22nd 2021 AMZN AAPL NFLX ZM TSLA BA SQ BABA and more PLAN REACT,3
2021-02-21,The story of our economy TSLA,0
2021-02-21,CONSOLIDATION IS HEALTHY dogecoin doge DOGE tsla TSLA,10
2021-02-21,I knew it This conspiracy penetrates DEEP TSLA sell cars to itself to pump numbers tslaq,0
2021-02-21,TSLA price target for 2021 is 1200 any price before 1000 is consider cheap or on discount TSLA,2
2021-02-22,Laggard will freak out the market today tsla amzn spy,1
2021-02-22,Tesla today one gap down two more gaps to go tsla tsla bubble,0
2021-02-22,TSLA ON FIRE SALES TONIGHT LEONG LEONG Singlish TSLA,0
2021-02-22,tsla No Demand amp The competition is coming,0
2021-02-22,Evening drives on FSD TSLA TSLA,0
2021-02-22,It seems as though the TSLA bubble has finally popped After reaching highs over 900 the stock has lost over 20 of that value Many believed the stock to be extremely overextended Tesla grew over 600 in 2020 but missed its recent earnings How do you feel about TSLA,0
2021-02-22,Disruptive Innovation Investing in the Right Side of Change check out my new article TSLA ARKK APPL GME INO AMC CCIV ARKG CRSP,5
2021-02-22,TSLA TSLA Not only is the monthly chart looking rough this is going into one of the worst months for seasonality over the last 5 years,6
2021-02-22,News sentiment for today to start off the week tsla cryptoreview ai tsla,1
2021-02-22,Buying the dip again MARA RIOT TSLA NIO AAPL Bitcoin,1
2021-02-22,NNDM TSLA CCIV TSLA LOOKKN JUICY TMRW,1
