Date,full_text,retweet_count
2021-06-21,Tesla details its self driving Supercomputer that will bring in the Dojo era Tesla TSLA,1
2021-06-21,EVERYONE in EV pool Porsche TSLA TSLA,1
2021-06-21,KULR Posted Four EV Stocks with Key Catalysts in Play TSLA FSR KULR NKLA wsj nytimes business reuters IHub StockPosts forbes marketwatch cnn bet foxnews latimes Benzinga usatoday ESPN WGN NASDAQ BlinkCharging 3Dpcb,1
2021-06-21,Porsche will develop and produce battery cells for electric sportscars in a new joint venture The new cells will allow charging in less than 15 minutes its CEO says,105
2021-06-21,Tesla Artificial Intelligence Day to take place in about a month Elon Musk says Tesla TSLA ElonMusk,2
2021-06-21,TSLA Long Rook out majority size near 629 from entry at 617 40 on 6 25 620 call amp 31 on 617 50 622 50 BPCS 12 bounce from my entry after alert Nice win TSLA DayTrading TW0E Alerts,0
2021-06-21,TSLA Room towards 630 today if it breaks 620 615 could have been a nice entry with a stop below 607 TSLA,1
2021-06-21,NASDAQ ROKU Current Price 364 50 AI Target price prediction 371 69 SPX AAPL AMZN FB NFLX GOOGL SNOW AMD BABA TSLA SQ machinelearning ArtificialIntelligence Python AI ML stocks StockMarket trade algotrading,1
2021-06-21,MotorTrend Yes the Tesla Model S Plaid can go 0 60 in two seconds but there s a catch Tesla TSLA,2
2021-06-21,NIO Holding well here in the 43 46 range Line which was resistance acting as support and bouncing off nicely here Look for a move higher shortly StocksToWatch stocks ev ElectricVehicle ElonMusk tsla GreenEnergy green,1
2021-06-21,ETH fire sale almost ETHEREUM ADA cryptocurrency BTC TSLA,0
2021-06-21,TSLA looks great Breaking this pennant on the daily with a RSI breakout amp a BB KC squeeze Targeting around 645 650 right where the 50MA and heatmap resistance meet StocksToBuy stocktrading optionstrading trading TSLA,1
2021-06-21,Thanks for sharing Tesla TSLA TeslaPlaid,0
2021-06-21,TSLA If you ve ever driven Tesla you realize TESLA is at another level,0
2021-06-21,Just looking at tesla tsla over a year,0
2021-06-21,just another manic monday i wish it were sunday btc ETH MAXR ENPH TSLA AAPL,0
2021-06-21,tsla holders hoping for a bump after a Tesla event,0
2021-06-21,Unfortunately it s pretty much a certainty that Tesla will have to record a small impairment charge for their Bitcoin this quarter tesla tsla,1
2021-06-21,LOL In Yahoo s world view if TSLA goes up 10 the headline is Tesla Reverses If TSLA goes down 10 the headline is Tesla Reverses If Ford goes goes up 40 cents the headline is Ford Surges Soft FUD not fooling anyone,5
2021-06-21,TSLA Call Lotto TSLA TSLA,0
2021-06-21,2 Alerts sent 2 Wins SPY Long TSLA Long TW0E DayTrading Alerts SPY TSLA,0
2021-06-22,Tesla EU absolute numbers and market share both down from 2019 Tesla market share is getting eaten up by VW amp Stellantis TSLA TSLAQ,11
2021-06-22,TSLA Trade Idea If it stays above 615 then we can expect a move above 620 towards 635 I am still watching TSLA DayTrading,0
2021-06-22,AMC GME TSLA AMZN THIS IS YOU VLAD WHEN WE GO UP IN YOUR ASS AND TAKE ALL YOUR MONEY USING AMC AND GME YOU SMEAGEL LOOKING ASS MOTHA FUCKA,0
2021-06-22,TSLA on the 3min looks to be getting close TSLA,0
2021-06-22,How many millions is that now up and down up and down think of the members getting their accounts turned putting their trust in guys like this to guide and lead them there is no sustainability and longevity long term for a new trader learning from guys like this AMC TSLA,1
2021-06-22,Tesla Model 3 dubbed by premier car hire firm as the EV everybody wanted to drive Tesla TSLA,1
2021-06-22,TSLA BPCS Took a small size with a stop below 4610 as of now I will scale in above 620 and reduce the stop to 614 TSLA DayTrading Alerts,0
2021-06-22,ETSY NNOX TSLA ZM on watch for tomorrow for a bullish run TSLA and ZM would be the big movers possibly stocks stocktowatch stockstobuy stockmarket chartidea,0
2021-06-22,Let s go TSLA Here s your scalp levels for today SPY SPY TSLA,0
2021-06-22,TSLA long in play here 1w Tesla OptionsTrading,0
2021-06-22,AMC SNDL BB CLOV BNGO TSLA GME DOGECOIN NOK MARKETSTOCKS MARKETWATCH SQUEEZE WallStreet WorldWide News RobinHood Td let your broker know you do not want your stocks loaned out be clear,0
2021-06-22,Swing Update Partial profits on TSLA amp NFLX BPCSs 75 on NFLX amp 44 on TSLA Holding majority size on TSLA I will take some more once it hits 630 TSLA NFLX SwingTrading Alerts,0
2021-06-22,Tesla What Can You Say tesla tsla stock stockmarket options money cars tech technology,1
2021-06-22,KULR Four EV Stocks with Key Catalysts in Play TSLA FSR KULR NKLA wsj nytimes business reuters IHub StockPosts forbes marketwatch cnn bet foxnews latimes Benzinga usatoday ESPN WGN NASDAQ BlinkCharging 3Dpcb,0
2021-06-22,Selling my tsla stocks to buy a house TSLA,0
2021-06-22,Make sure you always smack the butt before you stick it in charging tesla TSLA elonmusknews,0
2021-06-22,Tesla Model Y taxi service might be required to buy gas cars before it can deploy EV fleet TSLA Tesla,4
2021-06-22,NQ forming a bull pattern aapl aapl TSLA ES,0
2021-06-22,Plan your day ahead no pain no gain Homework is important if you want to be consistently successful in this game take a look at our morning note and focus from this morning ROKU SQ NVDA AMZN TSLA AMD DOCU SHOP,1
2021-06-22,Tesla attorney Lynn Miller leaves for autonomous trucking start up Plus Tesla TSLA,1
2021-06-22,Tesla has the 5th biggest supercomputer in the world taking them to full self driving cars in the future I wonder where the closest competitor are in terms of supercomputing data iscompetitioncoming tsla tslaq,0
2021-06-23,I can see both TSLA amp Doge They headed for the moon,5
2021-06-23,The Kaleshwaram project is set to bring about a new awakening with the irrigation plan benefiting around 13 districts of Telangana Tune in to watch Lifting a River premiering on 25th June at 8pm only on Discovery discovery liftingariver DiscoveryChannelIndia Telangana,585
2021-06-23,BABA GME TSLA NXPI on watch for tomorrow biggest watch is TSLA looks very interesting GME NXPI BABA alibaba gamestop stocks stocktowatch stockstobuy stockmarket chartidea,1
2021-06-23,Tesla Model S Plaid Pikes Peak racecar hits 136 mph in practice run at 14k feet TSLA Tesla,1
2021-06-23,Picked up a new toy today Gas prices on the rise More space in the frunk for legos tsla tesla,1
2021-06-23,The whole cryptocurrency market is drawing TSLA logo now That means bullish tsla btc Ethereum,1
2021-06-23,tesla tsla just broke 625 On its way to 700 Uptrend confirmed,0
2021-06-23,Tesla has now 2 of top 3 most American made cars Tesla TSLA,1
2021-06-23,Me I think we ve went high enough today TSLA Hold my beer OptionsTrading stocks Tesla tsla,0
2021-06-23,I think TSLA is climbing today bc it didn t react to the cryptocrash TSLA,2
2021-06-23,TSLA intra day chart Perfect example of momentum trading We opened a position once it took 632 added through 635 and trimmed all the way to 650 Have a plan and execute with confidence Hope you followed us,0
2021-06-23,tesla is making some moves early in the StockMarket Today is it finally time to rev this into it s next gear and join the hyper stock army tsla Elonmusk,1
2021-06-23,What is going with Tesla TSLA,0
2021-06-23,New video tomorrow TESLA TSLA Elliott Wave analysis The count was clear then it wasn t So lets make it simple TSLA Tesla,0
2021-06-23,TSLA 1W Timeframe Keep it on watch for a possible trend continuation Next weeks are crucial TSLA TESLA stocks StocksToWatch,0
2021-06-23,TSLA is still 100x overvalued,1
2021-06-23,All out from day trades SPY Long Got out for a small profit Choppy market Big Win on TSLA Small loss on DKNG amp small profit on RBLX SPY DayTrading Alerts TSLA,0
2021-06-23,TSLA 630 Call 100 now Took out partial profit for 80 Holding last piece TSLA Options,1
2021-06-23,TSLA Above 662 AH Swing Closed BPCS for a nice gain Still holding 7 16 640 700 Call Debit Spread TSLA,0
2021-06-23,Never doubt my boy TSLA TSLA,0
2021-06-23,Free option trade ideas TSLA Above 628 41 gt 630 Call Target 650 DKNG Above 50 gt 50 Call Target 53 RBLX Above 84 gt 85 Call Target 87 Don t forget to take profits along the way 25 30 50 Help me out with a TSLA DKNG RBLX TW0E DAyTrading Alerts,4
2021-06-23,We should start calling these V shaped patterns Tesla pattern from now on bitcoin btc tesla TSLA Crypto cryptocurrency bullish,1
2021-06-24,Retail buying the ask after hours TSLA,1
2021-06-24,YES VICTORY SECURED tesla tsla,1
2021-06-24,Fuck you TSLA,0
2021-06-24,TSLA TSLA Absolutely beautiful move here today The weekly setup says this may just be getting started,14
2021-06-24,Go Tesla Go TSLA stocks StocksToWatch StocksToBuy StockTrading StocksInFocus StocksInNews stockmarketnews InvestorAlerts,0
2021-06-24,Success from Lil Musky in Discord TSLA TSLA,0
2021-06-24,TSLA update,0
2021-06-24,TWTR Swing absolutely crushed it finance options stonks stockmarket wsb elon tsla gme trading robinhood marketing fitness optionstrading pennystocks stocks marketwatch tdt financialfreedom money invest trending motivation doge dogecoin memberprofits,0
2021-06-24,TSLA trading at 677 64 in PM Volume is currently 161 3K tsla,3
2021-06-24,TSLA TSLA Getting close to a huge weekly breakout,18
2021-06-24,Tesla 4680 battery cell new Panasonic CEO ready to make large investment if production test is a success Tesla TSLA Panasonic,2
2021-06-24,Nice view today tsla Switzerland Couldn t drive much on my birthday yesterday because I was down from the second vax shot Made it up today,0
2021-06-24,BYND this setup starting to look eerily similiar to the AMD setup I just traded last week high chance it will produce the same success Orange line has been well respected either as support or resistance Lets aim for 167 BYND TESLA TSLA AMD StocksToWatch investing,0
2021-06-24,TSLA now at 690 00 up 5 09 only 10 left for 700,2
2021-06-24,Tesla must have crushed Q2 like everyone expected TSLA,1
2021-06-24,Vini TSLA finally catching up to AMC gains,0
2021-06-24,TSLA TRADING RIGHT NOW AT 684 37 tsla Will we see 700 TSLA,1
2021-06-24,Countdown starting TSLA TESLA ROCKET,0
2021-06-24,LIFTING A RIVER a must watch for clueless Congress men who claimed to have not come prepared amp who walked out of TSLA when CM KCR Garu presented it in Assembly amp for ignorant BJP ians who are oblivious of the fact as to why CWC called it an ENGINEERING MARVEL,3
2021-06-24,TSLA TSLA closes green 82 of the time in June,2
2021-06-24,Not yet But it may catch up 6 months left for the year to complete TSLA,0
2021-06-25,interesting tweets on lithium shortage tsla EV EV ElectricVehicles ev Tesla ClimateChange EVs RenewableEnergy Renewables Sustainability electricvehicle ZeroEmissions driveelectric electricvehicles evcharging fuelcell lithium Airdrop AndiAbaya BNB BSC,3
2021-06-25,No SpaceX launch and Tsla not yet 1000 so I am consoled by earth sea and sky and thousands of sea grape plants,4
2021-06-26,In a disl xic heaven Dog is the God tsla tsla,2
2021-06-26,TSLA has a short term gap to fill below 667 61 trading stocks investing stockmarket stocktrading OptionsTrading Options 2TheMoon Tesla TSLA,0
2021-06-26,Shoutout to all the Tesla Doge HODLers TSLA dogecoin,1
2021-06-26,Tesla Supercharger station gets direct service from McDonald s get a Big Mac while charging Tesla TSLA McDonalds,1
2021-06-26,BREAKING Tesla Beijing will recall 35 665 imported Model3 made in Jan12 Nov27 2019 while Tesla Shanghai will recall 211 256 Model3 made in Dec19 2019 Jun7 2021 and 38 599 ModelY made in Jan1 Jun7 2021 manufactured in Shanghai Link to SAMR TSLA,25
2021-06-26,This has to be a global recall These models were also exported to Europe TSLA,7
2021-06-26,ElonMusk s Profitless Ponzi Tesla TSLA recalls 285K cars in China for online software fix China s Regulators said the issue is linked to an assisted driving function in TESLA EVs which could cause sudden acceleration if activated by drivers accidentally Probably Nothing,54
2021-06-26,The cars autopilot systems can be activated automatically potentially leading to crashes from sudden acceleration the Chinese agency said 1 2 TSLA TSLAQ,3
2021-06-26,TSLA TSLA Breakout on the weekly chart,11
2021-06-27,I can t think of a better car for the Crown Range it s an absolute beast Also regen all the way down the hill is a game changer No more riding the brakes all the way down TSLA Model3,0
2021-06-27,From self taught programmer to sending humans to Mars The man who taught us In this universe anyone can be anything Happy birthday Have an electric day ElonMusk ELONGATE TSLA spacex,2
2021-06-27,Tesla recalls most of its cars in China Tesla TSLA ElonMusk China cars Dogecoins WRCSafariRally ETH TXT USA LomaNakatani LISAforVogueHK HappyBirthday GULFxdtacCoins FF fashion FreeBritney sundayvibes art zonauang cryptocurrencies BLACKPINK vGMA2021 us,1
2021-06-27,TSLA Before and Now,0
2021-06-27,Tesmo Hypertruck I guess that s the name Roblox gave gave it so Tesla doesn t sue them Regardless of the name even little kids are excited when they get it tsla tesla rblx,1
2021-06-27,To enhance your experience in trading and get instant help click here TSLA AMZN ZM NVDA TLRY BABA BIDU KERN NFLX FSLR FUBO PINS PLUG CRM CRWD ABNB stocks TSLA StockMarket StocksToWatch,0
2021-06-27,TSLA TSLA Couldn t get through the ATH anchored VWAP or weekly resistance last week If the price can break through watch for an initial target above of 755,21
2021-06-27,Birds tsla tsla nature,1
2021-06-27,Let s get happy50thElon trending Happy birthday tsla tesla,6
2021-06-27,TSLA D update,1
2021-06-28,tesla shorts are shorting their pants TSLA,0
2021-06-28,BREAKING here comes the 1st demo of the completed OTA recall in China Push down the right lever once amp you hear the audible sound alerting you the vehicle is in TACC mode Lift the lever up to turn TACC off with audible alert Simple as that Source,87
2021-06-28,NIO Hit 49 BOOM Like I said a higher move was coming New high since Feb 2021 stocks ev ElectricVehicle tsla elon green energy,1
2021-06-28,To a great trading week WISH TSLA HighMaintenance,0
2021-06-28,Did people just realize companies donate to BOTH sides of the aisle and are only loyal to their own company From Tesla to Toyota it s the same issue TSLA,2
2021-06-28,Does it look familiar CBN early adopter mindset flamethrower TSLA SpaceX DoOnlyGoodEveryday,3
2021-06-28,I m BACK b tch3s With all new research GUARANTEED to clean your clocks tsla tslaq queen,3
2021-06-28,REPO gotta love this baller quote by the HTCI CEO TSLA TSLA EV,2
2021-06-28,Why doesn t the government go after this obvious market manipulators I ll tell you why because it s all b llsh t doge tsla,3
2021-06-28,last july i sold tsla at 318 because it s too highly valued based on fundamentals I did NOT understand short squeezes then Sound familiar to what the haters say against amc gme valuations tsla is now double when i sold it amc gme research shorts yall Do DD,35
2021-06-28,First milestone down 420 next tsla Tesla,0
2021-06-28,HappyBirthdayElonMusk Thanks for TSLA Starlink SpaceX and of course paypal,1
2021-06-28,TSLA Monday morning after all those china recall news Tsla,1
2021-06-28,Tesla TSLA keeps momentum as it shrugs off recall news from China Tesla TSLA China,1
2021-06-28,Mainstream media this morning as they realise Tesla fixed the China software issue OTA before they had a chance to manipulate the market with their Monday morning headlines TSLA,95
2021-06-28,NIO Hit 49 BOOM Like I said a higher move was coming New high since Feb 2021 stocks ev ElectricVehicle tsla elon green energy,1
2021-06-28,Tesla plots 20k 250 mile EV hatch to rival VW ID 3 Tesla TSLA,5
2021-06-28,Strong breakout in 60 volume The great stocks don t make it easy to get in They break out fast and hard Next stop 700 Careful selling those covered calls this week ladies TSLA,0
2021-06-28,Investment is game of patience TSLA TSLA,0
2021-06-28,Musk s gift on his birthday TSLA TSLA,0
2021-06-28,TSLA intra day chart Nice continuation above the gap it created last week We added at the open around 672 for a 20 points move so far The puts we sold on Friday working as we were synthetically long Trim some and hold some,1
2021-06-28,The FUD did not work doge tsla,0
2021-06-29,The fastest car in the world TSLA,0
2021-06-29,TSLA TSLA looking good finally trading above demand Gain 742 I m more interested Like Jan 15 730c around 95 but there will be scalps to be had here for cheaper if this trends,3
2021-06-29,TSLA Short Day Trade Plan TSLA DayTrading,1
2021-06-29,Companies making Autonomous Driving happen APTIV GOOGL GM TSLA,0
2021-06-29,I find it important to interact with the tsla cult as it reminds me of how delusional they are I would love to study some of them under DTI MRI as I m certain there s a pathology,1
2021-06-29,Tesla Model 3 with pure vision Autopilot gains IIHS Top Safety Pick rating Tesla TSLA,1
2021-06-29,How I went from 650 to OVER 700 followers in less than 2 years tsla tslaq A thread 1 42,1
2021-06-29,TSLA made a revolution in recalling cars So simple to recall 238k Tesla Thanks ElonMusk for making our life easier and safer,0
2021-06-29,BUY TSLA Stock NOW TSLA,4
2021-06-29,TSLA 1H As red A B C correction is currently complete and the impulsive waves 1 and 2 in blue has been formed wave 3 in black is forming with target of major level 800 Next major ones to watch out are 900 and 1000,0
2021-06-29,TSLA Short Took a small size and closed it for a small loss Not liking to short TSLA P L 70 TSLA,1
2021-06-29,First Tesla leggo TSLA tsla,0
2021-06-29,US regulators issued an order requiring automakers of vehicles equipped with advanced driver assistance to immediately report crashes The new order comes amid increased scrutiny especially Tesla Inc s Autopilot system tslaq tsla,8
2021-06-29,NIO Weekly chart looking very nice Broke out of resistance and tapped the 50s once again Expect a steady move higher tsla elon ev ElectricVehicle green energy stocks,1
2021-06-29,Tesla pure vision Autopilot to increase maximum speed to 80 mph Tesla TSLA,2
2021-06-29,STOCK UPDATE tsla recalls stonk price to 900,1
2021-06-29,Moore distinguishes between different kinds of data buffers which is a point never made when Elon Musk or other TSLA representatives discuss the billions of miles recorded,0
2021-06-29,Millions of autonomous miles of CAN bus data TSLA,1
2021-06-29,TSLA update,0
2021-06-29,Apple stores love HEX HEX BTC ETH BNB tron Doge Tsla xrp ada dot link airdrop nft money business entrepreneur pulse pulsechain,9
2021-06-29,NIO Nice continuation and close from its recent breakout 60s incoming soon StocksToWatch ev tsla tesla ElectricVehicle green energy,1
2021-06-30,RBC expects Tesla to post record 195k deliveries for Q2 says 200k Street consensus is too high Tesla TSLA,1
2021-06-30,NIO Tapping 51 95 up almost 30 from my buy call 42 Lots more room on the chart here 60s coming ev ElectricVehicle tsla tesla tsla StocksToWatch green energy tech,2
2021-06-30,TSLA TSLA Gap below following breakout Might act as a ZOI or maybe we just forget about it,1
2021-06-30,Tesla is looking to ace all subcategories and individual metrics in IIHS safety tests Tesla TSLA,2
2021-06-30,Fuck a ratio I follow everyone back because I love the crypto community If you re a fan of Doge Ethereum Bitcoin and Ripple follow me dogecoin ETH BTC XRP altcoin cryptoworld shib tsla SAFEMOON,2
2021-06-30,You Tsla Cultists can t handle how bad this GOVERNMENT MANDATED RECALL is So you LIE tslaq,2
2021-06-30,SHOP SHOP AMZN AMZN TSLA TSLA some fade into the close for any puts players to take profits on Trading Optiontrading Optionstrading Stocktrading Gains Calloption Stocks Options Daytrading Tradealerts Stockmarket Invest Investing Successful,1
2021-06-30,Great play for our members at CRSP GME TSLA AMZN SPY QQQ AAPL AMZN,0
2021-06-30,TSLA Watch for a breakout trading StocksToWatch StockMarket investing stocks tesla ElonMusk TSLA stocktrading OptionsTrading,0
2021-06-30,VMC BUSXF VMC V Beauty day and HOD close 8 32 Great volume to add as well bus ElectricVehicle ev tsla tsla tesla nio nio StocksToWatch stocks green energy,1
2021-06-30,VMC BUSXF VMC V There is my breakout hitting 8 28 as a high so far Next stop 10 As stated the chart is bullish and has lot more room to go here ev ElectricVehicle bus tsla tesla green energy StocksToWatch,0
2021-06-30,YouTube YouTuber TSLA Must check out YouTube channel if you are into Tesla Cryptos Investment opportunities amp more,0
2021-06-30,Current Day Trade Positions Took partial profits on TSLA amp SPX 24 on TSLA amp 16 on SPX SPY TSLA DayTrading,2
2021-06-30,TSLA note the gap up,2
2021-06-30,Thank me tomorrow tsla,0
2021-06-30,some of the shortsqueeze stocks being discuses on twitter clov tsla WISH,0
2021-06-30,Small Account Option 2000 TSLA Long 7 2 695 Call at 7 40 Stop below 678 TSLA SmallAccount DayTrading,1
2021-06-30,TSLA 694 and change level to break on TSLA Larger structure s 61 8 extension trading investing stocks StockMarket StocksToWatch tesla TSLA elonmusk,1
2021-06-30,Morgan Stanley acknowledges Tesla s tendency to attract exaggerated media coverage Tesla TSLA MorganStanley,1
2021-06-30,A wise well interesting old man told us this was the meaning of life We thought it was random enough to put on our brewery wall So happy belated birthday perhaps it is the meaning of life You tell us tennis tequilla tsla Tesla,0
2021-06-30,Day 554 of tweeting Elon and Tesla for a free Cybertruck Michael Collins must have been taking a pee when they picked Apollo 11 roles feed Tesla ElonMusk TSLA NASA SpaceX memes memesdaily,2
2021-07-01,What s the best gif you can think of for Tesla ownership I ll start TSLA TSLAQ,0
2021-07-01,VMC BUSXF VMC V Weekly chart is very nice here Recent breakout of resistance 8EMA slowly rising up again with lots of room to go over 10 is coming and then possibly break new hihgs of over 14 bus tsla tesla nio ev ElectricVehicles green energy stocks,4
2021-07-01,Happy to help another TESLA friend replacing a side window The job takes 30 minutes but it took us another hour talking about TSLA stock and its future What an incredible impacts ElonMusk has on everyone So proud 2b part of it,0
2021-07-01,FB Zuckerberg continuing to sell TSLA on resistance,0
2021-07-01,If you had invested 1 000 into Tesla s TSLA IPO on June 29th 2010 and held to today you d currently have 200 000 btc bnb aci bitcoin crypto investing stockmarketnews investments StockMarket,1
2021-07-01,Brand new Tesla Model S Plaid caught on fire in strange circumstances by,46
2021-07-01,Baby Doge doo doo doo doo doo Baby Doge doo doo doo doo doo Baby Doge doo doo doo doo doo Baby Doge,47361
2021-07-01,Elon Musk during the Q1 call tslaq tsla,3
2021-07-01,WE ARE METTA APES SPREAD THE WORD SS IF U WANT IDC mmat trch mmatf TSLA elon BillGates BillCosby,2
2021-07-01,Nasdaq ARVL get in while it s cheap ARVL arrival ups wkhs nio tsla elon stocks optionstrading amc gme wish tsm nvda amd boeing uber daytrading Robinhood tiktok ipo msft ev idex bus company stonks btc eth etc,1
2021-07-01,Nice day scalping NVDA BA TSLA,0
2021-07-01,Tesla Growth 2020 Q2 Deliveries 90 650 2021 Q2 Delivery Estimates 190 000 109 YOY increase 195 000 115 YOY increase 200 000 120 YOY increase 205 000 126 YOY increase Doesn t matter which way you cut it amazing YOY growth increase TSLA TSLA,38
2021-07-01,Grave Jolie tesla tsla,0
2021-07-01,ElonMusk s TESLA Ponzi Scheme Sees Its NEWEST Model TSLA Plaid Model S One Of Only 250 shipped Below spontaneously combust NO FIRE DEPT Is Equipped To Extinguish A Tesla Chemical Fire Does The NTSB Have Any Regulators Are They On St Elon s Payroll corruption,30
2021-07-01,Thanks again BIG BRO ketikoti FreeBritney COVID19 julywish DINU shibainu SHIB elonmusk Bitcoin NFTs ethereum TSLA hex dextools coinbase metamask twitch pulsechain dogecoin apple SHIB DINU,12
2021-07-01,I m so excited for the demand cliff I think it will hit this quarter tsla tslaq Counting cars WILL pay off,3
2021-07-01,Almost 10 point move out of demand on TSLA demand scalp,1
2021-07-01,It s official Tesla is now legal tsla Tesla,0
2021-07-01,ndx history to repeat again spx dxy trading investing money dollar stock equity tsla appl google facebook,0
2021-07-01,The Tesla Model S Plaid s most shocking upgrade is being hidden in plain sight Tesla TSLA,1
2021-07-01,Praying for Tesla s success tomorrow TSLA TSLA,2
2021-07-01,TSLA today s trend,0
2021-07-01,Just got done counting cars in a tsla lot Atrocious miss on deliveries incoming tslaq,3
2021-07-02,TSLA TSLA Got a glimpse of 700 for a second Welcome back Team Tesla,0
2021-07-02,Happy Friday time for witching hour TSLA I hope this week ends better than last week did,0
2021-07-02,TSLA hourly view 684 is the,0
2021-07-02,I ve noticed the Tesla pumpers on Twitter like Ray4Tesla have separately referral sites and if you click through you get Tesla perks like 1 000 free Supercharger miles Do any of these referral schemes appear on Tesla s financials tslaq TSLA,2
2021-07-02,Tesla delivers more than 200 000 vehicles in a quarter for the first time Tesla TSLA,1
2021-07-02,Friendly reminder WE ARE IN A BULL MARKET btc is mid and macro BULLISH AF Make sure you are net long and exposed You will probably never have another opportunity so blatantly obvious within your lifespan,25
2021-07-02,I have been counting cars for years tsla is lying tslaq,5
2021-07-02,T 0 Clear for takeoff Launch Tsla should move higher today and next week TSLA,1
2021-07-02,VMC BUSXF VMC V 9 57 My weekly target for 10 is almost near This chart is just sexy Look at that candle Boom bus ev ElectricVehicles tsla tsla tesla StocksToWatch tech,2
2021-07-02,Got a feeling that this RSI plot might play out for BTC btc Crypto cryptocurrencies ETH ADA dogearmy Altcoins BabyDoge NFT FTM LTC ETC HBAR tron Binance WazirX ripple xrp cryptoindia MATIC SOL VET 100xCoin 1inch USDC tether DXY TSLA ALGO,0
