Date,full_text,retweet_count
2013-05-15,I told y all to buy that Tesla stock 2 years ago when it was like 25 a share Haha,0
2018-06-16,Amazing work by Tesla team Built entire new general assembly line in 3 weeks w minimal resources Love u guys so much Pic of 1st Model 3 dual motor performance coming off the line,4053
2018-07-15,I have two big bets right now Bitcoin and Tesla Both will succeed in the long run making it considerable more tasty and profitable to go against all the short sellers and daily naysayers Don t bet against Satoshi and Musk if you value your sound money See ya in 2025,0
2018-10-04,Hang in there If you are truly long term it will be fine,357
2019-12-28,What s the huge advantage of driving a car Having the freedom of going anywhere and stopping wherever you want on the way I didn t buy a for city driving I bought it exclusively for RoadTripping because it s an EV ClimateCrisis,15
2020-02-04,No I ll just take my 1 million gain except will be over 3000 a share by the end of the year And remember who told you,1
2020-05-10,F ck Elon Musk,15002
2020-05-30,By spring of 2021 there will be an unprecedented short squeeze and rise in stock There will be virtually no shares available to buy,112
2020-07-23,3 000,0
2020-10-09,When you were spending a significant amount of time jumping up and down on about how good Pointerra was as a long term investment well over a year ago Gift wrapped SaaS 3DP ASX GEOINT AWS CloudComputing GrowthStock GeoSpatial Analytics BigData,5
2020-11-28,Uber redesigned this truck with more appealing look Analytics AI Rstats Reactjs IoT IIoT DataScience BigData Linux Serverless DEVCommunity flutter Coding SelfDrivingCars EV AutonomousVehicles SmartCity MachineLearning 100DaysOfCode,118
2020-11-30,There it is 600 TSLA,1
2020-11-30,It s beyond time for TSLA to announce a secondary They would be fools not to TSLA,1
2020-11-30,One of my favorite reasons for having it all in TSLA is coordinated complexity Really try to spend time thinking about this You can t even see it coming,1
2020-11-30,Knowing that NIO holds strong a 50 support should be a great sense of relief and reassurance that your investment is secure Most of EV sector is down today 7 20 but not NIO They have such a strong growth potential This is no joke We ve only just begun TSLA TSLA,1
2020-11-30,Compare NIO only with TSLA NOT those nonsense startups Another big week is ahead of us Always LONG and STRONG NIO TSLA EV revolution is happening,1
2020-11-30,WTF does this got to do with NIO More FUD Stocks stockmarket TSLA of China Biden,4
2020-11-30,TSLA kissed 554 51 See Power of BOXCHART,0
2020-11-30,TSLA has been nothing short of amazing this year Goes to show what a visionary leading your company can do,0
2020-11-30,TSLA TSLA over 600 Next upside target 644 31 IMO,1
2020-11-30,TSLA TSLA Levels of interest below if this continues to move down hard Using the anchored VWAP and anchored VBP Watch below just created this video,3
2020-11-30,Tesla may do a Model Y Christmas sale as soon as tomorrow Cyber Monday 1 Model Y tracker is now showing approximately 85 all time fill rates of VINs 2 VIN count has increased less than 24k over 2 months period 3 Days from order to VIN have been decreasing TSLA TSLAQ,1
2020-11-30,Tsla tomorrow close 615 TSLA the hurdle is 608 area,1
2020-11-30,Otto competing with tsla in the self driving truck market,6
2020-11-30,Tesla TSLA TSLA has priced to 3 000 600 factoring in the 5 to 1 stock split made the post before the split,0
2020-11-30,The future is extremely bright for a sustainable world Go TSLA Go,2
2020-11-30,Looks like we have our answer tsla tsla,1
2020-11-30,Good morning pre Marketers tsla,0
2020-11-30,Success from shawn in Discord TSLA TSLA,0
2020-11-30,Would something like this shock people Guess we ll wait to see next month which is only hours away nio tsla nio tsla nioq tslaq nioq niogang tslaq,2
2020-11-30,TSLA If not crosses today s high and stays below 595 for 20 30 minutes We see PANIC upto 555 542,0
2020-11-30,According to my technical analysts NIO is set to break 57 by Wednesday Just look at my chart pattern It very clear 57 63 by Friday nio tsla nio tsla nioq tslaq nioq niogang tslaq,5
2020-11-30,TSLA 172 points triangle breakout at 437 level Target was 609 Now kissed high of 607 80 More to our Members,0
2020-12-01,Looking back the biggest regret of this year is not investing in Tesla Should ve trusted my gut feeling TSLA,0
2020-12-01,My current positions spy spy aapl aapl fb fb amzn amzn tsla tsla,0
2020-12-01,TSLA TSLA Tesla to top 600 comfortably by weeks end,0
2020-12-01,Idk if you re the right fang06 from but thanks I really like your dildo video too Sexy nio tsla nio tsla nioq tslaq nioq niogang tslaq,1
2020-12-01,Good times Bounce off that 24 Do the Donald nio tsla nio tsla nioq tslaq nioq niogang tslaq,0
2020-12-01,Goldman Sachs NIO Upgrade stocks StockMarket stockstowatch niogang TSLA Of China,4
2020-12-01,Hey I think this guy really needs your help tsla,0
2020-12-01,TSLA P E almost 1200 means U are ok to pay 1200 to get 1 in return Good Bless the bubble in INR u are ok to pay 90 000 rs to get 74 rs returns thats 0 0008 returns Tesla,0
2020-12-01,Foretelling the future is the greatest superpower Tesla 3000 600 post 5 way split in 2020 More to come TSLA,2
2020-12-01,Tesla and Nio both up 4 5 Premarket Bitcoin holding above 19 000 Nio announced 5291 deliveries in November tsla Tsla Nio Nio Bitcoin,0
2020-12-01,Another great day here at BullTrades See you tomorrow TSLA FB AAPL TLRY NFLX PLTR,1
2020-12-01,Nasdaq 100 Index Update Charts are released earlier in our Discord group joinus Please like and share if you appreciate this Elliottwave update NDX SPX MSFT APPL AMZN GOOG GOOGL FB INTC NVDA CSCO ADBE NFLX PEP CMCSA PYPL TSLA COST AMGN TMUS AVGO TXN,0
2020-12-01,When stocks dip buy more dumbass TSLA,0
2020-12-01,TSLA TSLA Retest of the broadening formation resistance,5
2020-12-01,The search for next TSLA TSLA continues NKLA NKLA was supposed to be that but that has since fizzled Question remains who will be the next NKLA Who will out Trevor Trevor,0
2020-12-01,My friend and I riding TSLA long TESLA,0
2020-12-01,Exclusive images of TSLA entering the S amp P500,0
2020-12-01,Made my day but still long way to negotiate with HOA and condo management team to install wall connector TSLA,0
2020-12-01,Open at 595 this morning TSLA to the Mars,0
2020-12-01,today was a loss day but it doesn t matter tomorrow and rest of the week I m lining up for good plays gme tsla stocks,0
2020-12-02,My very simple NIO strategy Apply what I have learned from TSLA Long amp Strong x10 NIO amp TSLA are the clear winners of EV revolution and both will continue shaping our future,0
2020-12-02,TSLA TSLA This looks ready to explode tomorrow Looks like the weekly candle like 3 weeks ago with the symmetrical triangle and volume shelf lol This patterns are FRACTAL,16
2020-12-02,TSLA ran into some resistance and could probably use some rest from a monster move TSLA tradingview,0
2020-12-02,NORWAY tsla tslaq,0
2020-12-02,fastest growing company in the world tsla noobs,0
2020-12-02,MOTT S Apple sauce TSLA GM GM TSLA,0
2020-12-02,How many car companies can increase their vehicles performance via over the cloud updates Only NIO amp TSLA Wake up folks Long and Strong EV NIO TSLA,0
2020-12-02,So this was my breakthrough yesterday don t tell anyone It s been an expensive year Fuck 2020 by Ana Couper For sale all intellectual rights included 20 bitcoin or equal tsla or offer,0
2020-12-02,TSLA Our Targets were 555 542 see it kissed low of Now Below 542 if breaks closes below PANIC upto 502 489 will start,0
2020-12-02,Been working on an off road camper design for the Cybertruck Would love your feedback tsla tsla cybertruck offroad camper tesla,1
2020-12-02,Can we consider TSLA here a Diamond Top Chart based Topping pattern TSLA It is weak pre mkt Can bounce at open but probably gets rejected for another leg down,2
2020-12-02,TSLA got in this call will hold till expiration date or 700 which ever is first,0
2020-12-02,I made a Supercharger song Please dont sue me tesla supercharger tsla Abba,1
2020-12-02,S amp P 500 Index Update Charts are released earlier in our Discord group joinus Please like and share if you appreciate this Elliottwave update NDX SPX MSFT APPL AMZN GOOG GOOGL FB AMD NVDA SMH XLK JPM M PG UNH INTC VZ MA PFE MRK BAC DIS NFLX TSLA,0
2020-12-02,Fuck 2020 by couper art painting bitcoin tsla xau Triptych 49 5 x 3,1
2020-12-02,tsla falls 30 bucks in 2 days and everybody s like,0
2020-12-02,People still don t understand the difference between traditional car companies and technology companies like NIO amp TSLA That s why the Car company market value discussions around NIO amp TSLA are practically all useless,0
2020-12-02,TSLA Price Levels Nice bounce from 540 80 TSLA,0
2020-12-02,TSLA TSLA This looks ready to explode tomorrow Looks like the weekly candle like 3 weeks ago with the symmetrical triangle and volume shelf lol This patterns are FRACTAL,16
2020-12-02,TSLA needs to save money Elon Musk s email to Tesla s employees,0
2020-12-02,Tesla is now worth the combined value of Toyota Daimler Honda GM Hyundai Ford and VW group TSLA,1
2020-12-03,TSLA Long Small size TSLA,0
2020-12-03,Trade Ideas Based on Deep Learning Returns up to 178 14 in 3 Months BLNK DPW HEXO KIRK NLS NVAX PEIX TSLA WKHS tradeideas aggressivestocks bullishstocks marketopportunity algotrading stockstobuy marketforecast NYSE stockpredictions ai,1
2020-12-03,Uh Well then Apparently it increases range not sure on the look though Thoughts TSLA Tesla teslaq teslaquila teslamodel3 TeslaModelY tsla FSDBeta FSD autonomousdriving AutonomousVehicles tesla,1
2020-12-03,Them late night Facebook post TSLA,0
2020-12-03,Was a day late o well TSLA TSLA,0
2020-12-03,Busy day with couple of appointments TSLA Didn t close the trade Holding small piece for tomorrow 325 on TSLA Long amp 242 on NIO Short Expecting a gap above 600 tomorrow Risky to hold weekly options only one day left Big loss if it gaps down TSLA DayTrading,0
2020-12-03,This is ROKU TSLA Now,0
2020-12-03,TSLA I will book partial profit today at 592 75,0
2020-12-03,I m selling my NIO shares and I m going to buy a golden dildo and upload a review video of how I used it nio tsla nio tsla nioq tslaq nioq niogang tslaq,0
2020-12-03,Good EV news out of Japan tsla,0
2020-12-03,Ask the magic 8ball bitcoin StockMarket finance Memes stonks PLTR TSLA BTC,0
2020-12-03,TSLA TSLA Key Support amp Resistance Levels,0
2020-12-03,U S Futures flat Watch TSLA MMM XPO CRWD PVH,5
2020-12-03,If you re trading on RobinHood amp tired of missing out on the dips come to Webull where you can trade 4am Here s 2 FREE stocks to get you started SNDL PIC TSLA Bitcoin,2
2020-12-03,Another great day here at BullTrades See you tomorrow TSLA MRNA PFE SHOP BA,1
2020-12-03,TSLA Took out the majority size here for a nice profit Added size on the dip Looking to close if it doesn t break 600 in the next 15 mins TW0E DayTrading Alerts TSLA,0
2020-12-03,Aloha Traders Updated Elliottwave counts on our Discord platform BTC ETH SPX NDX WTI oil Gold GLD XAU JNJ EBAY Sideways formations in big cap stocks Some have broken out AAPL below AMD TSLA Will silent MSFT or AMZN trigger the breakout in indices,0
2020-12-03,Market makers manipulating TSLA long,0
2020-12-03,Uh oh TESLA TSLA TSLA Big Short investor Michael Burry reveals he s short Tesla tells Elon Musk to issue more stock at its ridiculous price,0
2020-12-03,TSLA Goldman increases PT to 780 TSLA Bullish Stonks blingbling holdat,0
2020-12-04,TSLA getting ready to bust through 600 next week Elon EV TSLA,1
2020-12-04,TSLA beautiful contraction on hourly with decreasing volume Possible bigger move coming up soon TSLA,0
2020-12-04,TSLA BOY 600 a share Yeee budddyyy,0
2020-12-04,The best investors I know NEVER admit when they are wrong about a company They only admit the stock price has become MORE wrong tsla tslaq,3
2020-12-04,Notice how every car manufacturer is making a point to catch Tesla or compete with Tesla That should tell you something about the future tsla tsla tesla,1
2020-12-04,We could ve helped the airlines if ELON wasn t so EVIL tsla tslaq,0
2020-12-04,When you make the perfect trade spy spy amzn AMZN aapl aapl tsla tsla,0
2020-12-04,TSLA weekly chart final target of the weekly reversal has been reached The speculation can continue because there is no limit to human s greed but it becomes very very dangerous to remain long A short without leverage is the optimal choice for me,1
2020-12-04,Twitter is one of the great place Share info and mind discuss own style But some shit guy they talk some suspicious things That s very annoying I want capture them and chop up and feed to pig who try stile my time and money BTC Crypto SPX TSLA investing,0
2020-12-04,TSLA high today,1
2020-12-04,NIO playing with support around 44 30 Will be looking for bounce or breakdown and keeping a close eye on option flow SPY StockMarket EVs TSLA Trader TechnicalAnalysis OptionsTrading,0
2020-12-04,Episode 10 of Donald and Dave out now TSLA LMND FXPO DOCU MCRO AMD SE market wizards at your usual source or from buzz sprout,1
2020-12-04,Utilizing an experienced helpful customer relations staff we at Tradeview pride ourselves on providing the best possible client support and service stocks futures options tvmarkets Amex NASDAQ NYSE StarlingTrader MT5 Metatrader5 RhinoTrader Equity TSLA,1
2020-12-04,With Tesla s upcoming inclusion in to the S amp P 500 index 82 of US managers do not own a position equities mutualfunds portfoliomanagement activemanagement tsla tesla SPX SP500,2
2020-12-05,StockMarket TSLA trading pacb I think i found something I m good at,0
2020-12-05,TSLA Tequila on the way tsla teslatequila,0
2020-12-06,New Video My Review of FSD Beta is Delayed But Still Funny Clips lol tesla tsla fsdbeta,0
2020-12-06,Options can be beautifully rewarding All It takes courage and clarity of concept TSLA OptionsTrading PS It s not my position But I hope should have been such,0
2020-12-06,You know what s better than driving your awesome Tesla Not driving your awesome Tesla If you know You know Level 5 Autonomy Coming 2021 TESLA FSDBeta TSLA,0
2020-12-06,Can we get sentry mode with external speakers If so I have a music suggestion Tesla sentrymode tsla model3 teslamodel3,6
2020-12-07,Anyone who shorted Tesla TSLA,2
2020-12-07,Rams Defensive coordinator Brandon Staley s NFL stock is valued HIGHER than TSLA in the NASDAQ,1
2020-12-07,TKSI USA reverse merger ticker TKSI the product is on sell in 500 store BYND SPAQ wallstreet investing TSLA BTC Japanese StockTwits fintok SPY SPX FSR PLTR TSLA,5
2020-12-07,TSLA TSLA Runner going,2
2020-12-07,TSLA TSLA Well we got the explosion,0
2020-12-07,TSLA was at 403 when I tweeted this Stock is now over 627 If you missed out I feel bad for you,0
2020-12-07,CANCEL THE MARKET TSLA TSLAQ TESLAQUALITYISSUES,0
2020-12-07,Still not selling TSLA You can call me crazy just like you did months ago daytrading TSLA BBTfamily,0
2020-12-07,Checking AAPL and TSLA everyday like,0
2020-12-07,Only seems right in 2020 TSLA,0
2020-12-07,Tsla tsla price target for Monday is 644 looking for it to break the 52 week high,0
2020-12-07,TSLA Eyes on 631 642 Will short with stop of 642,0
2020-12-07,,1
2020-12-07,Are you worried TSLA is up 880 YTD,3
2020-12-07,TSLA is up today and I get to enjoy a new software update teslastock Updates TSLA,1
2020-12-07,What a perfect day for these to show up TSLA Tesla,0
2020-12-07,nice day thanks to PLTR TSLA city adaptiveanalytics,1
2020-12-07,I have to keep my Word When would be the new promise 750 800 tsla,2
2020-12-07,TSLA TSLA The 2 618 extension is around 780,6
2020-12-07,TSLA is over 650 this year,1
2020-12-07,TSLA All time high,0
2020-12-07,Yawn No big deal or anything tsla,0
2020-12-08,TSLA chasing the dragon triangle thrusts from the 4th wave position are ending waves,4
2020-12-08,Success from Professor DO NOT DM in Discord PFE PFE TSLA TSLA,0
2020-12-08,Has there ever been such a large company doing an equity raise like this TSLA smart move,1
2020-12-08,TSLA I ve been waiting for this moment since September 17th The time has come Finally hitting my PT of 650 Had multiple 1000 plays AMZN AAPL BA BABA FB TSLA MSFT ROKU NKLA SPX SPY TDOC COST ZM NVDA BYND SNAP TGT,0
2020-12-08,Green Metallic Model S spotted today means that tsla will close green,0
2020-12-08,I don t respect a lot of financial analysts Nice title but over 90 of you all got Tesla stock wrong tsla,0
2020-12-08,Short sellers won t benefit TSLA,0
2020-12-08,Success from Peter the Great in Discord TSLA TSLA,1
2020-12-08,TSLA 2020 has been brutal for the Tesla bears Stocks,0
2020-12-08,Have a great night all Another successful day in the books SPY PLTR FSLY TSLA PENN,2
2020-12-08,TSLA Nice run 624 40 after LOD test I was watching it but didn t take entry Missing many day trade setups today TSLA,0
2020-12-08,Six hunnit fiddy tsla sixhunnitfiddy stonks,1
2020-12-08,Made 428 today with tsla Something better than nothing,0
2020-12-08,Did we mention TSLA,1
2020-12-08,If you had asked me in 2019 not sure I would have expected the past year to turn out this way TSLA 830 vs BTC 182 This was the Year of Elon Now we re heading to the Year of Satoshi My bags still sponsored by people bashing both Elon and Satoshi Don t short em,1
2020-12-08,Me waking to the family gathering after they called me crazy for buying BTC and TSLA in 2017,0
2020-12-08,tsla dilution is taking a tip without Shareholder consensus tesla boys will be so happy,0
2020-12-08,TSLA NEW ATH,0
2020-12-08,A majority of people I talk to about Tesla still scoff and giggle about getting rid of their gasoline vehicle This is still the beginning tsla,0
2020-12-08,Wow I couldn t have timed this Tesla option sell any better Took profits and the next day comes a huge dip Lol will definitely be buying back in on the dip for a second run tsla Can t lie I was nervous since I had the exp for after the dec 21 inclusion,0
2020-12-09,TSLA TSLA Auto trends does it again Watch below,2
2020-12-09,Group 1 2 amp 3 Daily Live Trading Rooms and ElliottWave Analysis Session video recordings are available for members viewing SPY AAPL FB AMZN GOOGL TSLA YM F USDX EURUSD USDJPY CL F ES F NQ F BTC,0
2020-12-09,New swings Bull put credit spreads 2 weeks Exp TSLA amp SPX SPX TSLA,0
2020-12-09,ES Is it a good idea to allow TSLA into the S amp P 500,1
2020-12-09,How about investing it all now in TSLA LIKE NOW ASAP,0
2020-12-09,Its meme time lol Tesla TSLA,0
2020-12-09,TSLA found buyers in blue box and rallied strongly 11 17 2020 1 Hour chart showed reaction higher which took place from the blue box Elliottwave TSLA Stocks trading,0
2020-12-09,People don t realize the potential and business model of NIO which is different than TSLA But it s growth will be just like TSLA Long amp Strong,0
2020-12-09,Winning streak DAY 60 Ok so that s three months now Literally the pressure is so great now 389 profit and I bailed before the crash This is the 6700 to 1 000 000 or bust challenge Come for the trades stay for the memes and transparency ES F NQ F SPY QQQ TSLA,0
2020-12-09,TCL Public Announcements 09 12 20 17 12 Forwarded from VIP Scott s Feed tsla nice rejection,0
2020-12-09,nice manipulation you wont get my shares though TSLA,0
2020-12-09,Swing Update Closed ZM for a loss Closed last pieces on FSLY amp TWLO for small profits NIO got triggered Looking to add SPX 3675 3680 amp TSLA 596 600 bull put credit spreads 2 weeks exp TW0E SwingTrading,0
2020-12-09,Trend line Support Price Level Support Good High probability Entry TSLA,0
2020-12-09,Tesla TSLA NASDAQ100 NASDAQ Tesla New high,0
2020-12-09,In another 50 on the open tsla tsla,0
2020-12-09,Holy cow just added 200 shares at 600 tsla tesla,1
2020-12-09,New swings Bull put credit spreads 2 weeks Exp TSLA amp SPX SPX TSLA,0
2020-12-09,TSLA TSLA Not shocking this had trouble here Confluence of long term resistance hit over the last 3 days,5
2020-12-09,Really seems that TSLA TSLA is the risk on vs risk off indicator in the market right now SPY QQQ IWM,2
2020-12-09,TSLA Possible bounce if markets turn from here I am just watching it amp waiting for the entry TSLA,0
2020-12-09,Who s in first place for the worst TSLA analyst It s a close race to the bottom,10
2020-12-09,New York s pension fund an influential investor will drop most fossil fuel stocks in the next five years and sell its shares in other companies that contribute to global warming by 2040,167
2020-12-10,Swing Update TSLA BPCS Looking to take partial profit above 624 Entered yesterday SPX I am looking to take a partial profit above 368 SPX TSLA SwingTrading Alerts,0
2020-12-10,My favorite strategy Gap TW0E Number TSLA All out Big win in 25 mins Took out the last piece at 600 from entry at 568 12 P L 2096 One good trade per day is enough TSLA DayTrading TW0E,0
2020-12-10,Tesla shares will go up regardless TSLA,0
2020-12-10,TSLA TSLA Nice gap fill this morning This is where the gap snake comes in Watch below,4
2020-12-10,The fact is NIO is currently the 2nd largest EV company in the World behind TSLA I ve owned both companies for a majority of 2020 and don t plan on selling anytime soon We have only just begun GLTA,4
2020-12-10,Said what the heck and added 42 more TSLA shares right before the close 591,0
2020-12-10,We sold 700c s for Friday in da Room TSLA chart,1
2020-12-10,TSLA is the missing piece TSLA,0
2020-12-10,Bunch of Robinhood ers fixing to Uber in some TSLA to their favorite abnb spot and order in some dash and,1
2020-12-10,TOYOTA MOTORS HAS DEVELOPED A EV BATTERY THAT CAN FULLY CHARGE IN 10 MINS AND GO 300 MILES ON A SINGLE CHARGE NIKKEI,404
2020-12-10,Since March 19th average pull back approximately 16 great opportunity for a buy coming up TSLA,0
2020-12-10,TSLA TSLA trades for the day All Long Entries DONE,1
2020-12-10,I wonder what price the TSLA equity raise was at,0
2020-12-10,TSLA TSLA Mini Bull Flag here watch for that 620 to be taken out volume seems good here OK promise last trade,0
2020-12-10,SIRC sales projected to reach 38 5 Million in FY 2022 90 Million in FY 2023 at substantial positive profit in both years 0 25 price target set for 3 6 months Goldman Small Cap Research stocks stockmarket solar SEDG SPWR TSLA,5
2020-12-10,Tesla Elliott Wave Analysis Charts are released earlier in our Discord group joinus Please like and share if you appreciate this Elliottwave update NDX SPX MSFT APPL AMZN GOOG GOOGL FB AMD NVDA SMH XLK JPM M PG UNH INTC VZ MA PFE MRK BAC DIS TSLA,1
2020-12-10,Experienced TSLA shareholders be like,1
2020-12-10,Best stocks to buy pltr tsla,0
2020-12-10,200 shares day traded TSLA TSLA,0
2020-12-10,Quick win TSLA Still holding more TSLA,0
2020-12-10,Showing just how popular trading has become TSLA stock is the 8th most searched on google this year,2
2020-12-10,Yup 2nd only to TSLA don t let NIO get dragged down by sector stocks,2
2020-12-10,TSLA TW0E Number 368 12 Took out the majority size above 584 I was 2 min late to post this level Big win in 3 mins from TW0E number TSLA DayTrading Alerts,0
2020-12-11,Oh no jeff doesn t believe lol tsla,0
2020-12-11,SPY Back above 364 Still holding a long position SPY,0
2020-12-11,TESLA Elliott Wave Analysis Charts are released earlier in our Discord group joinus Please like and share if you appreciate this Elliottwave update NDX SPX MSFT APPL AMZN GOOG GOOGL FB AMD NVDA SMH XLK JPM M PG UNH INTC VZ MA PFE MRK BAC DIS TSLA,1
2020-12-11,TSLA get ready for another round of short squeeze next week 18 is still a lot OptionsTrading Options TSLA,1
2020-12-11,TECHNOLOGY Toyota to introduce electric vehicle battery that can power a 500 km trip on one charge and can recharge from 0 to 100 in just ten minutes,4462
2020-12-11,One of my clients said what bright spark decided to add TSLA to the S amp P at the most illiquid time of the year I m buying vol into that event He might be right with the daily chart hitting trend resistance and what might be a perfect indecision doji on the weekly,4
2020-12-11,ASTI will be big tsla tsla solarenergy,0
2020-12-11,Biggest disruption in EV segment TSLA Tesla VW Honda Toyota Hyundai Maruti,0
2020-12-11,All out Green Friday 3 Trades 2 Wins 1 Small Loss Traded MRNA SPX amp TSLA P L 2697 Two 0DTE credit spreads worked very well on TSLA amp SPX TW0E DayTrading TSLA SPX,0
2020-12-11,We need to tell SPACEX this test was a FAILURE They still think it was a success tsla tslaq,0
2020-12-11,SPY Long As I mentioned pre market it s a tricky day Took a loss on the first trade Then got back in again at the bottom Taking the majority size here for a nice profit Not interested in short the market today as already mentioned Same happened for TSLA SPY TSLA,0
2020-12-11,TSLA scalp entry,0
2020-12-11,Not much time left stocks cypto stockmarket tsla spy trump wallstreet dow,1
2020-12-11,ASTI Stock Price Increases 100 This Past Week Why It Happened,0
2020-12-11,We need to educate spacex rocket scientists testing does NOT include failure DATA IS NOT IMPORTANT I will NOT be able to SLEEP TONIGHT tsla tslaq,1
2020-12-11,URGENT IS TSLA TESLA STOCK GOING TO BREAK IT S ALL TIME HIGH TODAY WATCH NOW sp500 stockstowatch stocks investing StockMarket tesla TSLA TeslaSouffle stocks investing trading daytrading Apple tesla nio,3
2020-12-12,UGH now we have to educate BUZZ how can he be so ignorant on this We can do this tslaq who s with me spacex tsla,1
2020-12-12,tsla tesla ElonMusk my dog loves it as well,1
2020-12-12,tesla tsla just love my new Y,0
2020-12-12,Swing Update SPX BPCS Closes for a small loss 40 NIO Got stopped out for 454 TSLA Partial profit for 360 Holding BABA BLNK amp DKNG TW0E SwingTrading TSLA NIO SPX,0
2020-12-12,For all the TSLA lovers here TSLA valuation over the last 4 years,2
